[32m[I 2022-12-30 07:49:41,051][0m Trial 591 finished with value: 0.3221883978483273 and parameters: {'hidden_size': 512, 'activation1': 'tanh', 'activation2': 'tanh', 'dropout': 0.1, 'lr': 0.001, 'weight_decay': 3e-05, 'opt': 'RMSprop'}. Best is trial 323 with value: 0.32512486453416034.[0m
[32m[I 2022-12-30 07:49:50,510][0m Trial 592 finished with value: 0.3215762653178033 and parameters: {'hidden_size': 512, 'activation1': 'tanh', 'activation2': 'tanh', 'dropout': 0.1, 'lr': 0.01, 'weight_decay': 3e-05, 'opt': 'Adam'}. Best is trial 323 with value: 0.32512486453416034.[0m
[32m[I 2022-12-30 07:49:58,847][0m Trial 593 finished with value: 0.3113806444895645 and parameters: {'hidden_size': 512, 'activation1': 'relu', 'activation2': 'tanh', 'dropout': 0.1, 'lr': 0.001, 'weight_decay': 3e-05, 'opt': 'RMSprop'}. Best is trial 323 with value: 0.32512486453416034.[0m
[32m[I 2022-12-30 07:50:07,150][0m Trial 594 finished with value: 0.32161944690066424 and parameters: {'hidden_size': 512, 'activation1': 'tanh', 'activation2': 'tanh', 'dropout': 0.1, 'lr': 0.001, 'weight_decay': 3e-05, 'opt': 'RMSprop'}. Best is trial 323 with value: 0.32512486453416034.[0m
[32m[I 2022-12-30 07:50:15,528][0m Trial 595 finished with value: 0.32100528030784936 and parameters: {'hidden_size': 512, 'activation1': 'tanh', 'activation2': 'tanh', 'dropout': 0.1, 'lr': 0.001, 'weight_decay': 3e-05, 'opt': 'RMSprop'}. Best is trial 323 with value: 0.32512486453416034.[0m
[32m[I 2022-12-30 07:50:23,966][0m Trial 596 finished with value: 0.2532099279883446 and parameters: {'hidden_size': 512, 'activation1': 'tanh', 'activation2': 'sigmoid', 'dropout': 0.1, 'lr': 0.001, 'weight_decay': 3e-05, 'opt': 'RMSprop'}. Best is trial 323 with value: 0.32512486453416034.[0m
[32m[I 2022-12-30 07:50:32,321][0m Trial 597 finished with value: 0.3238482430563857 and parameters: {'hidden_size': 512, 'activation1': 'tanh', 'activation2': 'tanh', 'dropout': 0.1, 'lr': 0.001, 'weight_decay': 1e-05, 'opt': 'RMSprop'}. Best is trial 323 with value: 0.32512486453416034.[0m
[32m[I 2022-12-30 07:50:40,567][0m Trial 598 finished with value: 0.32365356980112236 and parameters: {'hidden_size': 512, 'activation1': 'tanh', 'activation2': 'tanh', 'dropout': 0.1, 'lr': 0.001, 'weight_decay': 1e-05, 'opt': 'RMSprop'}. Best is trial 323 with value: 0.32512486453416034.[0m
[32m[I 2022-12-30 07:50:49,009][0m Trial 599 finished with value: 0.29847316924848705 and parameters: {'hidden_size': 512, 'activation1': 'tanh', 'activation2': 'tanh', 'dropout': 0.1, 'lr': 0.003, 'weight_decay': 1e-05, 'opt': 'RMSprop'}. Best is trial 323 with value: 0.32512486453416034.[0m
[32m[I 2022-12-30 07:50:57,532][0m Trial 600 finished with value: 0.32300540250482335 and parameters: {'hidden_size': 512, 'activation1': 'tanh', 'activation2': 'tanh', 'dropout': 0.1, 'lr': 0.001, 'weight_decay': 1e-05, 'opt': 'RMSprop'}. Best is trial 323 with value: 0.32512486453416034.[0m
[32m[I 2022-12-30 07:51:06,016][0m Trial 601 finished with value: 0.3215284203830865 and parameters: {'hidden_size': 512, 'activation1': 'tanh', 'activation2': 'tanh', 'dropout': 0.1, 'lr': 0.001, 'weight_decay': 1e-05, 'opt': 'RMSprop'}. Best is trial 323 with value: 0.32512486453416034.[0m
[32m[I 2022-12-30 07:51:14,294][0m Trial 602 finished with value: 0.32421109123451297 and parameters: {'hidden_size': 512, 'activation1': 'tanh', 'activation2': 'tanh', 'dropout': 0.1, 'lr': 0.001, 'weight_decay': 1e-05, 'opt': 'RMSprop'}. Best is trial 323 with value: 0.32512486453416034.[0m
[32m[I 2022-12-30 07:51:22,538][0m Trial 603 finished with value: 0.3237909117672568 and parameters: {'hidden_size': 512, 'activation1': 'tanh', 'activation2': 'tanh', 'dropout': 0.1, 'lr': 0.001, 'weight_decay': 1e-05, 'opt': 'RMSprop'}. Best is trial 323 with value: 0.32512486453416034.[0m
[32m[I 2022-12-30 07:51:30,862][0m Trial 604 finished with value: 0.3228131966849165 and parameters: {'hidden_size': 512, 'activation1': 'tanh', 'activation2': 'tanh', 'dropout': 0.1, 'lr': 0.001, 'weight_decay': 1e-05, 'opt': 'RMSprop'}. Best is trial 323 with value: 0.32512486453416034.[0m
[32m[I 2022-12-30 07:51:39,239][0m Trial 605 finished with value: 0.32139062852087524 and parameters: {'hidden_size': 512, 'activation1': 'tanh', 'activation2': 'tanh', 'dropout': 0.1, 'lr': 0.001, 'weight_decay': 1e-05, 'opt': 'RMSprop'}. Best is trial 323 with value: 0.32512486453416034.[0m
[32m[I 2022-12-30 07:51:47,888][0m Trial 606 finished with value: 0.30946054990829436 and parameters: {'hidden_size': 512, 'activation1': 'sigmoid', 'activation2': 'tanh', 'dropout': 0.1, 'lr': 0.001, 'weight_decay': 1e-05, 'opt': 'RMSprop'}. Best is trial 323 with value: 0.32512486453416034.[0m
[32m[I 2022-12-30 07:51:56,503][0m Trial 607 finished with value: 0.3227952446503145 and parameters: {'hidden_size': 512, 'activation1': 'tanh', 'activation2': 'tanh', 'dropout': 0.1, 'lr': 0.001, 'weight_decay': 1e-05, 'opt': 'RMSprop'}. Best is trial 323 with value: 0.32512486453416034.[0m
[32m[I 2022-12-30 07:52:05,702][0m Trial 608 finished with value: 0.25325766468668587 and parameters: {'hidden_size': 512, 'activation1': 'tanh', 'activation2': 'relu', 'dropout': 0.1, 'lr': 0.001, 'weight_decay': 1e-05, 'opt': 'RMSprop'}. Best is trial 323 with value: 0.32512486453416034.[0m
[32m[I 2022-12-30 07:52:15,301][0m Trial 609 finished with value: 0.3230880724782813 and parameters: {'hidden_size': 512, 'activation1': 'tanh', 'activation2': 'tanh', 'dropout': 0.1, 'lr': 0.001, 'weight_decay': 1e-05, 'opt': 'RMSprop'}. Best is trial 323 with value: 0.32512486453416034.[0m
[32m[I 2022-12-30 07:52:25,241][0m Trial 610 finished with value: 0.32183044506379654 and parameters: {'hidden_size': 512, 'activation1': 'tanh', 'activation2': 'tanh', 'dropout': 0.1, 'lr': 0.001, 'weight_decay': 1e-05, 'opt': 'RMSprop'}. Best is trial 323 with value: 0.32512486453416034.[0m
[32m[I 2022-12-30 07:52:34,845][0m Trial 611 finished with value: 0.3228383794991022 and parameters: {'hidden_size': 512, 'activation1': 'tanh', 'activation2': 'tanh', 'dropout': 0.1, 'lr': 0.001, 'weight_decay': 1e-05, 'opt': 'RMSprop'}. Best is trial 323 with value: 0.32512486453416034.[0m
[32m[I 2022-12-30 07:52:44,068][0m Trial 612 finished with value: 0.312455128050163 and parameters: {'hidden_size': 128, 'activation1': 'tanh', 'activation2': 'tanh', 'dropout': 0.1, 'lr': 0.001, 'weight_decay': 1e-05, 'opt': 'RMSprop'}. Best is trial 323 with value: 0.32512486453416034.[0m
[32m[I 2022-12-30 07:52:53,507][0m Trial 613 finished with value: 0.3216607676710125 and parameters: {'hidden_size': 512, 'activation1': 'tanh', 'activation2': 'tanh', 'dropout': 0.1, 'lr': 0.001, 'weight_decay': 1e-05, 'opt': 'RMSprop'}. Best is trial 323 with value: 0.32512486453416034.[0m
[32m[I 2022-12-30 07:53:01,887][0m Trial 614 finished with value: 0.29381990075000347 and parameters: {'hidden_size': 256, 'activation1': 'tanh', 'activation2': 'tanh', 'dropout': 0.1, 'lr': 0.001, 'weight_decay': 1e-05, 'opt': 'SGD'}. Best is trial 323 with value: 0.32512486453416034.[0m
[32m[I 2022-12-30 07:53:11,291][0m Trial 615 finished with value: 0.3226221307838725 and parameters: {'hidden_size': 512, 'activation1': 'tanh', 'activation2': 'tanh', 'dropout': 0.1, 'lr': 0.001, 'weight_decay': 1e-05, 'opt': 'RMSprop'}. Best is trial 323 with value: 0.32512486453416034.[0m
[32m[I 2022-12-30 07:53:21,871][0m Trial 616 finished with value: 0.3236757781767664 and parameters: {'hidden_size': 512, 'activation1': 'tanh', 'activation2': 'tanh', 'dropout': 0.1, 'lr': 0.01, 'weight_decay': 1e-05, 'opt': 'Adam'}. Best is trial 323 with value: 0.32512486453416034.[0m
[32m[I 2022-12-30 07:53:32,217][0m Trial 617 finished with value: 0.3232572771848547 and parameters: {'hidden_size': 512, 'activation1': 'tanh', 'activation2': 'tanh', 'dropout': 0.1, 'lr': 0.01, 'weight_decay': 1e-05, 'opt': 'Adam'}. Best is trial 323 with value: 0.32512486453416034.[0m
[32m[I 2022-12-30 07:53:42,660][0m Trial 618 finished with value: 0.2827952329459215 and parameters: {'hidden_size': 512, 'activation1': 'relu', 'activation2': 'tanh', 'dropout': 0.1, 'lr': 0.01, 'weight_decay': 1e-05, 'opt': 'Adam'}. Best is trial 323 with value: 0.32512486453416034.[0m
[32m[I 2022-12-30 07:53:52,124][0m Trial 619 finished with value: 0.2845237357697049 and parameters: {'hidden_size': 512, 'activation1': 'tanh', 'activation2': 'tanh', 'dropout': 0.1, 'lr': 0.01, 'weight_decay': 1e-05, 'opt': 'RMSprop'}. Best is trial 323 with value: 0.32512486453416034.[0m
[32m[I 2022-12-30 07:54:02,623][0m Trial 620 finished with value: 0.2459294031869052 and parameters: {'hidden_size': 512, 'activation1': 'tanh', 'activation2': 'sigmoid', 'dropout': 0.1, 'lr': 0.01, 'weight_decay': 1e-05, 'opt': 'Adam'}. Best is trial 323 with value: 0.32512486453416034.[0m
[32m[I 2022-12-30 07:54:12,768][0m Trial 621 finished with value: 0.32448773145069215 and parameters: {'hidden_size': 512, 'activation1': 'tanh', 'activation2': 'tanh', 'dropout': 0.1, 'lr': 0.01, 'weight_decay': 1e-05, 'opt': 'Adam'}. Best is trial 323 with value: 0.32512486453416034.[0m
[32m[I 2022-12-30 07:54:23,004][0m Trial 622 finished with value: 0.32232282272804175 and parameters: {'hidden_size': 512, 'activation1': 'tanh', 'activation2': 'tanh', 'dropout': 0.1, 'lr': 0.01, 'weight_decay': 1e-05, 'opt': 'Adam'}. Best is trial 323 with value: 0.32512486453416034.[0m
[32m[I 2022-12-30 07:54:33,679][0m Trial 623 finished with value: 0.3181238290231575 and parameters: {'hidden_size': 512, 'activation1': 'tanh', 'activation2': 'tanh', 'dropout': 0.1, 'lr': 0.003, 'weight_decay': 1e-05, 'opt': 'Adam'}. Best is trial 323 with value: 0.32512486453416034.[0m
[32m[I 2022-12-30 07:54:44,736][0m Trial 624 finished with value: 0.32253891496798587 and parameters: {'hidden_size': 512, 'activation1': 'tanh', 'activation2': 'tanh', 'dropout': 0.1, 'lr': 0.01, 'weight_decay': 1e-05, 'opt': 'Adam'}. Best is trial 323 with value: 0.32512486453416034.[0m
[32m[I 2022-12-30 07:54:55,409][0m Trial 625 finished with value: 0.3247753924206102 and parameters: {'hidden_size': 512, 'activation1': 'tanh', 'activation2': 'tanh', 'dropout': 0.1, 'lr': 0.01, 'weight_decay': 1e-05, 'opt': 'Adam'}. Best is trial 323 with value: 0.32512486453416034.[0m
[32m[I 2022-12-30 07:55:05,697][0m Trial 626 finished with value: 0.32353753514849054 and parameters: {'hidden_size': 512, 'activation1': 'tanh', 'activation2': 'tanh', 'dropout': 0.1, 'lr': 0.01, 'weight_decay': 1e-05, 'opt': 'Adam'}. Best is trial 323 with value: 0.32512486453416034.[0m
[32m[I 2022-12-30 07:55:15,686][0m Trial 627 finished with value: 0.3242279500294637 and parameters: {'hidden_size': 512, 'activation1': 'tanh', 'activation2': 'tanh', 'dropout': 0.1, 'lr': 0.01, 'weight_decay': 1e-05, 'opt': 'Adam'}. Best is trial 323 with value: 0.32512486453416034.[0m
[32m[I 2022-12-30 07:55:26,246][0m Trial 628 finished with value: 0.3200402466654736 and parameters: {'hidden_size': 512, 'activation1': 'tanh', 'activation2': 'tanh', 'dropout': 0.1, 'lr': 0.01, 'weight_decay': 1e-05, 'opt': 'Adam'}. Best is trial 323 with value: 0.32512486453416034.[0m
[32m[I 2022-12-30 07:55:36,730][0m Trial 629 finished with value: 0.27483303460198305 and parameters: {'hidden_size': 512, 'activation1': 'sigmoid', 'activation2': 'tanh', 'dropout': 0.1, 'lr': 0.01, 'weight_decay': 1e-05, 'opt': 'Adam'}. Best is trial 323 with value: 0.32512486453416034.[0m
[32m[I 2022-12-30 07:55:47,025][0m Trial 630 finished with value: 0.3212622952941751 and parameters: {'hidden_size': 512, 'activation1': 'tanh', 'activation2': 'tanh', 'dropout': 0.1, 'lr': 0.01, 'weight_decay': 1e-05, 'opt': 'Adam'}. Best is trial 323 with value: 0.32512486453416034.[0m
[32m[I 2022-12-30 07:55:57,442][0m Trial 631 finished with value: 0.32152708373239725 and parameters: {'hidden_size': 512, 'activation1': 'tanh', 'activation2': 'tanh', 'dropout': 0.1, 'lr': 0.01, 'weight_decay': 1e-05, 'opt': 'Adam'}. Best is trial 323 with value: 0.32512486453416034.[0m
[32m[I 2022-12-30 07:56:07,490][0m Trial 632 finished with value: 0.24750082005313184 and parameters: {'hidden_size': 512, 'activation1': 'tanh', 'activation2': 'relu', 'dropout': 0.1, 'lr': 0.01, 'weight_decay': 1e-05, 'opt': 'Adam'}. Best is trial 323 with value: 0.32512486453416034.[0m
[32m[I 2022-12-30 07:56:17,525][0m Trial 633 finished with value: 0.32112927792201373 and parameters: {'hidden_size': 512, 'activation1': 'tanh', 'activation2': 'tanh', 'dropout': 0.1, 'lr': 0.01, 'weight_decay': 1e-05, 'opt': 'Adam'}. Best is trial 323 with value: 0.32512486453416034.[0m
[32m[I 2022-12-30 07:56:27,594][0m Trial 634 finished with value: 0.3216309882239952 and parameters: {'hidden_size': 512, 'activation1': 'tanh', 'activation2': 'tanh', 'dropout': 0.1, 'lr': 0.01, 'weight_decay': 1e-05, 'opt': 'Adam'}. Best is trial 323 with value: 0.32512486453416034.[0m
[32m[I 2022-12-30 07:56:37,686][0m Trial 635 finished with value: 0.32451455069531276 and parameters: {'hidden_size': 512, 'activation1': 'tanh', 'activation2': 'tanh', 'dropout': 0.1, 'lr': 0.01, 'weight_decay': 1e-05, 'opt': 'Adam'}. Best is trial 323 with value: 0.32512486453416034.[0m
[32m[I 2022-12-30 07:56:47,788][0m Trial 636 finished with value: 0.32468850532011484 and parameters: {'hidden_size': 512, 'activation1': 'tanh', 'activation2': 'tanh', 'dropout': 0.1, 'lr': 0.01, 'weight_decay': 1e-05, 'opt': 'Adam'}. Best is trial 323 with value: 0.32512486453416034.[0m
[32m[I 2022-12-30 07:56:57,911][0m Trial 637 finished with value: 0.3240833865911349 and parameters: {'hidden_size': 512, 'activation1': 'tanh', 'activation2': 'tanh', 'dropout': 0.1, 'lr': 0.01, 'weight_decay': 1e-05, 'opt': 'Adam'}. Best is trial 323 with value: 0.32512486453416034.[0m
[32m[I 2022-12-30 07:57:08,693][0m Trial 638 finished with value: 0.3066198276939727 and parameters: {'hidden_size': 128, 'activation1': 'tanh', 'activation2': 'tanh', 'dropout': 0.1, 'lr': 0.01, 'weight_decay': 1e-05, 'opt': 'Adam'}. Best is trial 323 with value: 0.32512486453416034.[0m
[32m[I 2022-12-30 07:57:19,176][0m Trial 639 finished with value: 0.3228606231037194 and parameters: {'hidden_size': 512, 'activation1': 'tanh', 'activation2': 'tanh', 'dropout': 0.1, 'lr': 0.01, 'weight_decay': 1e-05, 'opt': 'Adam'}. Best is trial 323 with value: 0.32512486453416034.[0m
[32m[I 2022-12-30 07:57:30,039][0m Trial 640 finished with value: 0.3110892550729517 and parameters: {'hidden_size': 256, 'activation1': 'tanh', 'activation2': 'tanh', 'dropout': 0.1, 'lr': 0.01, 'weight_decay': 1e-05, 'opt': 'Adam'}. Best is trial 323 with value: 0.32512486453416034.[0m
[32m[I 2022-12-30 07:57:40,288][0m Trial 641 finished with value: 0.29806291392398154 and parameters: {'hidden_size': 512, 'activation1': 'relu', 'activation2': 'tanh', 'dropout': 0.1, 'lr': 0.01, 'weight_decay': 1e-05, 'opt': 'Adam'}. Best is trial 323 with value: 0.32512486453416034.[0m
[32m[I 2022-12-30 07:57:50,486][0m Trial 642 finished with value: 0.3229286395154761 and parameters: {'hidden_size': 512, 'activation1': 'tanh', 'activation2': 'tanh', 'dropout': 0.1, 'lr': 0.01, 'weight_decay': 1e-05, 'opt': 'Adam'}. Best is trial 323 with value: 0.32512486453416034.[0m
[32m[I 2022-12-30 07:58:00,865][0m Trial 643 finished with value: 0.3243534502006228 and parameters: {'hidden_size': 512, 'activation1': 'tanh', 'activation2': 'tanh', 'dropout': 0.1, 'lr': 0.01, 'weight_decay': 1e-05, 'opt': 'Adam'}. Best is trial 323 with value: 0.32512486453416034.[0m
[32m[I 2022-12-30 07:58:11,099][0m Trial 644 finished with value: 0.24431280276106876 and parameters: {'hidden_size': 512, 'activation1': 'tanh', 'activation2': 'sigmoid', 'dropout': 0.1, 'lr': 0.01, 'weight_decay': 1e-05, 'opt': 'Adam'}. Best is trial 323 with value: 0.32512486453416034.[0m
[32m[I 2022-12-30 07:58:21,400][0m Trial 645 finished with value: 0.325550929278013 and parameters: {'hidden_size': 512, 'activation1': 'tanh', 'activation2': 'tanh', 'dropout': 0.1, 'lr': 0.01, 'weight_decay': 1e-05, 'opt': 'Adam'}. Best is trial 645 with value: 0.325550929278013.[0m
[32m[I 2022-12-30 07:58:31,441][0m Trial 646 finished with value: 0.31957042944376973 and parameters: {'hidden_size': 512, 'activation1': 'tanh', 'activation2': 'tanh', 'dropout': 0.1, 'lr': 0.01, 'weight_decay': 1e-05, 'opt': 'Adam'}. Best is trial 645 with value: 0.325550929278013.[0m
[32m[I 2022-12-30 07:58:41,639][0m Trial 647 finished with value: 0.32134458234239005 and parameters: {'hidden_size': 512, 'activation1': 'tanh', 'activation2': 'tanh', 'dropout': 0.1, 'lr': 0.01, 'weight_decay': 1e-05, 'opt': 'Adam'}. Best is trial 645 with value: 0.325550929278013.[0m
[32m[I 2022-12-30 07:58:52,162][0m Trial 648 finished with value: 0.3227831664303281 and parameters: {'hidden_size': 512, 'activation1': 'tanh', 'activation2': 'tanh', 'dropout': 0.1, 'lr': 0.01, 'weight_decay': 1e-05, 'opt': 'Adam'}. Best is trial 645 with value: 0.325550929278013.[0m
[32m[I 2022-12-30 07:59:02,050][0m Trial 649 finished with value: 0.3250310039208889 and parameters: {'hidden_size': 512, 'activation1': 'tanh', 'activation2': 'tanh', 'dropout': 0.1, 'lr': 0.01, 'weight_decay': 1e-05, 'opt': 'Adam'}. Best is trial 645 with value: 0.325550929278013.[0m
[32m[I 2022-12-30 07:59:12,044][0m Trial 650 finished with value: 0.32352748722418356 and parameters: {'hidden_size': 512, 'activation1': 'tanh', 'activation2': 'tanh', 'dropout': 0.1, 'lr': 0.01, 'weight_decay': 1e-05, 'opt': 'Adam'}. Best is trial 645 with value: 0.325550929278013.[0m
[32m[I 2022-12-30 07:59:22,005][0m Trial 651 finished with value: 0.3205315899646803 and parameters: {'hidden_size': 512, 'activation1': 'tanh', 'activation2': 'tanh', 'dropout': 0.1, 'lr': 0.01, 'weight_decay': 1e-05, 'opt': 'Adam'}. Best is trial 645 with value: 0.325550929278013.[0m
[32m[I 2022-12-30 07:59:31,990][0m Trial 652 finished with value: 0.32536272189371923 and parameters: {'hidden_size': 512, 'activation1': 'tanh', 'activation2': 'tanh', 'dropout': 0.1, 'lr': 0.01, 'weight_decay': 1e-05, 'opt': 'Adam'}. Best is trial 645 with value: 0.325550929278013.[0m
[32m[I 2022-12-30 07:59:42,118][0m Trial 653 finished with value: 0.3239394172828366 and parameters: {'hidden_size': 512, 'activation1': 'tanh', 'activation2': 'tanh', 'dropout': 0.1, 'lr': 0.01, 'weight_decay': 1e-05, 'opt': 'Adam'}. Best is trial 645 with value: 0.325550929278013.[0m
[32m[I 2022-12-30 07:59:52,889][0m Trial 654 finished with value: 0.2749100028996446 and parameters: {'hidden_size': 512, 'activation1': 'sigmoid', 'activation2': 'tanh', 'dropout': 0.1, 'lr': 0.01, 'weight_decay': 1e-05, 'opt': 'Adam'}. Best is trial 645 with value: 0.325550929278013.[0m
[32m[I 2022-12-30 08:00:02,818][0m Trial 655 finished with value: 0.3228148698551807 and parameters: {'hidden_size': 512, 'activation1': 'tanh', 'activation2': 'tanh', 'dropout': 0.1, 'lr': 0.01, 'weight_decay': 1e-05, 'opt': 'Adam'}. Best is trial 645 with value: 0.325550929278013.[0m
[32m[I 2022-12-30 08:00:13,036][0m Trial 656 finished with value: 0.25115486378501994 and parameters: {'hidden_size': 512, 'activation1': 'tanh', 'activation2': 'relu', 'dropout': 0.1, 'lr': 0.01, 'weight_decay': 1e-05, 'opt': 'Adam'}. Best is trial 645 with value: 0.325550929278013.[0m
[32m[I 2022-12-30 08:00:23,060][0m Trial 657 finished with value: 0.3230227993382552 and parameters: {'hidden_size': 512, 'activation1': 'tanh', 'activation2': 'tanh', 'dropout': 0.1, 'lr': 0.01, 'weight_decay': 1e-05, 'opt': 'Adam'}. Best is trial 645 with value: 0.325550929278013.[0m
[32m[I 2022-12-30 08:00:33,244][0m Trial 658 finished with value: 0.3243733569903262 and parameters: {'hidden_size': 512, 'activation1': 'tanh', 'activation2': 'tanh', 'dropout': 0.1, 'lr': 0.01, 'weight_decay': 1e-05, 'opt': 'Adam'}. Best is trial 645 with value: 0.325550929278013.[0m
[32m[I 2022-12-30 08:00:43,829][0m Trial 659 finished with value: 0.3259113683638972 and parameters: {'hidden_size': 512, 'activation1': 'tanh', 'activation2': 'tanh', 'dropout': 0.1, 'lr': 0.01, 'weight_decay': 1e-05, 'opt': 'Adam'}. Best is trial 659 with value: 0.3259113683638972.[0m
[32m[I 2022-12-30 08:00:54,537][0m Trial 660 finished with value: 0.3249312860148725 and parameters: {'hidden_size': 512, 'activation1': 'tanh', 'activation2': 'tanh', 'dropout': 0.1, 'lr': 0.01, 'weight_decay': 1e-05, 'opt': 'Adam'}. Best is trial 659 with value: 0.3259113683638972.[0m
[32m[I 2022-12-30 08:01:05,042][0m Trial 661 finished with value: 0.3227459199668863 and parameters: {'hidden_size': 512, 'activation1': 'tanh', 'activation2': 'tanh', 'dropout': 0.1, 'lr': 0.01, 'weight_decay': 1e-05, 'opt': 'Adam'}. Best is trial 659 with value: 0.3259113683638972.[0m
[32m[I 2022-12-30 08:01:15,242][0m Trial 662 finished with value: 0.3216416483067205 and parameters: {'hidden_size': 512, 'activation1': 'tanh', 'activation2': 'tanh', 'dropout': 0.1, 'lr': 0.01, 'weight_decay': 1e-05, 'opt': 'Adam'}. Best is trial 659 with value: 0.3259113683638972.[0m
[32m[I 2022-12-30 08:01:25,841][0m Trial 663 finished with value: 0.30794131367145283 and parameters: {'hidden_size': 128, 'activation1': 'tanh', 'activation2': 'tanh', 'dropout': 0.1, 'lr': 0.01, 'weight_decay': 1e-05, 'opt': 'Adam'}. Best is trial 659 with value: 0.3259113683638972.[0m
[32m[I 2022-12-30 08:01:35,926][0m Trial 664 finished with value: 0.32158245692032544 and parameters: {'hidden_size': 512, 'activation1': 'tanh', 'activation2': 'tanh', 'dropout': 0.1, 'lr': 0.01, 'weight_decay': 1e-05, 'opt': 'Adam'}. Best is trial 659 with value: 0.3259113683638972.[0m
