[32m[I 2022-12-30 06:48:13,374][0m Trial 148 finished with value: 0.31489304725211753 and parameters: {'hidden_size': 1024, 'activation1': 'tanh', 'activation2': 'tanh', 'dropout': 0, 'lr': 0.0003, 'weight_decay': 3e-06, 'opt': 'RMSprop'}. Best is trial 72 with value: 0.3179216008278444.[0m
[32m[I 2022-12-30 06:48:21,867][0m Trial 149 finished with value: 0.31583217817643733 and parameters: {'hidden_size': 1024, 'activation1': 'tanh', 'activation2': 'tanh', 'dropout': 0.05, 'lr': 0.0003, 'weight_decay': 3e-06, 'opt': 'RMSprop'}. Best is trial 72 with value: 0.3179216008278444.[0m
[32m[I 2022-12-30 06:48:30,947][0m Trial 150 finished with value: 0.22784502362234854 and parameters: {'hidden_size': 128, 'activation1': 'tanh', 'activation2': 'relu', 'dropout': 0.1, 'lr': 0.0003, 'weight_decay': 3e-06, 'opt': 'RMSprop'}. Best is trial 72 with value: 0.3179216008278444.[0m
[32m[I 2022-12-30 06:48:39,422][0m Trial 151 finished with value: 0.3162463137145586 and parameters: {'hidden_size': 1024, 'activation1': 'tanh', 'activation2': 'tanh', 'dropout': 0.05, 'lr': 0.0003, 'weight_decay': 3e-06, 'opt': 'RMSprop'}. Best is trial 72 with value: 0.3179216008278444.[0m
[32m[I 2022-12-30 06:48:47,926][0m Trial 152 finished with value: 0.3164821460899107 and parameters: {'hidden_size': 1024, 'activation1': 'tanh', 'activation2': 'tanh', 'dropout': 0.05, 'lr': 0.0003, 'weight_decay': 3e-06, 'opt': 'RMSprop'}. Best is trial 72 with value: 0.3179216008278444.[0m
[32m[I 2022-12-30 06:48:56,434][0m Trial 153 finished with value: 0.31816274463260114 and parameters: {'hidden_size': 1024, 'activation1': 'tanh', 'activation2': 'tanh', 'dropout': 0.05, 'lr': 0.0003, 'weight_decay': 3e-06, 'opt': 'RMSprop'}. Best is trial 153 with value: 0.31816274463260114.[0m
[32m[I 2022-12-30 06:49:04,930][0m Trial 154 finished with value: 0.31561086426170704 and parameters: {'hidden_size': 1024, 'activation1': 'tanh', 'activation2': 'tanh', 'dropout': 0.05, 'lr': 0.0003, 'weight_decay': 3e-06, 'opt': 'RMSprop'}. Best is trial 153 with value: 0.31816274463260114.[0m
[32m[I 2022-12-30 06:49:13,390][0m Trial 155 finished with value: 0.3175775898210122 and parameters: {'hidden_size': 1024, 'activation1': 'tanh', 'activation2': 'tanh', 'dropout': 0.05, 'lr': 0.0003, 'weight_decay': 3e-06, 'opt': 'RMSprop'}. Best is trial 153 with value: 0.31816274463260114.[0m
[32m[I 2022-12-30 06:49:22,015][0m Trial 156 finished with value: 0.30377943100962745 and parameters: {'hidden_size': 1024, 'activation1': 'sigmoid', 'activation2': 'tanh', 'dropout': 0.05, 'lr': 0.0003, 'weight_decay': 3e-05, 'opt': 'RMSprop'}. Best is trial 153 with value: 0.31816274463260114.[0m
[32m[I 2022-12-30 06:49:30,543][0m Trial 157 finished with value: 0.31571134119363525 and parameters: {'hidden_size': 1024, 'activation1': 'tanh', 'activation2': 'tanh', 'dropout': 0.05, 'lr': 0.0003, 'weight_decay': 3e-06, 'opt': 'RMSprop'}. Best is trial 153 with value: 0.31816274463260114.[0m
[32m[I 2022-12-30 06:49:38,984][0m Trial 158 finished with value: 0.3164836383433551 and parameters: {'hidden_size': 1024, 'activation1': 'tanh', 'activation2': 'tanh', 'dropout': 0.05, 'lr': 0.0003, 'weight_decay': 3e-06, 'opt': 'RMSprop'}. Best is trial 153 with value: 0.31816274463260114.[0m
[32m[I 2022-12-30 06:49:48,833][0m Trial 159 finished with value: 0.3165053589706516 and parameters: {'hidden_size': 512, 'activation1': 'tanh', 'activation2': 'tanh', 'dropout': 0.05, 'lr': 0.0003, 'weight_decay': 3e-06, 'opt': 'Adam'}. Best is trial 153 with value: 0.31816274463260114.[0m
[32m[I 2022-12-30 06:49:55,952][0m Trial 160 finished with value: 0.0 and parameters: {'hidden_size': 1024, 'activation1': 'tanh', 'activation2': 'tanh', 'dropout': 0.05, 'lr': 0.01, 'weight_decay': 3e-06, 'opt': 'SGD'}. Best is trial 153 with value: 0.31816274463260114.[0m
[32m[I 2022-12-30 06:50:04,388][0m Trial 161 finished with value: 0.3172131211762809 and parameters: {'hidden_size': 1024, 'activation1': 'tanh', 'activation2': 'tanh', 'dropout': 0.05, 'lr': 0.0003, 'weight_decay': 3e-06, 'opt': 'RMSprop'}. Best is trial 153 with value: 0.31816274463260114.[0m
[32m[I 2022-12-30 06:50:12,845][0m Trial 162 finished with value: 0.31662650211960486 and parameters: {'hidden_size': 1024, 'activation1': 'tanh', 'activation2': 'tanh', 'dropout': 0.05, 'lr': 0.0003, 'weight_decay': 3e-06, 'opt': 'RMSprop'}. Best is trial 153 with value: 0.31816274463260114.[0m
[32m[I 2022-12-30 06:50:21,356][0m Trial 163 finished with value: 0.31608762844587296 and parameters: {'hidden_size': 1024, 'activation1': 'tanh', 'activation2': 'tanh', 'dropout': 0.05, 'lr': 0.0003, 'weight_decay': 3e-06, 'opt': 'RMSprop'}. Best is trial 153 with value: 0.31816274463260114.[0m
[32m[I 2022-12-30 06:50:29,891][0m Trial 164 finished with value: 0.3169455725332503 and parameters: {'hidden_size': 1024, 'activation1': 'tanh', 'activation2': 'tanh', 'dropout': 0.05, 'lr': 0.0003, 'weight_decay': 3e-06, 'opt': 'RMSprop'}. Best is trial 153 with value: 0.31816274463260114.[0m
[32m[I 2022-12-30 06:50:38,394][0m Trial 165 finished with value: 0.31702166411171595 and parameters: {'hidden_size': 1024, 'activation1': 'tanh', 'activation2': 'tanh', 'dropout': 0.05, 'lr': 0.0003, 'weight_decay': 3e-06, 'opt': 'RMSprop'}. Best is trial 153 with value: 0.31816274463260114.[0m
[32m[I 2022-12-30 06:50:46,873][0m Trial 166 finished with value: 0.31679480663300824 and parameters: {'hidden_size': 1024, 'activation1': 'tanh', 'activation2': 'tanh', 'dropout': 0.05, 'lr': 0.0003, 'weight_decay': 3e-06, 'opt': 'RMSprop'}. Best is trial 153 with value: 0.31816274463260114.[0m
[32m[I 2022-12-30 06:50:55,538][0m Trial 167 finished with value: 0.31659377570234853 and parameters: {'hidden_size': 1024, 'activation1': 'tanh', 'activation2': 'tanh', 'dropout': 0.05, 'lr': 0.0003, 'weight_decay': 3e-06, 'opt': 'RMSprop'}. Best is trial 153 with value: 0.31816274463260114.[0m
[32m[I 2022-12-30 06:51:04,003][0m Trial 168 finished with value: 0.31634488273604006 and parameters: {'hidden_size': 1024, 'activation1': 'tanh', 'activation2': 'tanh', 'dropout': 0.05, 'lr': 0.0003, 'weight_decay': 1e-05, 'opt': 'RMSprop'}. Best is trial 153 with value: 0.31816274463260114.[0m
[32m[I 2022-12-30 06:51:12,685][0m Trial 169 finished with value: 0.25664906282166833 and parameters: {'hidden_size': 1024, 'activation1': 'tanh', 'activation2': 'sigmoid', 'dropout': 0.05, 'lr': 0.0003, 'weight_decay': 3e-06, 'opt': 'RMSprop'}. Best is trial 153 with value: 0.31816274463260114.[0m
[32m[I 2022-12-30 06:51:21,105][0m Trial 170 finished with value: 0.265706744478637 and parameters: {'hidden_size': 1024, 'activation1': 'tanh', 'activation2': 'tanh', 'dropout': 0.2, 'lr': 0.003, 'weight_decay': 3e-06, 'opt': 'RMSprop'}. Best is trial 153 with value: 0.31816274463260114.[0m
[32m[I 2022-12-30 06:51:29,579][0m Trial 171 finished with value: 0.31606051362031434 and parameters: {'hidden_size': 1024, 'activation1': 'tanh', 'activation2': 'tanh', 'dropout': 0.05, 'lr': 0.0003, 'weight_decay': 3e-06, 'opt': 'RMSprop'}. Best is trial 153 with value: 0.31816274463260114.[0m
[32m[I 2022-12-30 06:51:38,087][0m Trial 172 finished with value: 0.31642455742120745 and parameters: {'hidden_size': 1024, 'activation1': 'tanh', 'activation2': 'tanh', 'dropout': 0.05, 'lr': 0.0003, 'weight_decay': 3e-06, 'opt': 'RMSprop'}. Best is trial 153 with value: 0.31816274463260114.[0m
[32m[I 2022-12-30 06:51:46,664][0m Trial 173 finished with value: 0.31650629755746873 and parameters: {'hidden_size': 1024, 'activation1': 'tanh', 'activation2': 'tanh', 'dropout': 0.05, 'lr': 0.0003, 'weight_decay': 3e-06, 'opt': 'RMSprop'}. Best is trial 153 with value: 0.31816274463260114.[0m
[32m[I 2022-12-30 06:51:55,204][0m Trial 174 finished with value: 0.3159239446979182 and parameters: {'hidden_size': 1024, 'activation1': 'tanh', 'activation2': 'tanh', 'dropout': 0.05, 'lr': 0.0003, 'weight_decay': 3e-06, 'opt': 'RMSprop'}. Best is trial 153 with value: 0.31816274463260114.[0m
[32m[I 2022-12-30 06:52:03,933][0m Trial 175 finished with value: 0.31634777094487365 and parameters: {'hidden_size': 1024, 'activation1': 'tanh', 'activation2': 'tanh', 'dropout': 0.05, 'lr': 0.0003, 'weight_decay': 3e-06, 'opt': 'RMSprop'}. Best is trial 153 with value: 0.31816274463260114.[0m
[32m[I 2022-12-30 06:52:12,681][0m Trial 176 finished with value: 0.31695840600929726 and parameters: {'hidden_size': 1024, 'activation1': 'tanh', 'activation2': 'tanh', 'dropout': 0.05, 'lr': 0.0003, 'weight_decay': 3e-06, 'opt': 'RMSprop'}. Best is trial 153 with value: 0.31816274463260114.[0m
[32m[I 2022-12-30 06:52:21,367][0m Trial 177 finished with value: 0.31672150893269074 and parameters: {'hidden_size': 1024, 'activation1': 'tanh', 'activation2': 'tanh', 'dropout': 0.05, 'lr': 0.0003, 'weight_decay': 3e-06, 'opt': 'RMSprop'}. Best is trial 153 with value: 0.31816274463260114.[0m
[32m[I 2022-12-30 06:52:30,027][0m Trial 178 finished with value: 0.31674113815864474 and parameters: {'hidden_size': 1024, 'activation1': 'tanh', 'activation2': 'tanh', 'dropout': 0.05, 'lr': 0.001, 'weight_decay': 3e-06, 'opt': 'RMSprop'}. Best is trial 153 with value: 0.31816274463260114.[0m
[32m[I 2022-12-30 06:52:38,515][0m Trial 179 finished with value: 0.3174459340384357 and parameters: {'hidden_size': 1024, 'activation1': 'tanh', 'activation2': 'tanh', 'dropout': 0.05, 'lr': 0.0003, 'weight_decay': 3e-06, 'opt': 'RMSprop'}. Best is trial 153 with value: 0.31816274463260114.[0m
[32m[I 2022-12-30 06:52:47,059][0m Trial 180 finished with value: 0.3179147160632482 and parameters: {'hidden_size': 1024, 'activation1': 'tanh', 'activation2': 'tanh', 'dropout': 0.05, 'lr': 0.0003, 'weight_decay': 3e-06, 'opt': 'RMSprop'}. Best is trial 153 with value: 0.31816274463260114.[0m
[32m[I 2022-12-30 06:52:55,583][0m Trial 181 finished with value: 0.31613897873423696 and parameters: {'hidden_size': 1024, 'activation1': 'tanh', 'activation2': 'tanh', 'dropout': 0.05, 'lr': 0.0003, 'weight_decay': 3e-06, 'opt': 'RMSprop'}. Best is trial 153 with value: 0.31816274463260114.[0m
[32m[I 2022-12-30 06:53:04,075][0m Trial 182 finished with value: 0.3168651682950343 and parameters: {'hidden_size': 1024, 'activation1': 'tanh', 'activation2': 'tanh', 'dropout': 0.05, 'lr': 0.0003, 'weight_decay': 3e-06, 'opt': 'RMSprop'}. Best is trial 153 with value: 0.31816274463260114.[0m
[32m[I 2022-12-30 06:53:12,614][0m Trial 183 finished with value: 0.3169398251759382 and parameters: {'hidden_size': 1024, 'activation1': 'tanh', 'activation2': 'tanh', 'dropout': 0.05, 'lr': 0.0003, 'weight_decay': 3e-06, 'opt': 'RMSprop'}. Best is trial 153 with value: 0.31816274463260114.[0m
[32m[I 2022-12-30 06:53:21,216][0m Trial 184 finished with value: 0.31678507035401177 and parameters: {'hidden_size': 1024, 'activation1': 'tanh', 'activation2': 'tanh', 'dropout': 0.05, 'lr': 0.0003, 'weight_decay': 3e-06, 'opt': 'RMSprop'}. Best is trial 153 with value: 0.31816274463260114.[0m
[32m[I 2022-12-30 06:53:29,731][0m Trial 185 finished with value: 0.31622289834445233 and parameters: {'hidden_size': 1024, 'activation1': 'tanh', 'activation2': 'tanh', 'dropout': 0.05, 'lr': 0.0003, 'weight_decay': 3e-06, 'opt': 'RMSprop'}. Best is trial 153 with value: 0.31816274463260114.[0m
[32m[I 2022-12-30 06:53:38,217][0m Trial 186 finished with value: 0.3054208864163657 and parameters: {'hidden_size': 1024, 'activation1': 'sigmoid', 'activation2': 'tanh', 'dropout': 0, 'lr': 0.0003, 'weight_decay': 3e-06, 'opt': 'RMSprop'}. Best is trial 153 with value: 0.31816274463260114.[0m
[32m[I 2022-12-30 06:53:47,419][0m Trial 187 finished with value: 0.22797370125856564 and parameters: {'hidden_size': 128, 'activation1': 'tanh', 'activation2': 'relu', 'dropout': 0.05, 'lr': 0.0003, 'weight_decay': 3e-06, 'opt': 'RMSprop'}. Best is trial 153 with value: 0.31816274463260114.[0m
[32m[I 2022-12-30 06:53:56,060][0m Trial 188 finished with value: 0.3160640232301043 and parameters: {'hidden_size': 1024, 'activation1': 'tanh', 'activation2': 'tanh', 'dropout': 0.1, 'lr': 0.0003, 'weight_decay': 3e-05, 'opt': 'RMSprop'}. Best is trial 153 with value: 0.31816274463260114.[0m
[32m[I 2022-12-30 06:54:04,633][0m Trial 189 finished with value: 0.31637116063775855 and parameters: {'hidden_size': 512, 'activation1': 'tanh', 'activation2': 'tanh', 'dropout': 0.05, 'lr': 0.0003, 'weight_decay': 3e-06, 'opt': 'RMSprop'}. Best is trial 153 with value: 0.31816274463260114.[0m
[32m[I 2022-12-30 06:54:13,143][0m Trial 190 finished with value: 0.3170233343087304 and parameters: {'hidden_size': 1024, 'activation1': 'tanh', 'activation2': 'tanh', 'dropout': 0.05, 'lr': 0.0003, 'weight_decay': 3e-06, 'opt': 'RMSprop'}. Best is trial 153 with value: 0.31816274463260114.[0m
[32m[I 2022-12-30 06:54:21,684][0m Trial 191 finished with value: 0.31647161101815896 and parameters: {'hidden_size': 1024, 'activation1': 'tanh', 'activation2': 'tanh', 'dropout': 0.05, 'lr': 0.0003, 'weight_decay': 3e-06, 'opt': 'RMSprop'}. Best is trial 153 with value: 0.31816274463260114.[0m
[32m[I 2022-12-30 06:54:30,299][0m Trial 192 finished with value: 0.3160097446289483 and parameters: {'hidden_size': 1024, 'activation1': 'tanh', 'activation2': 'tanh', 'dropout': 0.05, 'lr': 0.0003, 'weight_decay': 3e-06, 'opt': 'RMSprop'}. Best is trial 153 with value: 0.31816274463260114.[0m
[32m[I 2022-12-30 06:54:38,800][0m Trial 193 finished with value: 0.3168016383703612 and parameters: {'hidden_size': 1024, 'activation1': 'tanh', 'activation2': 'tanh', 'dropout': 0.05, 'lr': 0.0003, 'weight_decay': 3e-06, 'opt': 'RMSprop'}. Best is trial 153 with value: 0.31816274463260114.[0m
[32m[I 2022-12-30 06:54:47,390][0m Trial 194 finished with value: 0.3158184134072668 and parameters: {'hidden_size': 1024, 'activation1': 'tanh', 'activation2': 'tanh', 'dropout': 0.05, 'lr': 0.0003, 'weight_decay': 3e-06, 'opt': 'RMSprop'}. Best is trial 153 with value: 0.31816274463260114.[0m
[32m[I 2022-12-30 06:54:55,916][0m Trial 195 finished with value: 0.31624692300991813 and parameters: {'hidden_size': 1024, 'activation1': 'tanh', 'activation2': 'tanh', 'dropout': 0.05, 'lr': 0.0003, 'weight_decay': 3e-06, 'opt': 'RMSprop'}. Best is trial 153 with value: 0.31816274463260114.[0m
[32m[I 2022-12-30 06:55:04,408][0m Trial 196 finished with value: 0.3160621405823805 and parameters: {'hidden_size': 1024, 'activation1': 'tanh', 'activation2': 'tanh', 'dropout': 0.1, 'lr': 0.0003, 'weight_decay': 3e-06, 'opt': 'RMSprop'}. Best is trial 153 with value: 0.31816274463260114.[0m
[32m[I 2022-12-30 06:55:11,591][0m Trial 197 finished with value: 0.0 and parameters: {'hidden_size': 1024, 'activation1': 'tanh', 'activation2': 'tanh', 'dropout': 0.05, 'lr': 0.01, 'weight_decay': 3e-06, 'opt': 'SGD'}. Best is trial 153 with value: 0.31816274463260114.[0m
[32m[I 2022-12-30 06:55:20,161][0m Trial 198 finished with value: 0.3161539339293574 and parameters: {'hidden_size': 1024, 'activation1': 'tanh', 'activation2': 'tanh', 'dropout': 0.05, 'lr': 0.0003, 'weight_decay': 3e-06, 'opt': 'RMSprop'}. Best is trial 153 with value: 0.31816274463260114.[0m
[32m[I 2022-12-30 06:55:29,980][0m Trial 199 finished with value: 0.3133668908592509 and parameters: {'hidden_size': 1024, 'activation1': 'tanh', 'activation2': 'tanh', 'dropout': 0.05, 'lr': 0.0003, 'weight_decay': 3e-06, 'opt': 'Adam'}. Best is trial 153 with value: 0.31816274463260114.[0m
[32m[I 2022-12-30 06:55:38,534][0m Trial 200 finished with value: 0.31645634025984226 and parameters: {'hidden_size': 1024, 'activation1': 'tanh', 'activation2': 'tanh', 'dropout': 0.1, 'lr': 0.0003, 'weight_decay': 1e-05, 'opt': 'RMSprop'}. Best is trial 153 with value: 0.31816274463260114.[0m
[32m[I 2022-12-30 06:55:47,074][0m Trial 201 finished with value: 0.31771912728335483 and parameters: {'hidden_size': 1024, 'activation1': 'tanh', 'activation2': 'tanh', 'dropout': 0.05, 'lr': 0.0003, 'weight_decay': 3e-06, 'opt': 'RMSprop'}. Best is trial 153 with value: 0.31816274463260114.[0m
[32m[I 2022-12-30 06:55:55,572][0m Trial 202 finished with value: 0.3158787396420518 and parameters: {'hidden_size': 1024, 'activation1': 'tanh', 'activation2': 'tanh', 'dropout': 0.05, 'lr': 0.0003, 'weight_decay': 3e-06, 'opt': 'RMSprop'}. Best is trial 153 with value: 0.31816274463260114.[0m
[32m[I 2022-12-30 06:56:04,088][0m Trial 203 finished with value: 0.3163219684221222 and parameters: {'hidden_size': 1024, 'activation1': 'tanh', 'activation2': 'tanh', 'dropout': 0.05, 'lr': 0.0003, 'weight_decay': 3e-06, 'opt': 'RMSprop'}. Best is trial 153 with value: 0.31816274463260114.[0m
[32m[I 2022-12-30 06:56:12,581][0m Trial 204 finished with value: 0.3165358201215673 and parameters: {'hidden_size': 1024, 'activation1': 'tanh', 'activation2': 'tanh', 'dropout': 0.05, 'lr': 0.0003, 'weight_decay': 3e-06, 'opt': 'RMSprop'}. Best is trial 153 with value: 0.31816274463260114.[0m
[32m[I 2022-12-30 06:56:21,112][0m Trial 205 finished with value: 0.31594226678020043 and parameters: {'hidden_size': 1024, 'activation1': 'tanh', 'activation2': 'tanh', 'dropout': 0.05, 'lr': 0.0003, 'weight_decay': 3e-06, 'opt': 'RMSprop'}. Best is trial 153 with value: 0.31816274463260114.[0m
[32m[I 2022-12-30 06:56:29,837][0m Trial 206 finished with value: 0.25662035997609234 and parameters: {'hidden_size': 1024, 'activation1': 'tanh', 'activation2': 'sigmoid', 'dropout': 0.05, 'lr': 0.0003, 'weight_decay': 3e-06, 'opt': 'RMSprop'}. Best is trial 153 with value: 0.31816274463260114.[0m
[32m[I 2022-12-30 06:56:38,277][0m Trial 207 finished with value: 0.3150204234820829 and parameters: {'hidden_size': 1024, 'activation1': 'tanh', 'activation2': 'tanh', 'dropout': 0.2, 'lr': 0.0003, 'weight_decay': 3e-06, 'opt': 'RMSprop'}. Best is trial 153 with value: 0.31816274463260114.[0m
[32m[I 2022-12-30 06:56:46,788][0m Trial 208 finished with value: 0.3171773047686606 and parameters: {'hidden_size': 1024, 'activation1': 'tanh', 'activation2': 'tanh', 'dropout': 0.05, 'lr': 0.0003, 'weight_decay': 3e-06, 'opt': 'RMSprop'}. Best is trial 153 with value: 0.31816274463260114.[0m
[32m[I 2022-12-30 06:56:55,216][0m Trial 209 finished with value: 0.27037443241375403 and parameters: {'hidden_size': 1024, 'activation1': 'tanh', 'activation2': 'tanh', 'dropout': 0.05, 'lr': 0.003, 'weight_decay': 3e-06, 'opt': 'RMSprop'}. Best is trial 153 with value: 0.31816274463260114.[0m
[32m[I 2022-12-30 06:57:03,704][0m Trial 210 finished with value: 0.3166076636866178 and parameters: {'hidden_size': 1024, 'activation1': 'tanh', 'activation2': 'tanh', 'dropout': 0.1, 'lr': 0.0003, 'weight_decay': 3e-06, 'opt': 'RMSprop'}. Best is trial 153 with value: 0.31816274463260114.[0m
[32m[I 2022-12-30 06:57:12,175][0m Trial 211 finished with value: 0.3164094982446378 and parameters: {'hidden_size': 1024, 'activation1': 'tanh', 'activation2': 'tanh', 'dropout': 0.05, 'lr': 0.0003, 'weight_decay': 3e-06, 'opt': 'RMSprop'}. Best is trial 153 with value: 0.31816274463260114.[0m
[32m[I 2022-12-30 06:57:20,683][0m Trial 212 finished with value: 0.3158803690458071 and parameters: {'hidden_size': 1024, 'activation1': 'tanh', 'activation2': 'tanh', 'dropout': 0.05, 'lr': 0.0003, 'weight_decay': 3e-06, 'opt': 'RMSprop'}. Best is trial 153 with value: 0.31816274463260114.[0m
[32m[I 2022-12-30 06:57:29,220][0m Trial 213 finished with value: 0.3161277969488757 and parameters: {'hidden_size': 1024, 'activation1': 'tanh', 'activation2': 'tanh', 'dropout': 0.05, 'lr': 0.0003, 'weight_decay': 3e-06, 'opt': 'RMSprop'}. Best is trial 153 with value: 0.31816274463260114.[0m
[32m[I 2022-12-30 06:57:37,708][0m Trial 214 finished with value: 0.3154159217674879 and parameters: {'hidden_size': 1024, 'activation1': 'tanh', 'activation2': 'tanh', 'dropout': 0.05, 'lr': 0.0003, 'weight_decay': 3e-06, 'opt': 'RMSprop'}. Best is trial 153 with value: 0.31816274463260114.[0m
[32m[I 2022-12-30 06:57:46,158][0m Trial 215 finished with value: 0.31660564820782067 and parameters: {'hidden_size': 1024, 'activation1': 'tanh', 'activation2': 'tanh', 'dropout': 0.05, 'lr': 0.0003, 'weight_decay': 3e-06, 'opt': 'RMSprop'}. Best is trial 153 with value: 0.31816274463260114.[0m
[32m[I 2022-12-30 06:57:54,653][0m Trial 216 finished with value: 0.31576412466551584 and parameters: {'hidden_size': 1024, 'activation1': 'tanh', 'activation2': 'tanh', 'dropout': 0.05, 'lr': 0.0003, 'weight_decay': 3e-06, 'opt': 'RMSprop'}. Best is trial 153 with value: 0.31816274463260114.[0m
[32m[I 2022-12-30 06:58:03,096][0m Trial 217 finished with value: 0.3164109378594692 and parameters: {'hidden_size': 1024, 'activation1': 'tanh', 'activation2': 'tanh', 'dropout': 0.05, 'lr': 0.001, 'weight_decay': 3e-06, 'opt': 'RMSprop'}. Best is trial 153 with value: 0.31816274463260114.[0m
[32m[I 2022-12-30 06:58:11,759][0m Trial 218 finished with value: 0.3040397693825073 and parameters: {'hidden_size': 1024, 'activation1': 'sigmoid', 'activation2': 'tanh', 'dropout': 0.05, 'lr': 0.0003, 'weight_decay': 3e-06, 'opt': 'RMSprop'}. Best is trial 153 with value: 0.31816274463260114.[0m
[32m[I 2022-12-30 06:58:20,267][0m Trial 219 finished with value: 0.31767991930134476 and parameters: {'hidden_size': 1024, 'activation1': 'tanh', 'activation2': 'tanh', 'dropout': 0.05, 'lr': 0.0003, 'weight_decay': 3e-06, 'opt': 'RMSprop'}. Best is trial 153 with value: 0.31816274463260114.[0m
[32m[I 2022-12-30 06:58:28,695][0m Trial 220 finished with value: 0.3168271906868898 and parameters: {'hidden_size': 1024, 'activation1': 'tanh', 'activation2': 'tanh', 'dropout': 0.1, 'lr': 0.0003, 'weight_decay': 3e-06, 'opt': 'RMSprop'}. Best is trial 153 with value: 0.31816274463260114.[0m
