[32m[I 2022-12-30 09:57:43,677][0m Trial 1336 finished with value: 0.31096147774117255 and parameters: {'hidden_size': 256, 'activation1': 'tanh', 'activation2': 'tanh', 'dropout': 0.05, 'lr': 0.01, 'weight_decay': 1e-05, 'opt': 'Adam'}. Best is trial 722 with value: 0.32671537835324177.[0m
[32m[I 2022-12-30 09:57:53,800][0m Trial 1337 finished with value: 0.3198852223910406 and parameters: {'hidden_size': 512, 'activation1': 'tanh', 'activation2': 'tanh', 'dropout': 0.05, 'lr': 0.01, 'weight_decay': 1e-05, 'opt': 'Adam'}. Best is trial 722 with value: 0.32671537835324177.[0m
[32m[I 2022-12-30 09:58:03,897][0m Trial 1338 finished with value: 0.24532537617311032 and parameters: {'hidden_size': 512, 'activation1': 'tanh', 'activation2': 'sigmoid', 'dropout': 0.05, 'lr': 0.01, 'weight_decay': 1e-05, 'opt': 'Adam'}. Best is trial 722 with value: 0.32671537835324177.[0m
[32m[I 2022-12-30 09:58:14,166][0m Trial 1339 finished with value: 0.3204188153525017 and parameters: {'hidden_size': 512, 'activation1': 'tanh', 'activation2': 'tanh', 'dropout': 0.05, 'lr': 0.01, 'weight_decay': 1e-05, 'opt': 'Adam'}. Best is trial 722 with value: 0.32671537835324177.[0m
[32m[I 2022-12-30 09:58:24,389][0m Trial 1340 finished with value: 0.3227213236921137 and parameters: {'hidden_size': 512, 'activation1': 'tanh', 'activation2': 'tanh', 'dropout': 0.05, 'lr': 0.01, 'weight_decay': 3e-06, 'opt': 'Adam'}. Best is trial 722 with value: 0.32671537835324177.[0m
[32m[I 2022-12-30 09:58:34,709][0m Trial 1341 finished with value: 0.3236722085040407 and parameters: {'hidden_size': 512, 'activation1': 'tanh', 'activation2': 'tanh', 'dropout': 0.05, 'lr': 0.01, 'weight_decay': 1e-05, 'opt': 'Adam'}. Best is trial 722 with value: 0.32671537835324177.[0m
[32m[I 2022-12-30 09:58:45,052][0m Trial 1342 finished with value: 0.32381141907832534 and parameters: {'hidden_size': 512, 'activation1': 'tanh', 'activation2': 'tanh', 'dropout': 0.05, 'lr': 0.01, 'weight_decay': 1e-05, 'opt': 'Adam'}. Best is trial 722 with value: 0.32671537835324177.[0m
[32m[I 2022-12-30 09:58:55,118][0m Trial 1343 finished with value: 0.3237055892715571 and parameters: {'hidden_size': 512, 'activation1': 'tanh', 'activation2': 'tanh', 'dropout': 0.05, 'lr': 0.01, 'weight_decay': 1e-05, 'opt': 'Adam'}. Best is trial 722 with value: 0.32671537835324177.[0m
[32m[I 2022-12-30 09:59:05,189][0m Trial 1344 finished with value: 0.3216243091157621 and parameters: {'hidden_size': 512, 'activation1': 'tanh', 'activation2': 'tanh', 'dropout': 0.05, 'lr': 0.01, 'weight_decay': 1e-05, 'opt': 'Adam'}. Best is trial 722 with value: 0.32671537835324177.[0m
[32m[I 2022-12-30 09:59:15,313][0m Trial 1345 finished with value: 0.3247875556734791 and parameters: {'hidden_size': 512, 'activation1': 'tanh', 'activation2': 'tanh', 'dropout': 0.05, 'lr': 0.01, 'weight_decay': 1e-05, 'opt': 'Adam'}. Best is trial 722 with value: 0.32671537835324177.[0m
[32m[I 2022-12-30 09:59:25,523][0m Trial 1346 finished with value: 0.32325687816034276 and parameters: {'hidden_size': 512, 'activation1': 'tanh', 'activation2': 'tanh', 'dropout': 0.05, 'lr': 0.01, 'weight_decay': 1e-05, 'opt': 'Adam'}. Best is trial 722 with value: 0.32671537835324177.[0m
[32m[I 2022-12-30 09:59:35,872][0m Trial 1347 finished with value: 0.32414040696067387 and parameters: {'hidden_size': 512, 'activation1': 'tanh', 'activation2': 'tanh', 'dropout': 0.05, 'lr': 0.01, 'weight_decay': 1e-05, 'opt': 'Adam'}. Best is trial 722 with value: 0.32671537835324177.[0m
[32m[I 2022-12-30 09:59:46,859][0m Trial 1348 finished with value: 0.2752896304647924 and parameters: {'hidden_size': 512, 'activation1': 'sigmoid', 'activation2': 'tanh', 'dropout': 0.05, 'lr': 0.01, 'weight_decay': 1e-05, 'opt': 'Adam'}. Best is trial 722 with value: 0.32671537835324177.[0m
[32m[I 2022-12-30 09:59:57,528][0m Trial 1349 finished with value: 0.24508560040422228 and parameters: {'hidden_size': 512, 'activation1': 'tanh', 'activation2': 'relu', 'dropout': 0.05, 'lr': 0.01, 'weight_decay': 1e-05, 'opt': 'Adam'}. Best is trial 722 with value: 0.32671537835324177.[0m
[32m[I 2022-12-30 10:00:08,372][0m Trial 1350 finished with value: 0.30968054467639383 and parameters: {'hidden_size': 1024, 'activation1': 'tanh', 'activation2': 'tanh', 'dropout': 0.05, 'lr': 0.01, 'weight_decay': 1e-05, 'opt': 'Adam'}. Best is trial 722 with value: 0.32671537835324177.[0m
[32m[I 2022-12-30 10:00:18,682][0m Trial 1351 finished with value: 0.32305540766643936 and parameters: {'hidden_size': 512, 'activation1': 'tanh', 'activation2': 'tanh', 'dropout': 0.05, 'lr': 0.01, 'weight_decay': 1e-05, 'opt': 'Adam'}. Best is trial 722 with value: 0.32671537835324177.[0m
[32m[I 2022-12-30 10:00:28,884][0m Trial 1352 finished with value: 0.325548746582657 and parameters: {'hidden_size': 512, 'activation1': 'tanh', 'activation2': 'tanh', 'dropout': 0.05, 'lr': 0.01, 'weight_decay': 1e-05, 'opt': 'Adam'}. Best is trial 722 with value: 0.32671537835324177.[0m
[32m[I 2022-12-30 10:00:39,151][0m Trial 1353 finished with value: 0.3251855933092145 and parameters: {'hidden_size': 512, 'activation1': 'tanh', 'activation2': 'tanh', 'dropout': 0.05, 'lr': 0.01, 'weight_decay': 1e-05, 'opt': 'Adam'}. Best is trial 722 with value: 0.32671537835324177.[0m
[32m[I 2022-12-30 10:00:47,170][0m Trial 1354 finished with value: 0.03216194202732199 and parameters: {'hidden_size': 512, 'activation1': 'tanh', 'activation2': 'tanh', 'dropout': 0.05, 'lr': 0.01, 'weight_decay': 1e-05, 'opt': 'SGD'}. Best is trial 722 with value: 0.32671537835324177.[0m
[32m[I 2022-12-30 10:00:57,852][0m Trial 1355 finished with value: 0.3243263837497935 and parameters: {'hidden_size': 512, 'activation1': 'tanh', 'activation2': 'tanh', 'dropout': 0.05, 'lr': 0.01, 'weight_decay': 1e-05, 'opt': 'Adam'}. Best is trial 722 with value: 0.32671537835324177.[0m
[32m[I 2022-12-30 10:01:09,524][0m Trial 1356 finished with value: 0.31706732987011976 and parameters: {'hidden_size': 512, 'activation1': 'tanh', 'activation2': 'tanh', 'dropout': 0.05, 'lr': 0.0003, 'weight_decay': 1e-05, 'opt': 'Adam'}. Best is trial 722 with value: 0.32671537835324177.[0m
[32m[I 2022-12-30 10:01:20,582][0m Trial 1357 finished with value: 0.3018044812820678 and parameters: {'hidden_size': 128, 'activation1': 'tanh', 'activation2': 'tanh', 'dropout': 0.05, 'lr': 0.01, 'weight_decay': 1e-05, 'opt': 'Adam'}. Best is trial 722 with value: 0.32671537835324177.[0m
[32m[I 2022-12-30 10:01:30,879][0m Trial 1358 finished with value: 0.29569165342485376 and parameters: {'hidden_size': 512, 'activation1': 'relu', 'activation2': 'tanh', 'dropout': 0.05, 'lr': 0.01, 'weight_decay': 1e-05, 'opt': 'Adam'}. Best is trial 722 with value: 0.32671537835324177.[0m
[32m[I 2022-12-30 10:01:41,169][0m Trial 1359 finished with value: 0.31603328721378404 and parameters: {'hidden_size': 512, 'activation1': 'tanh', 'activation2': 'tanh', 'dropout': 0.05, 'lr': 0.003, 'weight_decay': 3e-06, 'opt': 'Adam'}. Best is trial 722 with value: 0.32671537835324177.[0m
[32m[I 2022-12-30 10:01:51,380][0m Trial 1360 finished with value: 0.3126185916399146 and parameters: {'hidden_size': 256, 'activation1': 'tanh', 'activation2': 'tanh', 'dropout': 0.05, 'lr': 0.01, 'weight_decay': 1e-05, 'opt': 'Adam'}. Best is trial 722 with value: 0.32671537835324177.[0m
[32m[I 2022-12-30 10:02:01,587][0m Trial 1361 finished with value: 0.3230459271579661 and parameters: {'hidden_size': 512, 'activation1': 'tanh', 'activation2': 'tanh', 'dropout': 0.05, 'lr': 0.01, 'weight_decay': 1e-05, 'opt': 'Adam'}. Best is trial 722 with value: 0.32671537835324177.[0m
[32m[I 2022-12-30 10:02:12,358][0m Trial 1362 finished with value: 0.24431170656915305 and parameters: {'hidden_size': 512, 'activation1': 'tanh', 'activation2': 'sigmoid', 'dropout': 0.05, 'lr': 0.01, 'weight_decay': 1e-05, 'opt': 'Adam'}. Best is trial 722 with value: 0.32671537835324177.[0m
[32m[I 2022-12-30 10:02:22,788][0m Trial 1363 finished with value: 0.32202429456415144 and parameters: {'hidden_size': 512, 'activation1': 'tanh', 'activation2': 'tanh', 'dropout': 0.05, 'lr': 0.01, 'weight_decay': 1e-05, 'opt': 'Adam'}. Best is trial 722 with value: 0.32671537835324177.[0m
[32m[I 2022-12-30 10:02:33,390][0m Trial 1364 finished with value: 0.3240229848970746 and parameters: {'hidden_size': 512, 'activation1': 'tanh', 'activation2': 'tanh', 'dropout': 0.05, 'lr': 0.01, 'weight_decay': 1e-05, 'opt': 'Adam'}. Best is trial 722 with value: 0.32671537835324177.[0m
[32m[I 2022-12-30 10:02:43,929][0m Trial 1365 finished with value: 0.3241807756025557 and parameters: {'hidden_size': 512, 'activation1': 'tanh', 'activation2': 'tanh', 'dropout': 0.05, 'lr': 0.01, 'weight_decay': 1e-05, 'opt': 'Adam'}. Best is trial 722 with value: 0.32671537835324177.[0m
[32m[I 2022-12-30 10:02:54,914][0m Trial 1366 finished with value: 0.3240046928159298 and parameters: {'hidden_size': 512, 'activation1': 'tanh', 'activation2': 'tanh', 'dropout': 0.05, 'lr': 0.01, 'weight_decay': 1e-05, 'opt': 'Adam'}. Best is trial 722 with value: 0.32671537835324177.[0m
[32m[I 2022-12-30 10:03:05,674][0m Trial 1367 finished with value: 0.3241583606719638 and parameters: {'hidden_size': 512, 'activation1': 'tanh', 'activation2': 'tanh', 'dropout': 0.05, 'lr': 0.01, 'weight_decay': 1e-05, 'opt': 'Adam'}. Best is trial 722 with value: 0.32671537835324177.[0m
[32m[I 2022-12-30 10:03:16,223][0m Trial 1368 finished with value: 0.3247655919910527 and parameters: {'hidden_size': 512, 'activation1': 'tanh', 'activation2': 'tanh', 'dropout': 0.05, 'lr': 0.01, 'weight_decay': 1e-05, 'opt': 'Adam'}. Best is trial 722 with value: 0.32671537835324177.[0m
[32m[I 2022-12-30 10:03:26,976][0m Trial 1369 finished with value: 0.3266403117678323 and parameters: {'hidden_size': 512, 'activation1': 'tanh', 'activation2': 'tanh', 'dropout': 0.05, 'lr': 0.01, 'weight_decay': 1e-05, 'opt': 'Adam'}. Best is trial 722 with value: 0.32671537835324177.[0m
[32m[I 2022-12-30 10:03:37,320][0m Trial 1370 finished with value: 0.32570849586636613 and parameters: {'hidden_size': 512, 'activation1': 'tanh', 'activation2': 'tanh', 'dropout': 0.05, 'lr': 0.01, 'weight_decay': 1e-05, 'opt': 'Adam'}. Best is trial 722 with value: 0.32671537835324177.[0m
[32m[I 2022-12-30 10:03:47,953][0m Trial 1371 finished with value: 0.2732947052837672 and parameters: {'hidden_size': 512, 'activation1': 'sigmoid', 'activation2': 'relu', 'dropout': 0.05, 'lr': 0.01, 'weight_decay': 1e-05, 'opt': 'Adam'}. Best is trial 722 with value: 0.32671537835324177.[0m
[32m[I 2022-12-30 10:03:58,548][0m Trial 1372 finished with value: 0.3145918221030293 and parameters: {'hidden_size': 1024, 'activation1': 'tanh', 'activation2': 'tanh', 'dropout': 0.05, 'lr': 0.0003, 'weight_decay': 1e-05, 'opt': 'Adam'}. Best is trial 722 with value: 0.32671537835324177.[0m
[32m[I 2022-12-30 10:04:08,806][0m Trial 1373 finished with value: 0.32348640100160647 and parameters: {'hidden_size': 512, 'activation1': 'tanh', 'activation2': 'tanh', 'dropout': 0.05, 'lr': 0.01, 'weight_decay': 1e-05, 'opt': 'Adam'}. Best is trial 722 with value: 0.32671537835324177.[0m
[32m[I 2022-12-30 10:04:16,470][0m Trial 1374 finished with value: 0.06867124028041609 and parameters: {'hidden_size': 512, 'activation1': 'tanh', 'activation2': 'tanh', 'dropout': 0.05, 'lr': 0.01, 'weight_decay': 1e-05, 'opt': 'SGD'}. Best is trial 722 with value: 0.32671537835324177.[0m
[32m[I 2022-12-30 10:04:26,662][0m Trial 1375 finished with value: 0.3241186879721756 and parameters: {'hidden_size': 512, 'activation1': 'tanh', 'activation2': 'tanh', 'dropout': 0.05, 'lr': 0.01, 'weight_decay': 1e-05, 'opt': 'Adam'}. Best is trial 722 with value: 0.32671537835324177.[0m
[32m[I 2022-12-30 10:04:36,903][0m Trial 1376 finished with value: 0.32308258703554105 and parameters: {'hidden_size': 512, 'activation1': 'tanh', 'activation2': 'tanh', 'dropout': 0.05, 'lr': 0.01, 'weight_decay': 1e-05, 'opt': 'Adam'}. Best is trial 722 with value: 0.32671537835324177.[0m
[32m[I 2022-12-30 10:04:47,293][0m Trial 1377 finished with value: 0.3249494926371145 and parameters: {'hidden_size': 512, 'activation1': 'tanh', 'activation2': 'tanh', 'dropout': 0.05, 'lr': 0.01, 'weight_decay': 1e-05, 'opt': 'Adam'}. Best is trial 722 with value: 0.32671537835324177.[0m
[32m[I 2022-12-30 10:04:57,842][0m Trial 1378 finished with value: 0.3227922708002122 and parameters: {'hidden_size': 512, 'activation1': 'tanh', 'activation2': 'tanh', 'dropout': 0.05, 'lr': 0.01, 'weight_decay': 1e-05, 'opt': 'Adam'}. Best is trial 722 with value: 0.32671537835324177.[0m
[32m[I 2022-12-30 10:05:08,886][0m Trial 1379 finished with value: 0.3257765626028366 and parameters: {'hidden_size': 512, 'activation1': 'tanh', 'activation2': 'tanh', 'dropout': 0.05, 'lr': 0.01, 'weight_decay': 1e-05, 'opt': 'Adam'}. Best is trial 722 with value: 0.32671537835324177.[0m
[32m[I 2022-12-30 10:05:20,102][0m Trial 1380 finished with value: 0.30519806159928164 and parameters: {'hidden_size': 512, 'activation1': 'relu', 'activation2': 'tanh', 'dropout': 0.05, 'lr': 0.01, 'weight_decay': 3e-06, 'opt': 'Adam'}. Best is trial 722 with value: 0.32671537835324177.[0m
[32m[I 2022-12-30 10:05:31,008][0m Trial 1381 finished with value: 0.3179636828170065 and parameters: {'hidden_size': 512, 'activation1': 'tanh', 'activation2': 'tanh', 'dropout': 0.05, 'lr': 0.003, 'weight_decay': 1e-05, 'opt': 'Adam'}. Best is trial 722 with value: 0.32671537835324177.[0m
[32m[I 2022-12-30 10:05:41,319][0m Trial 1382 finished with value: 0.3057370513737293 and parameters: {'hidden_size': 128, 'activation1': 'tanh', 'activation2': 'tanh', 'dropout': 0.05, 'lr': 0.01, 'weight_decay': 1e-05, 'opt': 'Adam'}. Best is trial 722 with value: 0.32671537835324177.[0m
[32m[I 2022-12-30 10:05:51,898][0m Trial 1383 finished with value: 0.24196996718730884 and parameters: {'hidden_size': 512, 'activation1': 'tanh', 'activation2': 'sigmoid', 'dropout': 0.05, 'lr': 0.01, 'weight_decay': 1e-05, 'opt': 'Adam'}. Best is trial 722 with value: 0.32671537835324177.[0m
[32m[I 2022-12-30 10:06:01,977][0m Trial 1384 finished with value: 0.32540901246547005 and parameters: {'hidden_size': 512, 'activation1': 'tanh', 'activation2': 'tanh', 'dropout': 0.05, 'lr': 0.01, 'weight_decay': 1e-05, 'opt': 'Adam'}. Best is trial 722 with value: 0.32671537835324177.[0m
[32m[I 2022-12-30 10:06:11,984][0m Trial 1385 finished with value: 0.30980212932026163 and parameters: {'hidden_size': 256, 'activation1': 'tanh', 'activation2': 'tanh', 'dropout': 0.05, 'lr': 0.01, 'weight_decay': 1e-05, 'opt': 'Adam'}. Best is trial 722 with value: 0.32671537835324177.[0m
[32m[I 2022-12-30 10:06:22,084][0m Trial 1386 finished with value: 0.3256498604430022 and parameters: {'hidden_size': 512, 'activation1': 'tanh', 'activation2': 'tanh', 'dropout': 0.05, 'lr': 0.01, 'weight_decay': 1e-05, 'opt': 'Adam'}. Best is trial 722 with value: 0.32671537835324177.[0m
[32m[I 2022-12-30 10:06:32,426][0m Trial 1387 finished with value: 0.32100867658166116 and parameters: {'hidden_size': 512, 'activation1': 'tanh', 'activation2': 'tanh', 'dropout': 0.05, 'lr': 0.01, 'weight_decay': 1e-05, 'opt': 'Adam'}. Best is trial 722 with value: 0.32671537835324177.[0m
[32m[I 2022-12-30 10:06:42,720][0m Trial 1388 finished with value: 0.324651099842178 and parameters: {'hidden_size': 512, 'activation1': 'tanh', 'activation2': 'tanh', 'dropout': 0.05, 'lr': 0.01, 'weight_decay': 1e-05, 'opt': 'Adam'}. Best is trial 722 with value: 0.32671537835324177.[0m
[32m[I 2022-12-30 10:06:53,023][0m Trial 1389 finished with value: 0.3244544801295366 and parameters: {'hidden_size': 512, 'activation1': 'tanh', 'activation2': 'tanh', 'dropout': 0.05, 'lr': 0.01, 'weight_decay': 1e-05, 'opt': 'Adam'}. Best is trial 722 with value: 0.32671537835324177.[0m
[32m[I 2022-12-30 10:07:03,199][0m Trial 1390 finished with value: 0.3231341813758209 and parameters: {'hidden_size': 512, 'activation1': 'tanh', 'activation2': 'tanh', 'dropout': 0.05, 'lr': 0.01, 'weight_decay': 1e-05, 'opt': 'Adam'}. Best is trial 722 with value: 0.32671537835324177.[0m
[32m[I 2022-12-30 10:07:13,838][0m Trial 1391 finished with value: 0.2684252765998741 and parameters: {'hidden_size': 512, 'activation1': 'sigmoid', 'activation2': 'tanh', 'dropout': 0.05, 'lr': 0.01, 'weight_decay': 1e-05, 'opt': 'Adam'}. Best is trial 722 with value: 0.32671537835324177.[0m
[32m[I 2022-12-30 10:07:25,333][0m Trial 1392 finished with value: 0.3233524933605946 and parameters: {'hidden_size': 512, 'activation1': 'tanh', 'activation2': 'tanh', 'dropout': 0.05, 'lr': 0.01, 'weight_decay': 1e-05, 'opt': 'Adam'}. Best is trial 722 with value: 0.32671537835324177.[0m
[32m[I 2022-12-30 10:07:35,853][0m Trial 1393 finished with value: 0.3234264831233662 and parameters: {'hidden_size': 512, 'activation1': 'tanh', 'activation2': 'tanh', 'dropout': 0.05, 'lr': 0.01, 'weight_decay': 1e-05, 'opt': 'Adam'}. Best is trial 722 with value: 0.32671537835324177.[0m
[32m[I 2022-12-30 10:07:47,127][0m Trial 1394 finished with value: 0.32318733033248853 and parameters: {'hidden_size': 512, 'activation1': 'tanh', 'activation2': 'tanh', 'dropout': 0.05, 'lr': 0.01, 'weight_decay': 1e-05, 'opt': 'Adam'}. Best is trial 722 with value: 0.32671537835324177.[0m
[32m[I 2022-12-30 10:07:58,993][0m Trial 1395 finished with value: 0.3161657440006186 and parameters: {'hidden_size': 512, 'activation1': 'tanh', 'activation2': 'tanh', 'dropout': 0.05, 'lr': 0.0003, 'weight_decay': 1e-05, 'opt': 'Adam'}. Best is trial 722 with value: 0.32671537835324177.[0m
[32m[I 2022-12-30 10:08:09,685][0m Trial 1396 finished with value: 0.2425793922062381 and parameters: {'hidden_size': 512, 'activation1': 'tanh', 'activation2': 'relu', 'dropout': 0.05, 'lr': 0.01, 'weight_decay': 1e-05, 'opt': 'Adam'}. Best is trial 722 with value: 0.32671537835324177.[0m
[32m[I 2022-12-30 10:08:18,293][0m Trial 1397 finished with value: 0.06575592739697078 and parameters: {'hidden_size': 512, 'activation1': 'tanh', 'activation2': 'tanh', 'dropout': 0.05, 'lr': 0.01, 'weight_decay': 1e-05, 'opt': 'SGD'}. Best is trial 722 with value: 0.32671537835324177.[0m
[32m[I 2022-12-30 10:08:29,793][0m Trial 1398 finished with value: 0.3070225850985694 and parameters: {'hidden_size': 1024, 'activation1': 'tanh', 'activation2': 'tanh', 'dropout': 0.05, 'lr': 0.01, 'weight_decay': 1e-05, 'opt': 'Adam'}. Best is trial 722 with value: 0.32671537835324177.[0m
[32m[I 2022-12-30 10:08:40,396][0m Trial 1399 finished with value: 0.325129921440989 and parameters: {'hidden_size': 512, 'activation1': 'tanh', 'activation2': 'tanh', 'dropout': 0.05, 'lr': 0.01, 'weight_decay': 1e-05, 'opt': 'Adam'}. Best is trial 722 with value: 0.32671537835324177.[0m
[32m[I 2022-12-30 10:08:51,444][0m Trial 1400 finished with value: 0.32379948556436206 and parameters: {'hidden_size': 512, 'activation1': 'tanh', 'activation2': 'tanh', 'dropout': 0.05, 'lr': 0.01, 'weight_decay': 1e-05, 'opt': 'Adam'}. Best is trial 722 with value: 0.32671537835324177.[0m
[32m[I 2022-12-30 10:09:02,056][0m Trial 1401 finished with value: 0.3249850153868962 and parameters: {'hidden_size': 512, 'activation1': 'tanh', 'activation2': 'tanh', 'dropout': 0.05, 'lr': 0.01, 'weight_decay': 1e-05, 'opt': 'Adam'}. Best is trial 722 with value: 0.32671537835324177.[0m
[32m[I 2022-12-30 10:09:12,826][0m Trial 1402 finished with value: 0.32591191527055513 and parameters: {'hidden_size': 512, 'activation1': 'tanh', 'activation2': 'tanh', 'dropout': 0.05, 'lr': 0.01, 'weight_decay': 3e-06, 'opt': 'Adam'}. Best is trial 722 with value: 0.32671537835324177.[0m
[32m[I 2022-12-30 10:09:24,144][0m Trial 1403 finished with value: 0.2841737696857939 and parameters: {'hidden_size': 512, 'activation1': 'relu', 'activation2': 'tanh', 'dropout': 0.05, 'lr': 0.01, 'weight_decay': 3e-06, 'opt': 'Adam'}. Best is trial 722 with value: 0.32671537835324177.[0m
[32m[I 2022-12-30 10:09:35,168][0m Trial 1404 finished with value: 0.3248484260046 and parameters: {'hidden_size': 512, 'activation1': 'tanh', 'activation2': 'tanh', 'dropout': 0.05, 'lr': 0.01, 'weight_decay': 3e-06, 'opt': 'Adam'}. Best is trial 722 with value: 0.32671537835324177.[0m
[32m[I 2022-12-30 10:09:46,116][0m Trial 1405 finished with value: 0.24390064788417565 and parameters: {'hidden_size': 512, 'activation1': 'tanh', 'activation2': 'sigmoid', 'dropout': 0.05, 'lr': 0.003, 'weight_decay': 3e-06, 'opt': 'Adam'}. Best is trial 722 with value: 0.32671537835324177.[0m
[32m[I 2022-12-30 10:09:57,023][0m Trial 1406 finished with value: 0.32491177533340315 and parameters: {'hidden_size': 512, 'activation1': 'tanh', 'activation2': 'tanh', 'dropout': 0.05, 'lr': 0.01, 'weight_decay': 3e-06, 'opt': 'Adam'}. Best is trial 722 with value: 0.32671537835324177.[0m
[32m[I 2022-12-30 10:10:07,818][0m Trial 1407 finished with value: 0.3215570262007369 and parameters: {'hidden_size': 512, 'activation1': 'tanh', 'activation2': 'tanh', 'dropout': 0.05, 'lr': 0.01, 'weight_decay': 3e-06, 'opt': 'Adam'}. Best is trial 722 with value: 0.32671537835324177.[0m
[32m[I 2022-12-30 10:10:18,067][0m Trial 1408 finished with value: 0.3052604132824004 and parameters: {'hidden_size': 128, 'activation1': 'tanh', 'activation2': 'tanh', 'dropout': 0.05, 'lr': 0.01, 'weight_decay': 3e-06, 'opt': 'Adam'}. Best is trial 722 with value: 0.32671537835324177.[0m
[32m[I 2022-12-30 10:10:28,562][0m Trial 1409 finished with value: 0.3258358484820771 and parameters: {'hidden_size': 512, 'activation1': 'tanh', 'activation2': 'tanh', 'dropout': 0.05, 'lr': 0.01, 'weight_decay': 3e-06, 'opt': 'Adam'}. Best is trial 722 with value: 0.32671537835324177.[0m
