[32m[I 2022-12-30 07:39:26,618][0m Trial 517 finished with value: 0.31474598119795993 and parameters: {'hidden_size': 128, 'activation1': 'tanh', 'activation2': 'tanh', 'dropout': 0.1, 'lr': 0.001, 'weight_decay': 3e-05, 'opt': 'RMSprop'}. Best is trial 323 with value: 0.32512486453416034.[0m
[32m[I 2022-12-30 07:39:34,820][0m Trial 518 finished with value: 0.2534371279273245 and parameters: {'hidden_size': 512, 'activation1': 'tanh', 'activation2': 'relu', 'dropout': 0.1, 'lr': 0.001, 'weight_decay': 3e-05, 'opt': 'RMSprop'}. Best is trial 323 with value: 0.32512486453416034.[0m
[32m[I 2022-12-30 07:39:43,043][0m Trial 519 finished with value: 0.3190363271821691 and parameters: {'hidden_size': 256, 'activation1': 'tanh', 'activation2': 'tanh', 'dropout': 0.1, 'lr': 0.001, 'weight_decay': 3e-05, 'opt': 'RMSprop'}. Best is trial 323 with value: 0.32512486453416034.[0m
[32m[I 2022-12-30 07:39:51,850][0m Trial 520 finished with value: 0.3213898059161354 and parameters: {'hidden_size': 512, 'activation1': 'tanh', 'activation2': 'tanh', 'dropout': 0.1, 'lr': 0.001, 'weight_decay': 3e-05, 'opt': 'RMSprop'}. Best is trial 323 with value: 0.32512486453416034.[0m
[32m[I 2022-12-30 07:40:00,524][0m Trial 521 finished with value: 0.32080853020339906 and parameters: {'hidden_size': 512, 'activation1': 'tanh', 'activation2': 'tanh', 'dropout': 0.1, 'lr': 0.001, 'weight_decay': 3e-05, 'opt': 'RMSprop'}. Best is trial 323 with value: 0.32512486453416034.[0m
[32m[I 2022-12-30 07:40:09,270][0m Trial 522 finished with value: 0.3216408101598658 and parameters: {'hidden_size': 512, 'activation1': 'tanh', 'activation2': 'tanh', 'dropout': 0.1, 'lr': 0.001, 'weight_decay': 3e-05, 'opt': 'RMSprop'}. Best is trial 323 with value: 0.32512486453416034.[0m
[32m[I 2022-12-30 07:40:17,369][0m Trial 523 finished with value: 0.30319989421063825 and parameters: {'hidden_size': 512, 'activation1': 'tanh', 'activation2': 'tanh', 'dropout': 0.1, 'lr': 0.001, 'weight_decay': 3e-05, 'opt': 'SGD'}. Best is trial 323 with value: 0.32512486453416034.[0m
[32m[I 2022-12-30 07:40:26,069][0m Trial 524 finished with value: 0.28621116313539013 and parameters: {'hidden_size': 512, 'activation1': 'tanh', 'activation2': 'tanh', 'dropout': 0.1, 'lr': 0.01, 'weight_decay': 3e-05, 'opt': 'RMSprop'}. Best is trial 323 with value: 0.32512486453416034.[0m
[32m[I 2022-12-30 07:40:34,805][0m Trial 525 finished with value: 0.31940235686583307 and parameters: {'hidden_size': 512, 'activation1': 'tanh', 'activation2': 'tanh', 'dropout': 0.2, 'lr': 0.001, 'weight_decay': 3e-05, 'opt': 'RMSprop'}. Best is trial 323 with value: 0.32512486453416034.[0m
[32m[I 2022-12-30 07:40:44,931][0m Trial 526 finished with value: 0.31358508720157807 and parameters: {'hidden_size': 512, 'activation1': 'tanh', 'activation2': 'tanh', 'dropout': 0.1, 'lr': 0.001, 'weight_decay': 3e-05, 'opt': 'Adam'}. Best is trial 323 with value: 0.32512486453416034.[0m
[32m[I 2022-12-30 07:40:53,669][0m Trial 527 finished with value: 0.30047758366163135 and parameters: {'hidden_size': 512, 'activation1': 'relu', 'activation2': 'tanh', 'dropout': 0.1, 'lr': 0.003, 'weight_decay': 3e-05, 'opt': 'RMSprop'}. Best is trial 323 with value: 0.32512486453416034.[0m
[32m[I 2022-12-30 07:41:02,363][0m Trial 528 finished with value: 0.32272594238266866 and parameters: {'hidden_size': 512, 'activation1': 'tanh', 'activation2': 'tanh', 'dropout': 0.1, 'lr': 0.001, 'weight_decay': 3e-05, 'opt': 'RMSprop'}. Best is trial 323 with value: 0.32512486453416034.[0m
[32m[I 2022-12-30 07:41:11,026][0m Trial 529 finished with value: 0.25278597324677615 and parameters: {'hidden_size': 512, 'activation1': 'tanh', 'activation2': 'sigmoid', 'dropout': 0.1, 'lr': 0.001, 'weight_decay': 3e-05, 'opt': 'RMSprop'}. Best is trial 323 with value: 0.32512486453416034.[0m
[32m[I 2022-12-30 07:41:19,726][0m Trial 530 finished with value: 0.32157409936443104 and parameters: {'hidden_size': 512, 'activation1': 'tanh', 'activation2': 'tanh', 'dropout': 0.1, 'lr': 0.001, 'weight_decay': 3e-05, 'opt': 'RMSprop'}. Best is trial 323 with value: 0.32512486453416034.[0m
[32m[I 2022-12-30 07:41:28,444][0m Trial 531 finished with value: 0.32165169976331304 and parameters: {'hidden_size': 512, 'activation1': 'tanh', 'activation2': 'tanh', 'dropout': 0.1, 'lr': 0.001, 'weight_decay': 3e-05, 'opt': 'RMSprop'}. Best is trial 323 with value: 0.32512486453416034.[0m
[32m[I 2022-12-30 07:41:37,371][0m Trial 532 finished with value: 0.3206630348893066 and parameters: {'hidden_size': 512, 'activation1': 'tanh', 'activation2': 'tanh', 'dropout': 0.1, 'lr': 0.001, 'weight_decay': 3e-05, 'opt': 'RMSprop'}. Best is trial 323 with value: 0.32512486453416034.[0m
[32m[I 2022-12-30 07:41:46,180][0m Trial 533 finished with value: 0.32185766422366513 and parameters: {'hidden_size': 512, 'activation1': 'tanh', 'activation2': 'tanh', 'dropout': 0.1, 'lr': 0.001, 'weight_decay': 3e-05, 'opt': 'RMSprop'}. Best is trial 323 with value: 0.32512486453416034.[0m
[32m[I 2022-12-30 07:41:54,915][0m Trial 534 finished with value: 0.3211983241369525 and parameters: {'hidden_size': 512, 'activation1': 'tanh', 'activation2': 'tanh', 'dropout': 0.1, 'lr': 0.001, 'weight_decay': 3e-05, 'opt': 'RMSprop'}. Best is trial 323 with value: 0.32512486453416034.[0m
[32m[I 2022-12-30 07:42:03,586][0m Trial 535 finished with value: 0.320758282653819 and parameters: {'hidden_size': 512, 'activation1': 'tanh', 'activation2': 'tanh', 'dropout': 0.1, 'lr': 0.001, 'weight_decay': 3e-05, 'opt': 'RMSprop'}. Best is trial 323 with value: 0.32512486453416034.[0m
[32m[I 2022-12-30 07:42:12,147][0m Trial 536 finished with value: 0.32115581696406403 and parameters: {'hidden_size': 512, 'activation1': 'tanh', 'activation2': 'tanh', 'dropout': 0.2, 'lr': 0.001, 'weight_decay': 3e-05, 'opt': 'RMSprop'}. Best is trial 323 with value: 0.32512486453416034.[0m
[32m[I 2022-12-30 07:42:20,453][0m Trial 537 finished with value: 0.3094863014160695 and parameters: {'hidden_size': 512, 'activation1': 'sigmoid', 'activation2': 'tanh', 'dropout': 0.1, 'lr': 0.001, 'weight_decay': 3e-05, 'opt': 'RMSprop'}. Best is trial 323 with value: 0.32512486453416034.[0m
[32m[I 2022-12-30 07:42:28,707][0m Trial 538 finished with value: 0.3212192822206654 and parameters: {'hidden_size': 512, 'activation1': 'tanh', 'activation2': 'tanh', 'dropout': 0.1, 'lr': 0.001, 'weight_decay': 3e-05, 'opt': 'RMSprop'}. Best is trial 323 with value: 0.32512486453416034.[0m
[32m[I 2022-12-30 07:42:36,945][0m Trial 539 finished with value: 0.32278015475147404 and parameters: {'hidden_size': 512, 'activation1': 'tanh', 'activation2': 'tanh', 'dropout': 0.1, 'lr': 0.001, 'weight_decay': 3e-05, 'opt': 'RMSprop'}. Best is trial 323 with value: 0.32512486453416034.[0m
[32m[I 2022-12-30 07:42:45,553][0m Trial 540 finished with value: 0.24234948941356427 and parameters: {'hidden_size': 128, 'activation1': 'tanh', 'activation2': 'relu', 'dropout': 0.1, 'lr': 0.001, 'weight_decay': 3e-05, 'opt': 'RMSprop'}. Best is trial 323 with value: 0.32512486453416034.[0m
[32m[I 2022-12-30 07:42:53,821][0m Trial 541 finished with value: 0.3210482251954704 and parameters: {'hidden_size': 512, 'activation1': 'tanh', 'activation2': 'tanh', 'dropout': 0.1, 'lr': 0.001, 'weight_decay': 3e-05, 'opt': 'RMSprop'}. Best is trial 323 with value: 0.32512486453416034.[0m
[32m[I 2022-12-30 07:43:02,021][0m Trial 542 finished with value: 0.32246981495314153 and parameters: {'hidden_size': 512, 'activation1': 'tanh', 'activation2': 'tanh', 'dropout': 0.1, 'lr': 0.001, 'weight_decay': 3e-05, 'opt': 'RMSprop'}. Best is trial 323 with value: 0.32512486453416034.[0m
[32m[I 2022-12-30 07:43:10,202][0m Trial 543 finished with value: 0.319941581303513 and parameters: {'hidden_size': 256, 'activation1': 'tanh', 'activation2': 'tanh', 'dropout': 0.1, 'lr': 0.001, 'weight_decay': 3e-05, 'opt': 'RMSprop'}. Best is trial 323 with value: 0.32512486453416034.[0m
[32m[I 2022-12-30 07:43:18,531][0m Trial 544 finished with value: 0.3211733827574243 and parameters: {'hidden_size': 512, 'activation1': 'tanh', 'activation2': 'tanh', 'dropout': 0.1, 'lr': 0.001, 'weight_decay': 3e-05, 'opt': 'RMSprop'}. Best is trial 323 with value: 0.32512486453416034.[0m
[32m[I 2022-12-30 07:43:25,610][0m Trial 545 finished with value: 0.08965195458197053 and parameters: {'hidden_size': 512, 'activation1': 'tanh', 'activation2': 'tanh', 'dropout': 0.1, 'lr': 0.01, 'weight_decay': 3e-05, 'opt': 'SGD'}. Best is trial 323 with value: 0.32512486453416034.[0m
[32m[I 2022-12-30 07:43:33,543][0m Trial 546 finished with value: 0.3224908464662516 and parameters: {'hidden_size': 512, 'activation1': 'tanh', 'activation2': 'tanh', 'dropout': 0, 'lr': 0.001, 'weight_decay': 3e-05, 'opt': 'RMSprop'}. Best is trial 323 with value: 0.32512486453416034.[0m
[32m[I 2022-12-30 07:43:43,162][0m Trial 547 finished with value: 0.3149715836265267 and parameters: {'hidden_size': 512, 'activation1': 'tanh', 'activation2': 'tanh', 'dropout': 0.1, 'lr': 0.001, 'weight_decay': 3e-05, 'opt': 'Adam'}. Best is trial 323 with value: 0.32512486453416034.[0m
[32m[I 2022-12-30 07:43:51,088][0m Trial 548 finished with value: 0.3229790022805849 and parameters: {'hidden_size': 512, 'activation1': 'tanh', 'activation2': 'tanh', 'dropout': 0, 'lr': 0.001, 'weight_decay': 3e-05, 'opt': 'RMSprop'}. Best is trial 323 with value: 0.32512486453416034.[0m
[32m[I 2022-12-30 07:43:59,346][0m Trial 549 finished with value: 0.3137007178131141 and parameters: {'hidden_size': 512, 'activation1': 'relu', 'activation2': 'tanh', 'dropout': 0.1, 'lr': 0.001, 'weight_decay': 1e-05, 'opt': 'RMSprop'}. Best is trial 323 with value: 0.32512486453416034.[0m
[32m[I 2022-12-30 07:44:07,121][0m Trial 550 finished with value: 0.303318556775805 and parameters: {'hidden_size': 512, 'activation1': 'tanh', 'activation2': 'tanh', 'dropout': 0, 'lr': 0.003, 'weight_decay': 3e-05, 'opt': 'RMSprop'}. Best is trial 323 with value: 0.32512486453416034.[0m
[32m[I 2022-12-30 07:44:15,329][0m Trial 551 finished with value: 0.25384106935866974 and parameters: {'hidden_size': 512, 'activation1': 'tanh', 'activation2': 'sigmoid', 'dropout': 0.1, 'lr': 0.001, 'weight_decay': 3e-05, 'opt': 'RMSprop'}. Best is trial 323 with value: 0.32512486453416034.[0m
[32m[I 2022-12-30 07:44:23,136][0m Trial 552 finished with value: 0.32297542497915205 and parameters: {'hidden_size': 512, 'activation1': 'tanh', 'activation2': 'tanh', 'dropout': 0, 'lr': 0.001, 'weight_decay': 3e-05, 'opt': 'RMSprop'}. Best is trial 323 with value: 0.32512486453416034.[0m
[32m[I 2022-12-30 07:44:31,274][0m Trial 553 finished with value: 0.3202948700900046 and parameters: {'hidden_size': 512, 'activation1': 'tanh', 'activation2': 'tanh', 'dropout': 0.2, 'lr': 0.001, 'weight_decay': 3e-05, 'opt': 'RMSprop'}. Best is trial 323 with value: 0.32512486453416034.[0m
[32m[I 2022-12-30 07:44:39,422][0m Trial 554 finished with value: 0.32157498483906977 and parameters: {'hidden_size': 512, 'activation1': 'tanh', 'activation2': 'tanh', 'dropout': 0.1, 'lr': 0.001, 'weight_decay': 3e-05, 'opt': 'RMSprop'}. Best is trial 323 with value: 0.32512486453416034.[0m
[32m[I 2022-12-30 07:44:47,303][0m Trial 555 finished with value: 0.3227486337868687 and parameters: {'hidden_size': 512, 'activation1': 'tanh', 'activation2': 'tanh', 'dropout': 0, 'lr': 0.001, 'weight_decay': 3e-05, 'opt': 'RMSprop'}. Best is trial 323 with value: 0.32512486453416034.[0m
[32m[I 2022-12-30 07:44:55,493][0m Trial 556 finished with value: 0.3202859015228017 and parameters: {'hidden_size': 512, 'activation1': 'tanh', 'activation2': 'tanh', 'dropout': 0.1, 'lr': 0.001, 'weight_decay': 3e-05, 'opt': 'RMSprop'}. Best is trial 323 with value: 0.32512486453416034.[0m
[32m[I 2022-12-30 07:45:03,400][0m Trial 557 finished with value: 0.3215457236432656 and parameters: {'hidden_size': 512, 'activation1': 'tanh', 'activation2': 'tanh', 'dropout': 0, 'lr': 0.001, 'weight_decay': 3e-05, 'opt': 'RMSprop'}. Best is trial 323 with value: 0.32512486453416034.[0m
[32m[I 2022-12-30 07:45:11,648][0m Trial 558 finished with value: 0.3215764138477332 and parameters: {'hidden_size': 512, 'activation1': 'tanh', 'activation2': 'tanh', 'dropout': 0.1, 'lr': 0.001, 'weight_decay': 3e-05, 'opt': 'RMSprop'}. Best is trial 323 with value: 0.32512486453416034.[0m
[32m[I 2022-12-30 07:45:19,953][0m Trial 559 finished with value: 0.3217686518501293 and parameters: {'hidden_size': 512, 'activation1': 'tanh', 'activation2': 'tanh', 'dropout': 0.1, 'lr': 0.001, 'weight_decay': 3e-05, 'opt': 'RMSprop'}. Best is trial 323 with value: 0.32512486453416034.[0m
[32m[I 2022-12-30 07:45:27,995][0m Trial 560 finished with value: 0.32257775096991537 and parameters: {'hidden_size': 512, 'activation1': 'tanh', 'activation2': 'tanh', 'dropout': 0, 'lr': 0.001, 'weight_decay': 3e-05, 'opt': 'RMSprop'}. Best is trial 323 with value: 0.32512486453416034.[0m
[32m[I 2022-12-30 07:45:36,227][0m Trial 561 finished with value: 0.32108377753376055 and parameters: {'hidden_size': 512, 'activation1': 'tanh', 'activation2': 'tanh', 'dropout': 0.1, 'lr': 0.001, 'weight_decay': 1e-05, 'opt': 'RMSprop'}. Best is trial 323 with value: 0.32512486453416034.[0m
[32m[I 2022-12-30 07:45:44,299][0m Trial 562 finished with value: 0.31007059307337004 and parameters: {'hidden_size': 512, 'activation1': 'sigmoid', 'activation2': 'tanh', 'dropout': 0, 'lr': 0.001, 'weight_decay': 3e-05, 'opt': 'RMSprop'}. Best is trial 323 with value: 0.32512486453416034.[0m
[32m[I 2022-12-30 07:45:52,581][0m Trial 563 finished with value: 0.3113478264978359 and parameters: {'hidden_size': 128, 'activation1': 'tanh', 'activation2': 'tanh', 'dropout': 0.1, 'lr': 0.001, 'weight_decay': 3e-05, 'opt': 'RMSprop'}. Best is trial 323 with value: 0.32512486453416034.[0m
[32m[I 2022-12-30 07:46:00,616][0m Trial 564 finished with value: 0.32208498590216383 and parameters: {'hidden_size': 512, 'activation1': 'tanh', 'activation2': 'tanh', 'dropout': 0, 'lr': 0.001, 'weight_decay': 3e-05, 'opt': 'RMSprop'}. Best is trial 323 with value: 0.32512486453416034.[0m
[32m[I 2022-12-30 07:46:09,108][0m Trial 565 finished with value: 0.25325483500256396 and parameters: {'hidden_size': 512, 'activation1': 'tanh', 'activation2': 'relu', 'dropout': 0.1, 'lr': 0.001, 'weight_decay': 3e-05, 'opt': 'RMSprop'}. Best is trial 323 with value: 0.32512486453416034.[0m
[32m[I 2022-12-30 07:46:17,092][0m Trial 566 finished with value: 0.3200685976915447 and parameters: {'hidden_size': 256, 'activation1': 'tanh', 'activation2': 'tanh', 'dropout': 0, 'lr': 0.001, 'weight_decay': 3e-05, 'opt': 'RMSprop'}. Best is trial 323 with value: 0.32512486453416034.[0m
[32m[I 2022-12-30 07:46:25,366][0m Trial 567 finished with value: 0.3218581039804019 and parameters: {'hidden_size': 512, 'activation1': 'tanh', 'activation2': 'tanh', 'dropout': 0.1, 'lr': 0.001, 'weight_decay': 3e-05, 'opt': 'RMSprop'}. Best is trial 323 with value: 0.32512486453416034.[0m
[32m[I 2022-12-30 07:46:32,048][0m Trial 568 finished with value: 0.04942932068041343 and parameters: {'hidden_size': 512, 'activation1': 'tanh', 'activation2': 'tanh', 'dropout': 0, 'lr': 0.01, 'weight_decay': 3e-05, 'opt': 'SGD'}. Best is trial 323 with value: 0.32512486453416034.[0m
[32m[I 2022-12-30 07:46:41,465][0m Trial 569 finished with value: 0.3143752783863555 and parameters: {'hidden_size': 512, 'activation1': 'tanh', 'activation2': 'tanh', 'dropout': 0.1, 'lr': 0.001, 'weight_decay': 3e-05, 'opt': 'Adam'}. Best is trial 323 with value: 0.32512486453416034.[0m
[32m[I 2022-12-30 07:46:49,754][0m Trial 570 finished with value: 0.3217072940387848 and parameters: {'hidden_size': 512, 'activation1': 'tanh', 'activation2': 'tanh', 'dropout': 0.1, 'lr': 0.001, 'weight_decay': 3e-05, 'opt': 'RMSprop'}. Best is trial 323 with value: 0.32512486453416034.[0m
[32m[I 2022-12-30 07:46:57,986][0m Trial 571 finished with value: 0.31459277263421204 and parameters: {'hidden_size': 512, 'activation1': 'relu', 'activation2': 'tanh', 'dropout': 0, 'lr': 0.001, 'weight_decay': 3e-05, 'opt': 'RMSprop'}. Best is trial 323 with value: 0.32512486453416034.[0m
[32m[I 2022-12-30 07:47:06,313][0m Trial 572 finished with value: 0.32264898286262894 and parameters: {'hidden_size': 512, 'activation1': 'tanh', 'activation2': 'tanh', 'dropout': 0.1, 'lr': 0.001, 'weight_decay': 3e-05, 'opt': 'RMSprop'}. Best is trial 323 with value: 0.32512486453416034.[0m
[32m[I 2022-12-30 07:47:14,188][0m Trial 573 finished with value: 0.32217328481205676 and parameters: {'hidden_size': 512, 'activation1': 'tanh', 'activation2': 'tanh', 'dropout': 0, 'lr': 0.001, 'weight_decay': 1e-05, 'opt': 'RMSprop'}. Best is trial 323 with value: 0.32512486453416034.[0m
[32m[I 2022-12-30 07:47:22,417][0m Trial 574 finished with value: 0.2500161170119513 and parameters: {'hidden_size': 512, 'activation1': 'tanh', 'activation2': 'sigmoid', 'dropout': 0.1, 'lr': 0.003, 'weight_decay': 3e-05, 'opt': 'RMSprop'}. Best is trial 323 with value: 0.32512486453416034.[0m
[32m[I 2022-12-30 07:47:30,316][0m Trial 575 finished with value: 0.3225772013412305 and parameters: {'hidden_size': 512, 'activation1': 'tanh', 'activation2': 'tanh', 'dropout': 0, 'lr': 0.001, 'weight_decay': 3e-05, 'opt': 'RMSprop'}. Best is trial 323 with value: 0.32512486453416034.[0m
[32m[I 2022-12-30 07:47:38,514][0m Trial 576 finished with value: 0.3227423078366859 and parameters: {'hidden_size': 512, 'activation1': 'tanh', 'activation2': 'tanh', 'dropout': 0.1, 'lr': 0.001, 'weight_decay': 3e-05, 'opt': 'RMSprop'}. Best is trial 323 with value: 0.32512486453416034.[0m
[32m[I 2022-12-30 07:47:46,494][0m Trial 577 finished with value: 0.322651962332756 and parameters: {'hidden_size': 512, 'activation1': 'tanh', 'activation2': 'tanh', 'dropout': 0, 'lr': 0.001, 'weight_decay': 3e-05, 'opt': 'RMSprop'}. Best is trial 323 with value: 0.32512486453416034.[0m
[32m[I 2022-12-30 07:47:54,721][0m Trial 578 finished with value: 0.3209906940566847 and parameters: {'hidden_size': 512, 'activation1': 'tanh', 'activation2': 'tanh', 'dropout': 0.1, 'lr': 0.001, 'weight_decay': 3e-05, 'opt': 'RMSprop'}. Best is trial 323 with value: 0.32512486453416034.[0m
[32m[I 2022-12-30 07:48:02,870][0m Trial 579 finished with value: 0.3194544677940766 and parameters: {'hidden_size': 512, 'activation1': 'tanh', 'activation2': 'tanh', 'dropout': 0.2, 'lr': 0.001, 'weight_decay': 3e-05, 'opt': 'RMSprop'}. Best is trial 323 with value: 0.32512486453416034.[0m
[32m[I 2022-12-30 07:48:11,052][0m Trial 580 finished with value: 0.3238463776494451 and parameters: {'hidden_size': 512, 'activation1': 'tanh', 'activation2': 'tanh', 'dropout': 0.1, 'lr': 0.001, 'weight_decay': 3e-05, 'opt': 'RMSprop'}. Best is trial 323 with value: 0.32512486453416034.[0m
[32m[I 2022-12-30 07:48:19,273][0m Trial 581 finished with value: 0.325109208072295 and parameters: {'hidden_size': 512, 'activation1': 'tanh', 'activation2': 'tanh', 'dropout': 0.1, 'lr': 0.001, 'weight_decay': 3e-05, 'opt': 'RMSprop'}. Best is trial 323 with value: 0.32512486453416034.[0m
[32m[I 2022-12-30 07:48:27,570][0m Trial 582 finished with value: 0.3101184183240602 and parameters: {'hidden_size': 512, 'activation1': 'sigmoid', 'activation2': 'tanh', 'dropout': 0.1, 'lr': 0.001, 'weight_decay': 3e-05, 'opt': 'RMSprop'}. Best is trial 323 with value: 0.32512486453416034.[0m
[32m[I 2022-12-30 07:48:35,784][0m Trial 583 finished with value: 0.321172094977568 and parameters: {'hidden_size': 512, 'activation1': 'tanh', 'activation2': 'tanh', 'dropout': 0.1, 'lr': 0.001, 'weight_decay': 3e-05, 'opt': 'RMSprop'}. Best is trial 323 with value: 0.32512486453416034.[0m
[32m[I 2022-12-30 07:48:44,000][0m Trial 584 finished with value: 0.32148760753670197 and parameters: {'hidden_size': 512, 'activation1': 'tanh', 'activation2': 'tanh', 'dropout': 0.1, 'lr': 0.001, 'weight_decay': 3e-05, 'opt': 'RMSprop'}. Best is trial 323 with value: 0.32512486453416034.[0m
[32m[I 2022-12-30 07:48:52,242][0m Trial 585 finished with value: 0.25274941778561094 and parameters: {'hidden_size': 512, 'activation1': 'tanh', 'activation2': 'relu', 'dropout': 0.1, 'lr': 0.001, 'weight_decay': 3e-05, 'opt': 'RMSprop'}. Best is trial 323 with value: 0.32512486453416034.[0m
[32m[I 2022-12-30 07:49:00,464][0m Trial 586 finished with value: 0.3222225885258526 and parameters: {'hidden_size': 512, 'activation1': 'tanh', 'activation2': 'tanh', 'dropout': 0.1, 'lr': 0.001, 'weight_decay': 1e-05, 'opt': 'RMSprop'}. Best is trial 323 with value: 0.32512486453416034.[0m
[32m[I 2022-12-30 07:49:08,624][0m Trial 587 finished with value: 0.3226318932882214 and parameters: {'hidden_size': 512, 'activation1': 'tanh', 'activation2': 'tanh', 'dropout': 0.1, 'lr': 0.001, 'weight_decay': 3e-05, 'opt': 'RMSprop'}. Best is trial 323 with value: 0.32512486453416034.[0m
[32m[I 2022-12-30 07:49:16,950][0m Trial 588 finished with value: 0.3195995134723676 and parameters: {'hidden_size': 256, 'activation1': 'tanh', 'activation2': 'tanh', 'dropout': 0.1, 'lr': 0.001, 'weight_decay': 3e-05, 'opt': 'RMSprop'}. Best is trial 323 with value: 0.32512486453416034.[0m
[32m[I 2022-12-30 07:49:24,380][0m Trial 589 finished with value: 0.3051878206173836 and parameters: {'hidden_size': 512, 'activation1': 'tanh', 'activation2': 'tanh', 'dropout': 0.1, 'lr': 0.001, 'weight_decay': 3e-05, 'opt': 'SGD'}. Best is trial 323 with value: 0.32512486453416034.[0m
[32m[I 2022-12-30 07:49:32,858][0m Trial 590 finished with value: 0.31314272763257245 and parameters: {'hidden_size': 128, 'activation1': 'tanh', 'activation2': 'tanh', 'dropout': 0.1, 'lr': 0.001, 'weight_decay': 3e-05, 'opt': 'RMSprop'}. Best is trial 323 with value: 0.32512486453416034.[0m
