[32m[I 2022-12-30 07:29:19,411][0m Trial 443 finished with value: 0.3219085609465181 and parameters: {'hidden_size': 512, 'activation1': 'tanh', 'activation2': 'tanh', 'dropout': 0, 'lr': 0.001, 'weight_decay': 3e-05, 'opt': 'RMSprop'}. Best is trial 323 with value: 0.32512486453416034.[0m
[32m[I 2022-12-30 07:29:27,359][0m Trial 444 finished with value: 0.3226016746191978 and parameters: {'hidden_size': 512, 'activation1': 'tanh', 'activation2': 'tanh', 'dropout': 0, 'lr': 0.001, 'weight_decay': 3e-05, 'opt': 'RMSprop'}. Best is trial 323 with value: 0.32512486453416034.[0m
[32m[I 2022-12-30 07:29:35,402][0m Trial 445 finished with value: 0.3217855441970262 and parameters: {'hidden_size': 512, 'activation1': 'tanh', 'activation2': 'tanh', 'dropout': 0, 'lr': 0.001, 'weight_decay': 3e-05, 'opt': 'RMSprop'}. Best is trial 323 with value: 0.32512486453416034.[0m
[32m[I 2022-12-30 07:29:43,407][0m Trial 446 finished with value: 0.3073390357825844 and parameters: {'hidden_size': 128, 'activation1': 'tanh', 'activation2': 'tanh', 'dropout': 0, 'lr': 0.001, 'weight_decay': 3e-05, 'opt': 'RMSprop'}. Best is trial 323 with value: 0.32512486453416034.[0m
[32m[I 2022-12-30 07:29:51,392][0m Trial 447 finished with value: 0.3233430286093368 and parameters: {'hidden_size': 512, 'activation1': 'tanh', 'activation2': 'tanh', 'dropout': 0, 'lr': 0.001, 'weight_decay': 3e-05, 'opt': 'RMSprop'}. Best is trial 323 with value: 0.32512486453416034.[0m
[32m[I 2022-12-30 07:29:59,432][0m Trial 448 finished with value: 0.320598797210768 and parameters: {'hidden_size': 256, 'activation1': 'tanh', 'activation2': 'tanh', 'dropout': 0, 'lr': 0.001, 'weight_decay': 3e-05, 'opt': 'RMSprop'}. Best is trial 323 with value: 0.32512486453416034.[0m
[32m[I 2022-12-30 07:30:07,549][0m Trial 449 finished with value: 0.3099303205464762 and parameters: {'hidden_size': 512, 'activation1': 'sigmoid', 'activation2': 'tanh', 'dropout': 0, 'lr': 0.001, 'weight_decay': 3e-05, 'opt': 'RMSprop'}. Best is trial 323 with value: 0.32512486453416034.[0m
[32m[I 2022-12-30 07:30:15,474][0m Trial 450 finished with value: 0.27906855078714676 and parameters: {'hidden_size': 512, 'activation1': 'tanh', 'activation2': 'tanh', 'dropout': 0, 'lr': 0.01, 'weight_decay': 3e-05, 'opt': 'RMSprop'}. Best is trial 323 with value: 0.32512486453416034.[0m
[32m[I 2022-12-30 07:30:23,754][0m Trial 451 finished with value: 0.3200474280206471 and parameters: {'hidden_size': 512, 'activation1': 'tanh', 'activation2': 'tanh', 'dropout': 0.2, 'lr': 0.001, 'weight_decay': 3e-05, 'opt': 'RMSprop'}. Best is trial 323 with value: 0.32512486453416034.[0m
[32m[I 2022-12-30 07:30:31,695][0m Trial 452 finished with value: 0.32214515494853113 and parameters: {'hidden_size': 512, 'activation1': 'tanh', 'activation2': 'tanh', 'dropout': 0, 'lr': 0.001, 'weight_decay': 3e-05, 'opt': 'RMSprop'}. Best is trial 323 with value: 0.32512486453416034.[0m
[32m[I 2022-12-30 07:30:39,748][0m Trial 453 finished with value: 0.25465249198741224 and parameters: {'hidden_size': 512, 'activation1': 'tanh', 'activation2': 'relu', 'dropout': 0, 'lr': 0.001, 'weight_decay': 3e-05, 'opt': 'RMSprop'}. Best is trial 323 with value: 0.32512486453416034.[0m
[32m[I 2022-12-30 07:30:47,785][0m Trial 454 finished with value: 0.3223112487645472 and parameters: {'hidden_size': 512, 'activation1': 'tanh', 'activation2': 'tanh', 'dropout': 0, 'lr': 0.001, 'weight_decay': 3e-05, 'opt': 'RMSprop'}. Best is trial 323 with value: 0.32512486453416034.[0m
[32m[I 2022-12-30 07:30:55,379][0m Trial 455 finished with value: 0.3044874537850661 and parameters: {'hidden_size': 512, 'activation1': 'tanh', 'activation2': 'tanh', 'dropout': 0, 'lr': 0.001, 'weight_decay': 3e-05, 'opt': 'SGD'}. Best is trial 323 with value: 0.32512486453416034.[0m
[32m[I 2022-12-30 07:31:03,306][0m Trial 456 finished with value: 0.3124500156245567 and parameters: {'hidden_size': 512, 'activation1': 'tanh', 'activation2': 'tanh', 'dropout': 0, 'lr': 0.003, 'weight_decay': 3e-05, 'opt': 'RMSprop'}. Best is trial 323 with value: 0.32512486453416034.[0m
[32m[I 2022-12-30 07:31:11,265][0m Trial 457 finished with value: 0.32275145538650774 and parameters: {'hidden_size': 512, 'activation1': 'tanh', 'activation2': 'tanh', 'dropout': 0, 'lr': 0.001, 'weight_decay': 3e-05, 'opt': 'RMSprop'}. Best is trial 323 with value: 0.32512486453416034.[0m
[32m[I 2022-12-30 07:31:19,262][0m Trial 458 finished with value: 0.32303424367060096 and parameters: {'hidden_size': 512, 'activation1': 'tanh', 'activation2': 'tanh', 'dropout': 0, 'lr': 0.001, 'weight_decay': 3e-05, 'opt': 'RMSprop'}. Best is trial 323 with value: 0.32512486453416034.[0m
[32m[I 2022-12-30 07:31:28,573][0m Trial 459 finished with value: 0.30739230940077505 and parameters: {'hidden_size': 512, 'activation1': 'relu', 'activation2': 'tanh', 'dropout': 0, 'lr': 0.001, 'weight_decay': 3e-05, 'opt': 'Adam'}. Best is trial 323 with value: 0.32512486453416034.[0m
[32m[I 2022-12-30 07:31:36,536][0m Trial 460 finished with value: 0.3225638476589372 and parameters: {'hidden_size': 512, 'activation1': 'tanh', 'activation2': 'tanh', 'dropout': 0, 'lr': 0.001, 'weight_decay': 3e-05, 'opt': 'RMSprop'}. Best is trial 323 with value: 0.32512486453416034.[0m
[32m[I 2022-12-30 07:31:44,498][0m Trial 461 finished with value: 0.3232180577801738 and parameters: {'hidden_size': 512, 'activation1': 'tanh', 'activation2': 'tanh', 'dropout': 0, 'lr': 0.001, 'weight_decay': 3e-05, 'opt': 'RMSprop'}. Best is trial 323 with value: 0.32512486453416034.[0m
[32m[I 2022-12-30 07:31:52,535][0m Trial 462 finished with value: 0.2547762277105951 and parameters: {'hidden_size': 512, 'activation1': 'tanh', 'activation2': 'sigmoid', 'dropout': 0, 'lr': 0.001, 'weight_decay': 3e-05, 'opt': 'RMSprop'}. Best is trial 323 with value: 0.32512486453416034.[0m
[32m[I 2022-12-30 07:32:00,498][0m Trial 463 finished with value: 0.32326051349852564 and parameters: {'hidden_size': 512, 'activation1': 'tanh', 'activation2': 'tanh', 'dropout': 0, 'lr': 0.001, 'weight_decay': 3e-05, 'opt': 'RMSprop'}. Best is trial 323 with value: 0.32512486453416034.[0m
[32m[I 2022-12-30 07:32:08,518][0m Trial 464 finished with value: 0.32102113965550433 and parameters: {'hidden_size': 512, 'activation1': 'tanh', 'activation2': 'tanh', 'dropout': 0, 'lr': 0.001, 'weight_decay': 3e-05, 'opt': 'RMSprop'}. Best is trial 323 with value: 0.32512486453416034.[0m
[32m[I 2022-12-30 07:32:16,485][0m Trial 465 finished with value: 0.32186526765339546 and parameters: {'hidden_size': 512, 'activation1': 'tanh', 'activation2': 'tanh', 'dropout': 0, 'lr': 0.001, 'weight_decay': 3e-05, 'opt': 'RMSprop'}. Best is trial 323 with value: 0.32512486453416034.[0m
[32m[I 2022-12-30 07:32:24,719][0m Trial 466 finished with value: 0.32052991735072905 and parameters: {'hidden_size': 512, 'activation1': 'tanh', 'activation2': 'tanh', 'dropout': 0.2, 'lr': 0.001, 'weight_decay': 3e-05, 'opt': 'RMSprop'}. Best is trial 323 with value: 0.32512486453416034.[0m
[32m[I 2022-12-30 07:32:32,626][0m Trial 467 finished with value: 0.32206319141895134 and parameters: {'hidden_size': 512, 'activation1': 'tanh', 'activation2': 'tanh', 'dropout': 0, 'lr': 0.001, 'weight_decay': 3e-05, 'opt': 'RMSprop'}. Best is trial 323 with value: 0.32512486453416034.[0m
[32m[I 2022-12-30 07:32:40,564][0m Trial 468 finished with value: 0.3227959983257752 and parameters: {'hidden_size': 512, 'activation1': 'tanh', 'activation2': 'tanh', 'dropout': 0, 'lr': 0.001, 'weight_decay': 3e-05, 'opt': 'RMSprop'}. Best is trial 323 with value: 0.32512486453416034.[0m
[32m[I 2022-12-30 07:32:48,566][0m Trial 469 finished with value: 0.3096846169968096 and parameters: {'hidden_size': 128, 'activation1': 'tanh', 'activation2': 'tanh', 'dropout': 0, 'lr': 0.001, 'weight_decay': 3e-05, 'opt': 'RMSprop'}. Best is trial 323 with value: 0.32512486453416034.[0m
[32m[I 2022-12-30 07:32:56,602][0m Trial 470 finished with value: 0.3089671894479558 and parameters: {'hidden_size': 512, 'activation1': 'sigmoid', 'activation2': 'tanh', 'dropout': 0, 'lr': 0.001, 'weight_decay': 3e-05, 'opt': 'RMSprop'}. Best is trial 323 with value: 0.32512486453416034.[0m
[32m[I 2022-12-30 07:33:04,636][0m Trial 471 finished with value: 0.32335033815348696 and parameters: {'hidden_size': 512, 'activation1': 'tanh', 'activation2': 'tanh', 'dropout': 0, 'lr': 0.001, 'weight_decay': 3e-05, 'opt': 'RMSprop'}. Best is trial 323 with value: 0.32512486453416034.[0m
[32m[I 2022-12-30 07:33:12,704][0m Trial 472 finished with value: 0.32239833618900854 and parameters: {'hidden_size': 512, 'activation1': 'tanh', 'activation2': 'tanh', 'dropout': 0, 'lr': 0.001, 'weight_decay': 3e-05, 'opt': 'RMSprop'}. Best is trial 323 with value: 0.32512486453416034.[0m
[32m[I 2022-12-30 07:33:20,778][0m Trial 473 finished with value: 0.320892715730301 and parameters: {'hidden_size': 256, 'activation1': 'tanh', 'activation2': 'tanh', 'dropout': 0, 'lr': 0.001, 'weight_decay': 3e-05, 'opt': 'RMSprop'}. Best is trial 323 with value: 0.32512486453416034.[0m
[32m[I 2022-12-30 07:33:28,853][0m Trial 474 finished with value: 0.24996830960727792 and parameters: {'hidden_size': 512, 'activation1': 'tanh', 'activation2': 'relu', 'dropout': 0, 'lr': 0.01, 'weight_decay': 3e-05, 'opt': 'RMSprop'}. Best is trial 323 with value: 0.32512486453416034.[0m
[32m[I 2022-12-30 07:33:36,865][0m Trial 475 finished with value: 0.32095789189499924 and parameters: {'hidden_size': 512, 'activation1': 'tanh', 'activation2': 'tanh', 'dropout': 0, 'lr': 0.001, 'weight_decay': 3e-05, 'opt': 'RMSprop'}. Best is trial 323 with value: 0.32512486453416034.[0m
[32m[I 2022-12-30 07:33:44,944][0m Trial 476 finished with value: 0.3215671193560649 and parameters: {'hidden_size': 512, 'activation1': 'tanh', 'activation2': 'tanh', 'dropout': 0, 'lr': 0.001, 'weight_decay': 3e-05, 'opt': 'RMSprop'}. Best is trial 323 with value: 0.32512486453416034.[0m
[32m[I 2022-12-30 07:33:53,026][0m Trial 477 finished with value: 0.3225456986065277 and parameters: {'hidden_size': 512, 'activation1': 'tanh', 'activation2': 'tanh', 'dropout': 0, 'lr': 0.001, 'weight_decay': 3e-05, 'opt': 'RMSprop'}. Best is trial 323 with value: 0.32512486453416034.[0m
[32m[I 2022-12-30 07:34:01,352][0m Trial 478 finished with value: 0.32374835614662445 and parameters: {'hidden_size': 512, 'activation1': 'tanh', 'activation2': 'tanh', 'dropout': 0.1, 'lr': 0.001, 'weight_decay': 3e-05, 'opt': 'RMSprop'}. Best is trial 323 with value: 0.32512486453416034.[0m
[32m[I 2022-12-30 07:34:08,875][0m Trial 479 finished with value: 0.3039314725838974 and parameters: {'hidden_size': 512, 'activation1': 'tanh', 'activation2': 'tanh', 'dropout': 0.1, 'lr': 0.001, 'weight_decay': 3e-05, 'opt': 'SGD'}. Best is trial 323 with value: 0.32512486453416034.[0m
[32m[I 2022-12-30 07:34:17,312][0m Trial 480 finished with value: 0.3069291323260039 and parameters: {'hidden_size': 512, 'activation1': 'tanh', 'activation2': 'tanh', 'dropout': 0.1, 'lr': 0.003, 'weight_decay': 3e-05, 'opt': 'RMSprop'}. Best is trial 323 with value: 0.32512486453416034.[0m
[32m[I 2022-12-30 07:34:26,649][0m Trial 481 finished with value: 0.3121854967959405 and parameters: {'hidden_size': 512, 'activation1': 'tanh', 'activation2': 'tanh', 'dropout': 0.1, 'lr': 0.001, 'weight_decay': 3e-05, 'opt': 'Adam'}. Best is trial 323 with value: 0.32512486453416034.[0m
[32m[I 2022-12-30 07:34:35,031][0m Trial 482 finished with value: 0.3140735311572288 and parameters: {'hidden_size': 512, 'activation1': 'relu', 'activation2': 'tanh', 'dropout': 0.1, 'lr': 0.001, 'weight_decay': 3e-05, 'opt': 'RMSprop'}. Best is trial 323 with value: 0.32512486453416034.[0m
[32m[I 2022-12-30 07:34:43,258][0m Trial 483 finished with value: 0.3226484686559388 and parameters: {'hidden_size': 512, 'activation1': 'tanh', 'activation2': 'tanh', 'dropout': 0.1, 'lr': 0.001, 'weight_decay': 3e-05, 'opt': 'RMSprop'}. Best is trial 323 with value: 0.32512486453416034.[0m
[32m[I 2022-12-30 07:34:51,630][0m Trial 484 finished with value: 0.25258138992369095 and parameters: {'hidden_size': 512, 'activation1': 'tanh', 'activation2': 'sigmoid', 'dropout': 0.1, 'lr': 0.001, 'weight_decay': 3e-05, 'opt': 'RMSprop'}. Best is trial 323 with value: 0.32512486453416034.[0m
[32m[I 2022-12-30 07:34:59,868][0m Trial 485 finished with value: 0.3227260336692993 and parameters: {'hidden_size': 512, 'activation1': 'tanh', 'activation2': 'tanh', 'dropout': 0.1, 'lr': 0.001, 'weight_decay': 3e-05, 'opt': 'RMSprop'}. Best is trial 323 with value: 0.32512486453416034.[0m
[32m[I 2022-12-30 07:35:08,123][0m Trial 486 finished with value: 0.3232760399190565 and parameters: {'hidden_size': 512, 'activation1': 'tanh', 'activation2': 'tanh', 'dropout': 0.1, 'lr': 0.001, 'weight_decay': 3e-05, 'opt': 'RMSprop'}. Best is trial 323 with value: 0.32512486453416034.[0m
[32m[I 2022-12-30 07:35:16,368][0m Trial 487 finished with value: 0.32353081006031326 and parameters: {'hidden_size': 512, 'activation1': 'tanh', 'activation2': 'tanh', 'dropout': 0.1, 'lr': 0.001, 'weight_decay': 3e-05, 'opt': 'RMSprop'}. Best is trial 323 with value: 0.32512486453416034.[0m
[32m[I 2022-12-30 07:35:24,651][0m Trial 488 finished with value: 0.32181993635858436 and parameters: {'hidden_size': 512, 'activation1': 'tanh', 'activation2': 'tanh', 'dropout': 0.1, 'lr': 0.001, 'weight_decay': 3e-05, 'opt': 'RMSprop'}. Best is trial 323 with value: 0.32512486453416034.[0m
[32m[I 2022-12-30 07:35:33,044][0m Trial 489 finished with value: 0.3209296203256781 and parameters: {'hidden_size': 512, 'activation1': 'tanh', 'activation2': 'tanh', 'dropout': 0.1, 'lr': 0.001, 'weight_decay': 3e-05, 'opt': 'RMSprop'}. Best is trial 323 with value: 0.32512486453416034.[0m
[32m[I 2022-12-30 07:35:41,341][0m Trial 490 finished with value: 0.32415325512858506 and parameters: {'hidden_size': 512, 'activation1': 'tanh', 'activation2': 'tanh', 'dropout': 0.1, 'lr': 0.001, 'weight_decay': 3e-05, 'opt': 'RMSprop'}. Best is trial 323 with value: 0.32512486453416034.[0m
[32m[I 2022-12-30 07:35:49,651][0m Trial 491 finished with value: 0.3205609332861126 and parameters: {'hidden_size': 512, 'activation1': 'tanh', 'activation2': 'tanh', 'dropout': 0.1, 'lr': 0.001, 'weight_decay': 3e-05, 'opt': 'RMSprop'}. Best is trial 323 with value: 0.32512486453416034.[0m
[32m[I 2022-12-30 07:35:57,953][0m Trial 492 finished with value: 0.32294084726855443 and parameters: {'hidden_size': 512, 'activation1': 'tanh', 'activation2': 'tanh', 'dropout': 0.1, 'lr': 0.001, 'weight_decay': 3e-05, 'opt': 'RMSprop'}. Best is trial 323 with value: 0.32512486453416034.[0m
[32m[I 2022-12-30 07:36:06,511][0m Trial 493 finished with value: 0.32177289529454917 and parameters: {'hidden_size': 512, 'activation1': 'tanh', 'activation2': 'tanh', 'dropout': 0.1, 'lr': 0.001, 'weight_decay': 3e-05, 'opt': 'RMSprop'}. Best is trial 323 with value: 0.32512486453416034.[0m
[32m[I 2022-12-30 07:36:15,308][0m Trial 494 finished with value: 0.30139955634341087 and parameters: {'hidden_size': 128, 'activation1': 'sigmoid', 'activation2': 'tanh', 'dropout': 0.1, 'lr': 0.001, 'weight_decay': 3e-05, 'opt': 'RMSprop'}. Best is trial 323 with value: 0.32512486453416034.[0m
[32m[I 2022-12-30 07:36:23,882][0m Trial 495 finished with value: 0.3201558553667908 and parameters: {'hidden_size': 256, 'activation1': 'tanh', 'activation2': 'tanh', 'dropout': 0.1, 'lr': 0.001, 'weight_decay': 3e-05, 'opt': 'RMSprop'}. Best is trial 323 with value: 0.32512486453416034.[0m
[32m[I 2022-12-30 07:36:32,336][0m Trial 496 finished with value: 0.25335835859763767 and parameters: {'hidden_size': 512, 'activation1': 'tanh', 'activation2': 'relu', 'dropout': 0.1, 'lr': 0.001, 'weight_decay': 3e-05, 'opt': 'RMSprop'}. Best is trial 323 with value: 0.32512486453416034.[0m
[32m[I 2022-12-30 07:36:40,553][0m Trial 497 finished with value: 0.3230638935935658 and parameters: {'hidden_size': 512, 'activation1': 'tanh', 'activation2': 'tanh', 'dropout': 0.1, 'lr': 0.001, 'weight_decay': 3e-05, 'opt': 'RMSprop'}. Best is trial 323 with value: 0.32512486453416034.[0m
[32m[I 2022-12-30 07:36:48,755][0m Trial 498 finished with value: 0.2746881457677466 and parameters: {'hidden_size': 512, 'activation1': 'tanh', 'activation2': 'tanh', 'dropout': 0.1, 'lr': 0.01, 'weight_decay': 3e-05, 'opt': 'RMSprop'}. Best is trial 323 with value: 0.32512486453416034.[0m
[32m[I 2022-12-30 07:36:57,002][0m Trial 499 finished with value: 0.322839282182637 and parameters: {'hidden_size': 512, 'activation1': 'tanh', 'activation2': 'tanh', 'dropout': 0.1, 'lr': 0.001, 'weight_decay': 3e-05, 'opt': 'RMSprop'}. Best is trial 323 with value: 0.32512486453416034.[0m
[32m[I 2022-12-30 07:37:04,509][0m Trial 500 finished with value: 0.302395481522067 and parameters: {'hidden_size': 512, 'activation1': 'tanh', 'activation2': 'tanh', 'dropout': 0.1, 'lr': 0.001, 'weight_decay': 3e-05, 'opt': 'SGD'}. Best is trial 323 with value: 0.32512486453416034.[0m
[32m[I 2022-12-30 07:37:12,754][0m Trial 501 finished with value: 0.32231813164538325 and parameters: {'hidden_size': 512, 'activation1': 'tanh', 'activation2': 'tanh', 'dropout': 0.1, 'lr': 0.001, 'weight_decay': 3e-05, 'opt': 'RMSprop'}. Best is trial 323 with value: 0.32512486453416034.[0m
[32m[I 2022-12-30 07:37:21,052][0m Trial 502 finished with value: 0.32304053127905774 and parameters: {'hidden_size': 512, 'activation1': 'tanh', 'activation2': 'tanh', 'dropout': 0.1, 'lr': 0.001, 'weight_decay': 3e-05, 'opt': 'RMSprop'}. Best is trial 323 with value: 0.32512486453416034.[0m
[32m[I 2022-12-30 07:37:30,486][0m Trial 503 finished with value: 0.3119746806032159 and parameters: {'hidden_size': 512, 'activation1': 'tanh', 'activation2': 'tanh', 'dropout': 0.2, 'lr': 0.001, 'weight_decay': 3e-05, 'opt': 'Adam'}. Best is trial 323 with value: 0.32512486453416034.[0m
[32m[I 2022-12-30 07:37:38,884][0m Trial 504 finished with value: 0.32097955951447193 and parameters: {'hidden_size': 512, 'activation1': 'tanh', 'activation2': 'tanh', 'dropout': 0.1, 'lr': 0.001, 'weight_decay': 3e-05, 'opt': 'RMSprop'}. Best is trial 323 with value: 0.32512486453416034.[0m
[32m[I 2022-12-30 07:37:47,145][0m Trial 505 finished with value: 0.3061203094047958 and parameters: {'hidden_size': 512, 'activation1': 'tanh', 'activation2': 'tanh', 'dropout': 0.1, 'lr': 0.003, 'weight_decay': 3e-05, 'opt': 'RMSprop'}. Best is trial 323 with value: 0.32512486453416034.[0m
[32m[I 2022-12-30 07:37:55,510][0m Trial 506 finished with value: 0.3197376242129991 and parameters: {'hidden_size': 512, 'activation1': 'relu', 'activation2': 'tanh', 'dropout': 0.1, 'lr': 0.001, 'weight_decay': 3e-05, 'opt': 'RMSprop'}. Best is trial 323 with value: 0.32512486453416034.[0m
[32m[I 2022-12-30 07:38:03,798][0m Trial 507 finished with value: 0.25369493920014763 and parameters: {'hidden_size': 512, 'activation1': 'tanh', 'activation2': 'sigmoid', 'dropout': 0.1, 'lr': 0.001, 'weight_decay': 3e-05, 'opt': 'RMSprop'}. Best is trial 323 with value: 0.32512486453416034.[0m
[32m[I 2022-12-30 07:38:12,150][0m Trial 508 finished with value: 0.32397914193554 and parameters: {'hidden_size': 512, 'activation1': 'tanh', 'activation2': 'tanh', 'dropout': 0.1, 'lr': 0.001, 'weight_decay': 3e-05, 'opt': 'RMSprop'}. Best is trial 323 with value: 0.32512486453416034.[0m
[32m[I 2022-12-30 07:38:20,609][0m Trial 509 finished with value: 0.3213818358500717 and parameters: {'hidden_size': 512, 'activation1': 'tanh', 'activation2': 'tanh', 'dropout': 0.1, 'lr': 0.001, 'weight_decay': 3e-05, 'opt': 'RMSprop'}. Best is trial 323 with value: 0.32512486453416034.[0m
[32m[I 2022-12-30 07:38:28,898][0m Trial 510 finished with value: 0.3221116554549922 and parameters: {'hidden_size': 512, 'activation1': 'tanh', 'activation2': 'tanh', 'dropout': 0.1, 'lr': 0.001, 'weight_decay': 3e-05, 'opt': 'RMSprop'}. Best is trial 323 with value: 0.32512486453416034.[0m
[32m[I 2022-12-30 07:38:37,096][0m Trial 511 finished with value: 0.323252332955034 and parameters: {'hidden_size': 512, 'activation1': 'tanh', 'activation2': 'tanh', 'dropout': 0.1, 'lr': 0.001, 'weight_decay': 3e-05, 'opt': 'RMSprop'}. Best is trial 323 with value: 0.32512486453416034.[0m
[32m[I 2022-12-30 07:38:45,322][0m Trial 512 finished with value: 0.32288116880927886 and parameters: {'hidden_size': 512, 'activation1': 'tanh', 'activation2': 'tanh', 'dropout': 0.1, 'lr': 0.001, 'weight_decay': 3e-05, 'opt': 'RMSprop'}. Best is trial 323 with value: 0.32512486453416034.[0m
[32m[I 2022-12-30 07:38:53,492][0m Trial 513 finished with value: 0.3213455389975414 and parameters: {'hidden_size': 512, 'activation1': 'tanh', 'activation2': 'tanh', 'dropout': 0.1, 'lr': 0.001, 'weight_decay': 3e-05, 'opt': 'RMSprop'}. Best is trial 323 with value: 0.32512486453416034.[0m
[32m[I 2022-12-30 07:39:01,769][0m Trial 514 finished with value: 0.32314423722647245 and parameters: {'hidden_size': 512, 'activation1': 'tanh', 'activation2': 'tanh', 'dropout': 0.1, 'lr': 0.001, 'weight_decay': 3e-05, 'opt': 'RMSprop'}. Best is trial 323 with value: 0.32512486453416034.[0m
[32m[I 2022-12-30 07:39:10,064][0m Trial 515 finished with value: 0.31009235077642894 and parameters: {'hidden_size': 512, 'activation1': 'sigmoid', 'activation2': 'tanh', 'dropout': 0.1, 'lr': 0.001, 'weight_decay': 3e-05, 'opt': 'RMSprop'}. Best is trial 323 with value: 0.32512486453416034.[0m
[32m[I 2022-12-30 07:39:18,381][0m Trial 516 finished with value: 0.32218150838800896 and parameters: {'hidden_size': 512, 'activation1': 'tanh', 'activation2': 'tanh', 'dropout': 0.1, 'lr': 0.001, 'weight_decay': 3e-05, 'opt': 'RMSprop'}. Best is trial 323 with value: 0.32512486453416034.[0m
