[32m[I 2022-12-30 09:06:08,538][0m Trial 1040 finished with value: 0.3044449585330934 and parameters: {'hidden_size': 128, 'activation1': 'tanh', 'activation2': 'tanh', 'dropout': 0.1, 'lr': 0.01, 'weight_decay': 1e-05, 'opt': 'Adam'}. Best is trial 722 with value: 0.32671537835324177.[0m
[32m[I 2022-12-30 09:06:19,456][0m Trial 1041 finished with value: 0.3236728497269925 and parameters: {'hidden_size': 512, 'activation1': 'tanh', 'activation2': 'tanh', 'dropout': 0.1, 'lr': 0.01, 'weight_decay': 1e-05, 'opt': 'Adam'}. Best is trial 722 with value: 0.32671537835324177.[0m
[32m[I 2022-12-30 09:06:30,104][0m Trial 1042 finished with value: 0.32491628770603664 and parameters: {'hidden_size': 512, 'activation1': 'tanh', 'activation2': 'tanh', 'dropout': 0.1, 'lr': 0.01, 'weight_decay': 1e-05, 'opt': 'Adam'}. Best is trial 722 with value: 0.32671537835324177.[0m
[32m[I 2022-12-30 09:06:40,465][0m Trial 1043 finished with value: 0.31126034129937874 and parameters: {'hidden_size': 256, 'activation1': 'tanh', 'activation2': 'tanh', 'dropout': 0.1, 'lr': 0.01, 'weight_decay': 1e-05, 'opt': 'Adam'}. Best is trial 722 with value: 0.32671537835324177.[0m
[32m[I 2022-12-30 09:06:50,768][0m Trial 1044 finished with value: 0.32375335586564685 and parameters: {'hidden_size': 512, 'activation1': 'tanh', 'activation2': 'tanh', 'dropout': 0.1, 'lr': 0.01, 'weight_decay': 1e-05, 'opt': 'Adam'}. Best is trial 722 with value: 0.32671537835324177.[0m
[32m[I 2022-12-30 09:07:01,543][0m Trial 1045 finished with value: 0.32378299604075783 and parameters: {'hidden_size': 512, 'activation1': 'tanh', 'activation2': 'tanh', 'dropout': 0.1, 'lr': 0.01, 'weight_decay': 1e-05, 'opt': 'Adam'}. Best is trial 722 with value: 0.32671537835324177.[0m
[32m[I 2022-12-30 09:07:12,355][0m Trial 1046 finished with value: 0.29981239885515765 and parameters: {'hidden_size': 512, 'activation1': 'relu', 'activation2': 'tanh', 'dropout': 0.1, 'lr': 0.01, 'weight_decay': 1e-05, 'opt': 'Adam'}. Best is trial 722 with value: 0.32671537835324177.[0m
[32m[I 2022-12-30 09:07:22,727][0m Trial 1047 finished with value: 0.32541164692957486 and parameters: {'hidden_size': 512, 'activation1': 'tanh', 'activation2': 'tanh', 'dropout': 0.1, 'lr': 0.01, 'weight_decay': 1e-05, 'opt': 'Adam'}. Best is trial 722 with value: 0.32671537835324177.[0m
[32m[I 2022-12-30 09:07:33,086][0m Trial 1048 finished with value: 0.24595271742416386 and parameters: {'hidden_size': 512, 'activation1': 'tanh', 'activation2': 'sigmoid', 'dropout': 0.1, 'lr': 0.01, 'weight_decay': 1e-05, 'opt': 'Adam'}. Best is trial 722 with value: 0.32671537835324177.[0m
[32m[I 2022-12-30 09:07:43,370][0m Trial 1049 finished with value: 0.3246338495176413 and parameters: {'hidden_size': 512, 'activation1': 'tanh', 'activation2': 'tanh', 'dropout': 0.1, 'lr': 0.01, 'weight_decay': 1e-05, 'opt': 'Adam'}. Best is trial 722 with value: 0.32671537835324177.[0m
[32m[I 2022-12-30 09:07:53,537][0m Trial 1050 finished with value: 0.32530400493311873 and parameters: {'hidden_size': 512, 'activation1': 'tanh', 'activation2': 'tanh', 'dropout': 0.1, 'lr': 0.01, 'weight_decay': 1e-05, 'opt': 'Adam'}. Best is trial 722 with value: 0.32671537835324177.[0m
[32m[I 2022-12-30 09:08:03,898][0m Trial 1051 finished with value: 0.32411051018134523 and parameters: {'hidden_size': 512, 'activation1': 'tanh', 'activation2': 'tanh', 'dropout': 0.1, 'lr': 0.01, 'weight_decay': 1e-05, 'opt': 'Adam'}. Best is trial 722 with value: 0.32671537835324177.[0m
[32m[I 2022-12-30 09:08:12,033][0m Trial 1052 finished with value: 0.06273330222993204 and parameters: {'hidden_size': 512, 'activation1': 'tanh', 'activation2': 'tanh', 'dropout': 0.1, 'lr': 0.01, 'weight_decay': 1e-05, 'opt': 'SGD'}. Best is trial 722 with value: 0.32671537835324177.[0m
[32m[I 2022-12-30 09:08:22,485][0m Trial 1053 finished with value: 0.3224473691729483 and parameters: {'hidden_size': 512, 'activation1': 'tanh', 'activation2': 'tanh', 'dropout': 0.1, 'lr': 0.01, 'weight_decay': 1e-05, 'opt': 'Adam'}. Best is trial 722 with value: 0.32671537835324177.[0m
[32m[I 2022-12-30 09:08:33,159][0m Trial 1054 finished with value: 0.3237745062639307 and parameters: {'hidden_size': 512, 'activation1': 'tanh', 'activation2': 'tanh', 'dropout': 0.1, 'lr': 0.01, 'weight_decay': 1e-05, 'opt': 'Adam'}. Best is trial 722 with value: 0.32671537835324177.[0m
[32m[I 2022-12-30 09:08:43,787][0m Trial 1055 finished with value: 0.3237923888785704 and parameters: {'hidden_size': 512, 'activation1': 'tanh', 'activation2': 'tanh', 'dropout': 0.1, 'lr': 0.01, 'weight_decay': 1e-05, 'opt': 'Adam'}. Best is trial 722 with value: 0.32671537835324177.[0m
[32m[I 2022-12-30 09:08:54,577][0m Trial 1056 finished with value: 0.3228320008606855 and parameters: {'hidden_size': 512, 'activation1': 'tanh', 'activation2': 'tanh', 'dropout': 0.1, 'lr': 0.01, 'weight_decay': 1e-05, 'opt': 'Adam'}. Best is trial 722 with value: 0.32671537835324177.[0m
[32m[I 2022-12-30 09:09:05,159][0m Trial 1057 finished with value: 0.2795883011765845 and parameters: {'hidden_size': 512, 'activation1': 'sigmoid', 'activation2': 'tanh', 'dropout': 0.1, 'lr': 0.01, 'weight_decay': 1e-05, 'opt': 'Adam'}. Best is trial 722 with value: 0.32671537835324177.[0m
[32m[I 2022-12-30 09:09:15,828][0m Trial 1058 finished with value: 0.3220702223449483 and parameters: {'hidden_size': 512, 'activation1': 'tanh', 'activation2': 'tanh', 'dropout': 0.1, 'lr': 0.01, 'weight_decay': 1e-05, 'opt': 'Adam'}. Best is trial 722 with value: 0.32671537835324177.[0m
[32m[I 2022-12-30 09:09:26,482][0m Trial 1059 finished with value: 0.32285818388866194 and parameters: {'hidden_size': 512, 'activation1': 'tanh', 'activation2': 'tanh', 'dropout': 0.1, 'lr': 0.01, 'weight_decay': 1e-05, 'opt': 'Adam'}. Best is trial 722 with value: 0.32671537835324177.[0m
[32m[I 2022-12-30 09:09:36,922][0m Trial 1060 finished with value: 0.2506970571490386 and parameters: {'hidden_size': 512, 'activation1': 'tanh', 'activation2': 'relu', 'dropout': 0.1, 'lr': 0.01, 'weight_decay': 1e-05, 'opt': 'Adam'}. Best is trial 722 with value: 0.32671537835324177.[0m
[32m[I 2022-12-30 09:09:48,002][0m Trial 1061 finished with value: 0.3163890716447876 and parameters: {'hidden_size': 512, 'activation1': 'tanh', 'activation2': 'tanh', 'dropout': 0.2, 'lr': 0.003, 'weight_decay': 1e-05, 'opt': 'Adam'}. Best is trial 722 with value: 0.32671537835324177.[0m
[32m[I 2022-12-30 09:09:58,356][0m Trial 1062 finished with value: 0.32356417365695145 and parameters: {'hidden_size': 512, 'activation1': 'tanh', 'activation2': 'tanh', 'dropout': 0.1, 'lr': 0.01, 'weight_decay': 1e-05, 'opt': 'Adam'}. Best is trial 722 with value: 0.32671537835324177.[0m
[32m[I 2022-12-30 09:10:09,081][0m Trial 1063 finished with value: 0.32348135930235317 and parameters: {'hidden_size': 512, 'activation1': 'tanh', 'activation2': 'tanh', 'dropout': 0.1, 'lr': 0.01, 'weight_decay': 1e-05, 'opt': 'Adam'}. Best is trial 722 with value: 0.32671537835324177.[0m
[32m[I 2022-12-30 09:10:20,510][0m Trial 1064 finished with value: 0.30575149931859513 and parameters: {'hidden_size': 128, 'activation1': 'tanh', 'activation2': 'tanh', 'dropout': 0.1, 'lr': 0.01, 'weight_decay': 1e-05, 'opt': 'Adam'}. Best is trial 722 with value: 0.32671537835324177.[0m
[32m[I 2022-12-30 09:10:30,980][0m Trial 1065 finished with value: 0.32212539407962354 and parameters: {'hidden_size': 512, 'activation1': 'tanh', 'activation2': 'tanh', 'dropout': 0.1, 'lr': 0.01, 'weight_decay': 1e-05, 'opt': 'Adam'}. Best is trial 722 with value: 0.32671537835324177.[0m
[32m[I 2022-12-30 09:10:41,161][0m Trial 1066 finished with value: 0.32293997649946393 and parameters: {'hidden_size': 512, 'activation1': 'tanh', 'activation2': 'tanh', 'dropout': 0.1, 'lr': 0.01, 'weight_decay': 1e-05, 'opt': 'Adam'}. Best is trial 722 with value: 0.32671537835324177.[0m
[32m[I 2022-12-30 09:10:51,368][0m Trial 1067 finished with value: 0.3106804734345249 and parameters: {'hidden_size': 256, 'activation1': 'tanh', 'activation2': 'tanh', 'dropout': 0.1, 'lr': 0.01, 'weight_decay': 1e-05, 'opt': 'Adam'}. Best is trial 722 with value: 0.32671537835324177.[0m
[32m[I 2022-12-30 09:11:01,796][0m Trial 1068 finished with value: 0.30442759499860605 and parameters: {'hidden_size': 512, 'activation1': 'relu', 'activation2': 'tanh', 'dropout': 0.05, 'lr': 0.01, 'weight_decay': 1e-05, 'opt': 'Adam'}. Best is trial 722 with value: 0.32671537835324177.[0m
[32m[I 2022-12-30 09:11:12,138][0m Trial 1069 finished with value: 0.3255353051584823 and parameters: {'hidden_size': 512, 'activation1': 'tanh', 'activation2': 'tanh', 'dropout': 0.1, 'lr': 0.01, 'weight_decay': 1e-05, 'opt': 'Adam'}. Best is trial 722 with value: 0.32671537835324177.[0m
[32m[I 2022-12-30 09:11:22,283][0m Trial 1070 finished with value: 0.2482509803775815 and parameters: {'hidden_size': 512, 'activation1': 'tanh', 'activation2': 'sigmoid', 'dropout': 0.1, 'lr': 0.01, 'weight_decay': 1e-05, 'opt': 'Adam'}. Best is trial 722 with value: 0.32671537835324177.[0m
[32m[I 2022-12-30 09:11:30,088][0m Trial 1071 finished with value: 0.054281337213934286 and parameters: {'hidden_size': 512, 'activation1': 'tanh', 'activation2': 'tanh', 'dropout': 0.1, 'lr': 0.01, 'weight_decay': 1e-05, 'opt': 'SGD'}. Best is trial 722 with value: 0.32671537835324177.[0m
[32m[I 2022-12-30 09:11:40,311][0m Trial 1072 finished with value: 0.3241497062941704 and parameters: {'hidden_size': 512, 'activation1': 'tanh', 'activation2': 'tanh', 'dropout': 0.1, 'lr': 0.01, 'weight_decay': 1e-05, 'opt': 'Adam'}. Best is trial 722 with value: 0.32671537835324177.[0m
[32m[I 2022-12-30 09:11:50,670][0m Trial 1073 finished with value: 0.3226737516892798 and parameters: {'hidden_size': 512, 'activation1': 'tanh', 'activation2': 'tanh', 'dropout': 0.1, 'lr': 0.01, 'weight_decay': 1e-05, 'opt': 'Adam'}. Best is trial 722 with value: 0.32671537835324177.[0m
[32m[I 2022-12-30 09:12:00,996][0m Trial 1074 finished with value: 0.3229035647290157 and parameters: {'hidden_size': 512, 'activation1': 'tanh', 'activation2': 'tanh', 'dropout': 0.1, 'lr': 0.01, 'weight_decay': 1e-05, 'opt': 'Adam'}. Best is trial 722 with value: 0.32671537835324177.[0m
[32m[I 2022-12-30 09:12:11,470][0m Trial 1075 finished with value: 0.3242737410986655 and parameters: {'hidden_size': 512, 'activation1': 'tanh', 'activation2': 'tanh', 'dropout': 0.1, 'lr': 0.01, 'weight_decay': 1e-05, 'opt': 'Adam'}. Best is trial 722 with value: 0.32671537835324177.[0m
[32m[I 2022-12-30 09:12:21,772][0m Trial 1076 finished with value: 0.3262005696023256 and parameters: {'hidden_size': 512, 'activation1': 'tanh', 'activation2': 'tanh', 'dropout': 0.1, 'lr': 0.01, 'weight_decay': 1e-05, 'opt': 'Adam'}. Best is trial 722 with value: 0.32671537835324177.[0m
[32m[I 2022-12-30 09:12:31,978][0m Trial 1077 finished with value: 0.3204378955523445 and parameters: {'hidden_size': 512, 'activation1': 'tanh', 'activation2': 'tanh', 'dropout': 0.1, 'lr': 0.01, 'weight_decay': 1e-05, 'opt': 'Adam'}. Best is trial 722 with value: 0.32671537835324177.[0m
[32m[I 2022-12-30 09:12:42,299][0m Trial 1078 finished with value: 0.3240394258316358 and parameters: {'hidden_size': 512, 'activation1': 'tanh', 'activation2': 'tanh', 'dropout': 0.1, 'lr': 0.01, 'weight_decay': 1e-05, 'opt': 'Adam'}. Best is trial 722 with value: 0.32671537835324177.[0m
[32m[I 2022-12-30 09:12:52,720][0m Trial 1079 finished with value: 0.273197408146594 and parameters: {'hidden_size': 512, 'activation1': 'sigmoid', 'activation2': 'tanh', 'dropout': 0.1, 'lr': 0.01, 'weight_decay': 1e-05, 'opt': 'Adam'}. Best is trial 722 with value: 0.32671537835324177.[0m
[32m[I 2022-12-30 09:13:02,952][0m Trial 1080 finished with value: 0.32488170005026334 and parameters: {'hidden_size': 512, 'activation1': 'tanh', 'activation2': 'tanh', 'dropout': 0.1, 'lr': 0.01, 'weight_decay': 1e-05, 'opt': 'Adam'}. Best is trial 722 with value: 0.32671537835324177.[0m
[32m[I 2022-12-30 09:13:13,533][0m Trial 1081 finished with value: 0.3213933355663924 and parameters: {'hidden_size': 512, 'activation1': 'tanh', 'activation2': 'tanh', 'dropout': 0.1, 'lr': 0.01, 'weight_decay': 1e-05, 'opt': 'Adam'}. Best is trial 722 with value: 0.32671537835324177.[0m
[32m[I 2022-12-30 09:13:23,909][0m Trial 1082 finished with value: 0.25175337650459145 and parameters: {'hidden_size': 512, 'activation1': 'tanh', 'activation2': 'relu', 'dropout': 0.1, 'lr': 0.01, 'weight_decay': 1e-05, 'opt': 'Adam'}. Best is trial 722 with value: 0.32671537835324177.[0m
[32m[I 2022-12-30 09:13:34,309][0m Trial 1083 finished with value: 0.32278177984005396 and parameters: {'hidden_size': 512, 'activation1': 'tanh', 'activation2': 'tanh', 'dropout': 0.1, 'lr': 0.01, 'weight_decay': 1e-05, 'opt': 'Adam'}. Best is trial 722 with value: 0.32671537835324177.[0m
[32m[I 2022-12-30 09:13:44,941][0m Trial 1084 finished with value: 0.3228918893742473 and parameters: {'hidden_size': 512, 'activation1': 'tanh', 'activation2': 'tanh', 'dropout': 0.2, 'lr': 0.01, 'weight_decay': 1e-05, 'opt': 'Adam'}. Best is trial 722 with value: 0.32671537835324177.[0m
[32m[I 2022-12-30 09:13:55,274][0m Trial 1085 finished with value: 0.3250592700347725 and parameters: {'hidden_size': 512, 'activation1': 'tanh', 'activation2': 'tanh', 'dropout': 0.1, 'lr': 0.01, 'weight_decay': 1e-05, 'opt': 'Adam'}. Best is trial 722 with value: 0.32671537835324177.[0m
[32m[I 2022-12-30 09:14:05,537][0m Trial 1086 finished with value: 0.32469451188092424 and parameters: {'hidden_size': 512, 'activation1': 'tanh', 'activation2': 'tanh', 'dropout': 0.1, 'lr': 0.01, 'weight_decay': 1e-05, 'opt': 'Adam'}. Best is trial 722 with value: 0.32671537835324177.[0m
[32m[I 2022-12-30 09:14:15,742][0m Trial 1087 finished with value: 0.3047125562226619 and parameters: {'hidden_size': 128, 'activation1': 'tanh', 'activation2': 'tanh', 'dropout': 0.1, 'lr': 0.01, 'weight_decay': 1e-05, 'opt': 'Adam'}. Best is trial 722 with value: 0.32671537835324177.[0m
[32m[I 2022-12-30 09:14:25,894][0m Trial 1088 finished with value: 0.32371008947691793 and parameters: {'hidden_size': 512, 'activation1': 'tanh', 'activation2': 'tanh', 'dropout': 0.1, 'lr': 0.01, 'weight_decay': 1e-05, 'opt': 'Adam'}. Best is trial 722 with value: 0.32671537835324177.[0m
[32m[I 2022-12-30 09:14:36,564][0m Trial 1089 finished with value: 0.3226534122734083 and parameters: {'hidden_size': 512, 'activation1': 'tanh', 'activation2': 'tanh', 'dropout': 0.1, 'lr': 0.01, 'weight_decay': 1e-05, 'opt': 'Adam'}. Best is trial 722 with value: 0.32671537835324177.[0m
[32m[I 2022-12-30 09:14:46,951][0m Trial 1090 finished with value: 0.29166368361540507 and parameters: {'hidden_size': 256, 'activation1': 'relu', 'activation2': 'tanh', 'dropout': 0.1, 'lr': 0.01, 'weight_decay': 1e-05, 'opt': 'Adam'}. Best is trial 722 with value: 0.32671537835324177.[0m
[32m[I 2022-12-30 09:14:57,252][0m Trial 1091 finished with value: 0.3223637398519597 and parameters: {'hidden_size': 512, 'activation1': 'tanh', 'activation2': 'tanh', 'dropout': 0.1, 'lr': 0.01, 'weight_decay': 1e-05, 'opt': 'Adam'}. Best is trial 722 with value: 0.32671537835324177.[0m
[32m[I 2022-12-30 09:15:07,818][0m Trial 1092 finished with value: 0.32366118388377574 and parameters: {'hidden_size': 512, 'activation1': 'tanh', 'activation2': 'tanh', 'dropout': 0.1, 'lr': 0.01, 'weight_decay': 1e-05, 'opt': 'Adam'}. Best is trial 722 with value: 0.32671537835324177.[0m
[32m[I 2022-12-30 09:15:18,884][0m Trial 1093 finished with value: 0.24917228668321867 and parameters: {'hidden_size': 512, 'activation1': 'tanh', 'activation2': 'sigmoid', 'dropout': 0.05, 'lr': 0.01, 'weight_decay': 1e-05, 'opt': 'Adam'}. Best is trial 722 with value: 0.32671537835324177.[0m
[32m[I 2022-12-30 09:15:30,103][0m Trial 1094 finished with value: 0.32183697149967533 and parameters: {'hidden_size': 512, 'activation1': 'tanh', 'activation2': 'tanh', 'dropout': 0.1, 'lr': 0.01, 'weight_decay': 1e-05, 'opt': 'Adam'}. Best is trial 722 with value: 0.32671537835324177.[0m
[32m[I 2022-12-30 09:15:40,488][0m Trial 1095 finished with value: 0.3245138576968348 and parameters: {'hidden_size': 512, 'activation1': 'tanh', 'activation2': 'tanh', 'dropout': 0.1, 'lr': 0.01, 'weight_decay': 1e-05, 'opt': 'Adam'}. Best is trial 722 with value: 0.32671537835324177.[0m
[32m[I 2022-12-30 09:15:50,759][0m Trial 1096 finished with value: 0.31756459366575074 and parameters: {'hidden_size': 512, 'activation1': 'tanh', 'activation2': 'tanh', 'dropout': 0.1, 'lr': 0.003, 'weight_decay': 1e-05, 'opt': 'Adam'}. Best is trial 722 with value: 0.32671537835324177.[0m
[32m[I 2022-12-30 09:16:01,501][0m Trial 1097 finished with value: 0.3242878090752193 and parameters: {'hidden_size': 512, 'activation1': 'tanh', 'activation2': 'tanh', 'dropout': 0.1, 'lr': 0.01, 'weight_decay': 1e-05, 'opt': 'Adam'}. Best is trial 722 with value: 0.32671537835324177.[0m
[32m[I 2022-12-30 09:16:11,931][0m Trial 1098 finished with value: 0.3234893581426155 and parameters: {'hidden_size': 512, 'activation1': 'tanh', 'activation2': 'tanh', 'dropout': 0.1, 'lr': 0.01, 'weight_decay': 1e-05, 'opt': 'Adam'}. Best is trial 722 with value: 0.32671537835324177.[0m
[32m[I 2022-12-30 09:16:22,975][0m Trial 1099 finished with value: 0.324258408702411 and parameters: {'hidden_size': 512, 'activation1': 'tanh', 'activation2': 'tanh', 'dropout': 0.1, 'lr': 0.01, 'weight_decay': 1e-05, 'opt': 'Adam'}. Best is trial 722 with value: 0.32671537835324177.[0m
[32m[I 2022-12-30 09:16:33,408][0m Trial 1100 finished with value: 0.32383320432897134 and parameters: {'hidden_size': 512, 'activation1': 'tanh', 'activation2': 'tanh', 'dropout': 0.1, 'lr': 0.01, 'weight_decay': 1e-05, 'opt': 'Adam'}. Best is trial 722 with value: 0.32671537835324177.[0m
[32m[I 2022-12-30 09:16:43,582][0m Trial 1101 finished with value: 0.32482500909044665 and parameters: {'hidden_size': 512, 'activation1': 'tanh', 'activation2': 'tanh', 'dropout': 0.1, 'lr': 0.01, 'weight_decay': 1e-05, 'opt': 'Adam'}. Best is trial 722 with value: 0.32671537835324177.[0m
[32m[I 2022-12-30 09:16:53,980][0m Trial 1102 finished with value: 0.2775483984319503 and parameters: {'hidden_size': 512, 'activation1': 'sigmoid', 'activation2': 'tanh', 'dropout': 0.1, 'lr': 0.01, 'weight_decay': 1e-05, 'opt': 'Adam'}. Best is trial 722 with value: 0.32671537835324177.[0m
[32m[I 2022-12-30 09:17:04,441][0m Trial 1103 finished with value: 0.32329520373521037 and parameters: {'hidden_size': 512, 'activation1': 'tanh', 'activation2': 'tanh', 'dropout': 0.1, 'lr': 0.01, 'weight_decay': 1e-05, 'opt': 'Adam'}. Best is trial 722 with value: 0.32671537835324177.[0m
[32m[I 2022-12-30 09:17:15,491][0m Trial 1104 finished with value: 0.32215497949241645 and parameters: {'hidden_size': 512, 'activation1': 'tanh', 'activation2': 'tanh', 'dropout': 0.1, 'lr': 0.01, 'weight_decay': 1e-05, 'opt': 'Adam'}. Best is trial 722 with value: 0.32671537835324177.[0m
[32m[I 2022-12-30 09:17:23,295][0m Trial 1105 finished with value: 0.0 and parameters: {'hidden_size': 1024, 'activation1': 'tanh', 'activation2': 'relu', 'dropout': 0.1, 'lr': 0.01, 'weight_decay': 1e-05, 'opt': 'SGD'}. Best is trial 722 with value: 0.32671537835324177.[0m
[32m[I 2022-12-30 09:17:34,054][0m Trial 1106 finished with value: 0.32406400856684653 and parameters: {'hidden_size': 512, 'activation1': 'tanh', 'activation2': 'tanh', 'dropout': 0.1, 'lr': 0.01, 'weight_decay': 1e-05, 'opt': 'Adam'}. Best is trial 722 with value: 0.32671537835324177.[0m
[32m[I 2022-12-30 09:17:44,782][0m Trial 1107 finished with value: 0.3230704569829973 and parameters: {'hidden_size': 512, 'activation1': 'tanh', 'activation2': 'tanh', 'dropout': 0.1, 'lr': 0.01, 'weight_decay': 1e-05, 'opt': 'Adam'}. Best is trial 722 with value: 0.32671537835324177.[0m
[32m[I 2022-12-30 09:17:55,213][0m Trial 1108 finished with value: 0.3225050758990384 and parameters: {'hidden_size': 512, 'activation1': 'tanh', 'activation2': 'tanh', 'dropout': 0.2, 'lr': 0.01, 'weight_decay': 1e-05, 'opt': 'Adam'}. Best is trial 722 with value: 0.32671537835324177.[0m
[32m[I 2022-12-30 09:18:05,432][0m Trial 1109 finished with value: 0.32356847059497956 and parameters: {'hidden_size': 512, 'activation1': 'tanh', 'activation2': 'tanh', 'dropout': 0.1, 'lr': 0.01, 'weight_decay': 1e-05, 'opt': 'Adam'}. Best is trial 722 with value: 0.32671537835324177.[0m
[32m[I 2022-12-30 09:18:15,976][0m Trial 1110 finished with value: 0.3242786531251327 and parameters: {'hidden_size': 512, 'activation1': 'tanh', 'activation2': 'tanh', 'dropout': 0.1, 'lr': 0.01, 'weight_decay': 1e-05, 'opt': 'Adam'}. Best is trial 722 with value: 0.32671537835324177.[0m
[32m[I 2022-12-30 09:18:26,407][0m Trial 1111 finished with value: 0.3244692371921925 and parameters: {'hidden_size': 512, 'activation1': 'tanh', 'activation2': 'tanh', 'dropout': 0.1, 'lr': 0.01, 'weight_decay': 1e-05, 'opt': 'Adam'}. Best is trial 722 with value: 0.32671537835324177.[0m
[32m[I 2022-12-30 09:18:36,979][0m Trial 1112 finished with value: 0.32286559236103685 and parameters: {'hidden_size': 512, 'activation1': 'tanh', 'activation2': 'tanh', 'dropout': 0.1, 'lr': 0.01, 'weight_decay': 1e-05, 'opt': 'Adam'}. Best is trial 722 with value: 0.32671537835324177.[0m
[32m[I 2022-12-30 09:18:47,298][0m Trial 1113 finished with value: 0.304404769143373 and parameters: {'hidden_size': 128, 'activation1': 'relu', 'activation2': 'tanh', 'dropout': 0.1, 'lr': 0.01, 'weight_decay': 1e-05, 'opt': 'Adam'}. Best is trial 722 with value: 0.32671537835324177.[0m
