[32m[I 2022-12-30 08:01:46,181][0m Trial 665 finished with value: 0.31360655404148396 and parameters: {'hidden_size': 256, 'activation1': 'tanh', 'activation2': 'tanh', 'dropout': 0.1, 'lr': 0.01, 'weight_decay': 1e-05, 'opt': 'Adam'}. Best is trial 659 with value: 0.3259113683638972.[0m
[32m[I 2022-12-30 08:01:56,619][0m Trial 666 finished with value: 0.28886614508018427 and parameters: {'hidden_size': 512, 'activation1': 'relu', 'activation2': 'tanh', 'dropout': 0.1, 'lr': 0.01, 'weight_decay': 1e-05, 'opt': 'Adam'}. Best is trial 659 with value: 0.3259113683638972.[0m
[32m[I 2022-12-30 08:02:07,182][0m Trial 667 finished with value: 0.3240208088805116 and parameters: {'hidden_size': 512, 'activation1': 'tanh', 'activation2': 'tanh', 'dropout': 0.1, 'lr': 0.01, 'weight_decay': 1e-05, 'opt': 'Adam'}. Best is trial 659 with value: 0.3259113683638972.[0m
[32m[I 2022-12-30 08:02:17,522][0m Trial 668 finished with value: 0.32332555233674976 and parameters: {'hidden_size': 512, 'activation1': 'tanh', 'activation2': 'tanh', 'dropout': 0.1, 'lr': 0.01, 'weight_decay': 1e-05, 'opt': 'Adam'}. Best is trial 659 with value: 0.3259113683638972.[0m
[32m[I 2022-12-30 08:02:27,764][0m Trial 669 finished with value: 0.24973735727510554 and parameters: {'hidden_size': 512, 'activation1': 'tanh', 'activation2': 'sigmoid', 'dropout': 0.1, 'lr': 0.01, 'weight_decay': 1e-05, 'opt': 'Adam'}. Best is trial 659 with value: 0.3259113683638972.[0m
[32m[I 2022-12-30 08:02:37,900][0m Trial 670 finished with value: 0.3244180465129725 and parameters: {'hidden_size': 512, 'activation1': 'tanh', 'activation2': 'tanh', 'dropout': 0.1, 'lr': 0.01, 'weight_decay': 1e-05, 'opt': 'Adam'}. Best is trial 659 with value: 0.3259113683638972.[0m
[32m[I 2022-12-30 08:02:48,135][0m Trial 671 finished with value: 0.32279079391142673 and parameters: {'hidden_size': 512, 'activation1': 'tanh', 'activation2': 'tanh', 'dropout': 0.1, 'lr': 0.01, 'weight_decay': 1e-05, 'opt': 'Adam'}. Best is trial 659 with value: 0.3259113683638972.[0m
[32m[I 2022-12-30 08:02:58,795][0m Trial 672 finished with value: 0.32439185183186287 and parameters: {'hidden_size': 512, 'activation1': 'tanh', 'activation2': 'tanh', 'dropout': 0.1, 'lr': 0.01, 'weight_decay': 1e-05, 'opt': 'Adam'}. Best is trial 659 with value: 0.3259113683638972.[0m
[32m[I 2022-12-30 08:03:09,235][0m Trial 673 finished with value: 0.3208801158381522 and parameters: {'hidden_size': 512, 'activation1': 'tanh', 'activation2': 'tanh', 'dropout': 0.1, 'lr': 0.01, 'weight_decay': 1e-05, 'opt': 'Adam'}. Best is trial 659 with value: 0.3259113683638972.[0m
[32m[I 2022-12-30 08:03:19,793][0m Trial 674 finished with value: 0.3220115491836564 and parameters: {'hidden_size': 512, 'activation1': 'tanh', 'activation2': 'tanh', 'dropout': 0.1, 'lr': 0.01, 'weight_decay': 1e-05, 'opt': 'Adam'}. Best is trial 659 with value: 0.3259113683638972.[0m
[32m[I 2022-12-30 08:03:30,283][0m Trial 675 finished with value: 0.32439166276999915 and parameters: {'hidden_size': 512, 'activation1': 'tanh', 'activation2': 'tanh', 'dropout': 0.1, 'lr': 0.01, 'weight_decay': 1e-05, 'opt': 'Adam'}. Best is trial 659 with value: 0.3259113683638972.[0m
[32m[I 2022-12-30 08:03:40,548][0m Trial 676 finished with value: 0.32345951963807046 and parameters: {'hidden_size': 512, 'activation1': 'tanh', 'activation2': 'tanh', 'dropout': 0.1, 'lr': 0.01, 'weight_decay': 1e-05, 'opt': 'Adam'}. Best is trial 659 with value: 0.3259113683638972.[0m
[32m[I 2022-12-30 08:03:51,114][0m Trial 677 finished with value: 0.2804744238662506 and parameters: {'hidden_size': 512, 'activation1': 'sigmoid', 'activation2': 'tanh', 'dropout': 0.1, 'lr': 0.01, 'weight_decay': 1e-05, 'opt': 'Adam'}. Best is trial 659 with value: 0.3259113683638972.[0m
[32m[I 2022-12-30 08:04:01,355][0m Trial 678 finished with value: 0.3236106008338858 and parameters: {'hidden_size': 512, 'activation1': 'tanh', 'activation2': 'tanh', 'dropout': 0.1, 'lr': 0.01, 'weight_decay': 1e-05, 'opt': 'Adam'}. Best is trial 659 with value: 0.3259113683638972.[0m
[32m[I 2022-12-30 08:04:12,299][0m Trial 679 finished with value: 0.32415541453558616 and parameters: {'hidden_size': 512, 'activation1': 'tanh', 'activation2': 'tanh', 'dropout': 0.1, 'lr': 0.01, 'weight_decay': 1e-05, 'opt': 'Adam'}. Best is trial 659 with value: 0.3259113683638972.[0m
[32m[I 2022-12-30 08:04:22,558][0m Trial 680 finished with value: 0.25112409091560034 and parameters: {'hidden_size': 512, 'activation1': 'tanh', 'activation2': 'relu', 'dropout': 0.1, 'lr': 0.01, 'weight_decay': 1e-05, 'opt': 'Adam'}. Best is trial 659 with value: 0.3259113683638972.[0m
[32m[I 2022-12-30 08:04:32,810][0m Trial 681 finished with value: 0.32342770938601645 and parameters: {'hidden_size': 512, 'activation1': 'tanh', 'activation2': 'tanh', 'dropout': 0.1, 'lr': 0.01, 'weight_decay': 1e-05, 'opt': 'Adam'}. Best is trial 659 with value: 0.3259113683638972.[0m
[32m[I 2022-12-30 08:04:43,473][0m Trial 682 finished with value: 0.3218100400723213 and parameters: {'hidden_size': 512, 'activation1': 'tanh', 'activation2': 'tanh', 'dropout': 0.1, 'lr': 0.01, 'weight_decay': 1e-05, 'opt': 'Adam'}. Best is trial 659 with value: 0.3259113683638972.[0m
[32m[I 2022-12-30 08:04:54,013][0m Trial 683 finished with value: 0.32396409835750006 and parameters: {'hidden_size': 512, 'activation1': 'tanh', 'activation2': 'tanh', 'dropout': 0.1, 'lr': 0.01, 'weight_decay': 1e-05, 'opt': 'Adam'}. Best is trial 659 with value: 0.3259113683638972.[0m
[32m[I 2022-12-30 08:05:04,232][0m Trial 684 finished with value: 0.32260231915299653 and parameters: {'hidden_size': 512, 'activation1': 'tanh', 'activation2': 'tanh', 'dropout': 0.1, 'lr': 0.01, 'weight_decay': 1e-05, 'opt': 'Adam'}. Best is trial 659 with value: 0.3259113683638972.[0m
[32m[I 2022-12-30 08:05:14,354][0m Trial 685 finished with value: 0.32020395340667795 and parameters: {'hidden_size': 512, 'activation1': 'tanh', 'activation2': 'tanh', 'dropout': 0.1, 'lr': 0.01, 'weight_decay': 1e-05, 'opt': 'Adam'}. Best is trial 659 with value: 0.3259113683638972.[0m
[32m[I 2022-12-30 08:05:24,669][0m Trial 686 finished with value: 0.3217299134650362 and parameters: {'hidden_size': 512, 'activation1': 'tanh', 'activation2': 'tanh', 'dropout': 0.1, 'lr': 0.01, 'weight_decay': 1e-05, 'opt': 'Adam'}. Best is trial 659 with value: 0.3259113683638972.[0m
[32m[I 2022-12-30 08:05:35,159][0m Trial 687 finished with value: 0.30449794524641083 and parameters: {'hidden_size': 128, 'activation1': 'tanh', 'activation2': 'tanh', 'dropout': 0.1, 'lr': 0.01, 'weight_decay': 1e-05, 'opt': 'Adam'}. Best is trial 659 with value: 0.3259113683638972.[0m
[32m[I 2022-12-30 08:05:45,444][0m Trial 688 finished with value: 0.32421996498186323 and parameters: {'hidden_size': 512, 'activation1': 'tanh', 'activation2': 'tanh', 'dropout': 0.1, 'lr': 0.01, 'weight_decay': 1e-05, 'opt': 'Adam'}. Best is trial 659 with value: 0.3259113683638972.[0m
[32m[I 2022-12-30 08:05:55,483][0m Trial 689 finished with value: 0.3239063485791516 and parameters: {'hidden_size': 512, 'activation1': 'tanh', 'activation2': 'tanh', 'dropout': 0.1, 'lr': 0.01, 'weight_decay': 1e-05, 'opt': 'Adam'}. Best is trial 659 with value: 0.3259113683638972.[0m
[32m[I 2022-12-30 08:06:05,528][0m Trial 690 finished with value: 0.31152938204575925 and parameters: {'hidden_size': 256, 'activation1': 'tanh', 'activation2': 'tanh', 'dropout': 0.1, 'lr': 0.01, 'weight_decay': 1e-05, 'opt': 'Adam'}. Best is trial 659 with value: 0.3259113683638972.[0m
[32m[I 2022-12-30 08:06:15,858][0m Trial 691 finished with value: 0.2970666327169872 and parameters: {'hidden_size': 512, 'activation1': 'relu', 'activation2': 'tanh', 'dropout': 0.1, 'lr': 0.01, 'weight_decay': 1e-05, 'opt': 'Adam'}. Best is trial 659 with value: 0.3259113683638972.[0m
[32m[I 2022-12-30 08:06:26,333][0m Trial 692 finished with value: 0.24879268874035138 and parameters: {'hidden_size': 512, 'activation1': 'tanh', 'activation2': 'sigmoid', 'dropout': 0.1, 'lr': 0.01, 'weight_decay': 1e-05, 'opt': 'Adam'}. Best is trial 659 with value: 0.3259113683638972.[0m
[32m[I 2022-12-30 08:06:36,460][0m Trial 693 finished with value: 0.3253152760197645 and parameters: {'hidden_size': 512, 'activation1': 'tanh', 'activation2': 'tanh', 'dropout': 0.1, 'lr': 0.01, 'weight_decay': 1e-05, 'opt': 'Adam'}. Best is trial 659 with value: 0.3259113683638972.[0m
[32m[I 2022-12-30 08:06:46,529][0m Trial 694 finished with value: 0.3234321592986716 and parameters: {'hidden_size': 512, 'activation1': 'tanh', 'activation2': 'tanh', 'dropout': 0.1, 'lr': 0.01, 'weight_decay': 1e-05, 'opt': 'Adam'}. Best is trial 659 with value: 0.3259113683638972.[0m
[32m[I 2022-12-30 08:06:56,680][0m Trial 695 finished with value: 0.32478337109787836 and parameters: {'hidden_size': 512, 'activation1': 'tanh', 'activation2': 'tanh', 'dropout': 0.1, 'lr': 0.01, 'weight_decay': 1e-05, 'opt': 'Adam'}. Best is trial 659 with value: 0.3259113683638972.[0m
[32m[I 2022-12-30 08:07:06,858][0m Trial 696 finished with value: 0.32390712460716076 and parameters: {'hidden_size': 512, 'activation1': 'tanh', 'activation2': 'tanh', 'dropout': 0.1, 'lr': 0.01, 'weight_decay': 1e-05, 'opt': 'Adam'}. Best is trial 659 with value: 0.3259113683638972.[0m
[32m[I 2022-12-30 08:07:17,495][0m Trial 697 finished with value: 0.32138115958345287 and parameters: {'hidden_size': 512, 'activation1': 'tanh', 'activation2': 'tanh', 'dropout': 0.1, 'lr': 0.01, 'weight_decay': 1e-05, 'opt': 'Adam'}. Best is trial 659 with value: 0.3259113683638972.[0m
[32m[I 2022-12-30 08:07:27,699][0m Trial 698 finished with value: 0.3242535564279399 and parameters: {'hidden_size': 512, 'activation1': 'tanh', 'activation2': 'tanh', 'dropout': 0.1, 'lr': 0.01, 'weight_decay': 1e-05, 'opt': 'Adam'}. Best is trial 659 with value: 0.3259113683638972.[0m
[32m[I 2022-12-30 08:07:38,306][0m Trial 699 finished with value: 0.32430974563552145 and parameters: {'hidden_size': 512, 'activation1': 'tanh', 'activation2': 'tanh', 'dropout': 0.1, 'lr': 0.01, 'weight_decay': 1e-05, 'opt': 'Adam'}. Best is trial 659 with value: 0.3259113683638972.[0m
[32m[I 2022-12-30 08:07:49,538][0m Trial 700 finished with value: 0.2746461849658379 and parameters: {'hidden_size': 512, 'activation1': 'sigmoid', 'activation2': 'tanh', 'dropout': 0.1, 'lr': 0.01, 'weight_decay': 1e-05, 'opt': 'Adam'}. Best is trial 659 with value: 0.3259113683638972.[0m
[32m[I 2022-12-30 08:08:00,984][0m Trial 701 finished with value: 0.3228102365170626 and parameters: {'hidden_size': 512, 'activation1': 'tanh', 'activation2': 'tanh', 'dropout': 0.2, 'lr': 0.01, 'weight_decay': 1e-05, 'opt': 'Adam'}. Best is trial 659 with value: 0.3259113683638972.[0m
[32m[I 2022-12-30 08:08:11,911][0m Trial 702 finished with value: 0.32225837108274347 and parameters: {'hidden_size': 512, 'activation1': 'tanh', 'activation2': 'tanh', 'dropout': 0.1, 'lr': 0.01, 'weight_decay': 1e-05, 'opt': 'Adam'}. Best is trial 659 with value: 0.3259113683638972.[0m
[32m[I 2022-12-30 08:08:23,019][0m Trial 703 finished with value: 0.2466379780000862 and parameters: {'hidden_size': 512, 'activation1': 'tanh', 'activation2': 'relu', 'dropout': 0.1, 'lr': 0.01, 'weight_decay': 1e-05, 'opt': 'Adam'}. Best is trial 659 with value: 0.3259113683638972.[0m
[32m[I 2022-12-30 08:08:33,927][0m Trial 704 finished with value: 0.32243956804608875 and parameters: {'hidden_size': 512, 'activation1': 'tanh', 'activation2': 'tanh', 'dropout': 0.1, 'lr': 0.01, 'weight_decay': 1e-05, 'opt': 'Adam'}. Best is trial 659 with value: 0.3259113683638972.[0m
[32m[I 2022-12-30 08:08:44,550][0m Trial 705 finished with value: 0.3227178294527452 and parameters: {'hidden_size': 512, 'activation1': 'tanh', 'activation2': 'tanh', 'dropout': 0.1, 'lr': 0.01, 'weight_decay': 1e-05, 'opt': 'Adam'}. Best is trial 659 with value: 0.3259113683638972.[0m
[32m[I 2022-12-30 08:08:55,228][0m Trial 706 finished with value: 0.3225399047232373 and parameters: {'hidden_size': 512, 'activation1': 'tanh', 'activation2': 'tanh', 'dropout': 0.1, 'lr': 0.01, 'weight_decay': 1e-05, 'opt': 'Adam'}. Best is trial 659 with value: 0.3259113683638972.[0m
[32m[I 2022-12-30 08:09:05,546][0m Trial 707 finished with value: 0.3236131853477958 and parameters: {'hidden_size': 512, 'activation1': 'tanh', 'activation2': 'tanh', 'dropout': 0.1, 'lr': 0.01, 'weight_decay': 1e-05, 'opt': 'Adam'}. Best is trial 659 with value: 0.3259113683638972.[0m
[32m[I 2022-12-30 08:09:16,071][0m Trial 708 finished with value: 0.3225874008668047 and parameters: {'hidden_size': 512, 'activation1': 'tanh', 'activation2': 'tanh', 'dropout': 0.1, 'lr': 0.01, 'weight_decay': 1e-05, 'opt': 'Adam'}. Best is trial 659 with value: 0.3259113683638972.[0m
[32m[I 2022-12-30 08:09:26,925][0m Trial 709 finished with value: 0.32286259972462555 and parameters: {'hidden_size': 512, 'activation1': 'tanh', 'activation2': 'tanh', 'dropout': 0.1, 'lr': 0.01, 'weight_decay': 1e-05, 'opt': 'Adam'}. Best is trial 659 with value: 0.3259113683638972.[0m
[32m[I 2022-12-30 08:09:37,678][0m Trial 710 finished with value: 0.3211099635995837 and parameters: {'hidden_size': 512, 'activation1': 'tanh', 'activation2': 'tanh', 'dropout': 0.1, 'lr': 0.01, 'weight_decay': 1e-05, 'opt': 'Adam'}. Best is trial 659 with value: 0.3259113683638972.[0m
[32m[I 2022-12-30 08:09:48,383][0m Trial 711 finished with value: 0.32271078450312707 and parameters: {'hidden_size': 512, 'activation1': 'tanh', 'activation2': 'tanh', 'dropout': 0.1, 'lr': 0.01, 'weight_decay': 1e-05, 'opt': 'Adam'}. Best is trial 659 with value: 0.3259113683638972.[0m
[32m[I 2022-12-30 08:09:58,865][0m Trial 712 finished with value: 0.30485283737660396 and parameters: {'hidden_size': 128, 'activation1': 'tanh', 'activation2': 'tanh', 'dropout': 0.1, 'lr': 0.01, 'weight_decay': 1e-05, 'opt': 'Adam'}. Best is trial 659 with value: 0.3259113683638972.[0m
[32m[I 2022-12-30 08:10:09,691][0m Trial 713 finished with value: 0.2841059974378536 and parameters: {'hidden_size': 512, 'activation1': 'relu', 'activation2': 'tanh', 'dropout': 0.1, 'lr': 0.01, 'weight_decay': 1e-05, 'opt': 'Adam'}. Best is trial 659 with value: 0.3259113683638972.[0m
[32m[I 2022-12-30 08:10:20,883][0m Trial 714 finished with value: 0.23969928214379266 and parameters: {'hidden_size': 256, 'activation1': 'tanh', 'activation2': 'sigmoid', 'dropout': 0.1, 'lr': 0.01, 'weight_decay': 1e-05, 'opt': 'Adam'}. Best is trial 659 with value: 0.3259113683638972.[0m
[32m[I 2022-12-30 08:10:31,669][0m Trial 715 finished with value: 0.3232023367295843 and parameters: {'hidden_size': 512, 'activation1': 'tanh', 'activation2': 'tanh', 'dropout': 0.1, 'lr': 0.01, 'weight_decay': 1e-05, 'opt': 'Adam'}. Best is trial 659 with value: 0.3259113683638972.[0m
[32m[I 2022-12-30 08:10:42,063][0m Trial 716 finished with value: 0.32430663130693727 and parameters: {'hidden_size': 512, 'activation1': 'tanh', 'activation2': 'tanh', 'dropout': 0.1, 'lr': 0.01, 'weight_decay': 1e-05, 'opt': 'Adam'}. Best is trial 659 with value: 0.3259113683638972.[0m
[32m[I 2022-12-30 08:10:52,316][0m Trial 717 finished with value: 0.3247493132396515 and parameters: {'hidden_size': 512, 'activation1': 'tanh', 'activation2': 'tanh', 'dropout': 0.1, 'lr': 0.01, 'weight_decay': 1e-05, 'opt': 'Adam'}. Best is trial 659 with value: 0.3259113683638972.[0m
[32m[I 2022-12-30 08:11:02,453][0m Trial 718 finished with value: 0.3243111048722834 and parameters: {'hidden_size': 512, 'activation1': 'tanh', 'activation2': 'tanh', 'dropout': 0.1, 'lr': 0.01, 'weight_decay': 1e-05, 'opt': 'Adam'}. Best is trial 659 with value: 0.3259113683638972.[0m
[32m[I 2022-12-30 08:11:12,659][0m Trial 719 finished with value: 0.3248511201162924 and parameters: {'hidden_size': 512, 'activation1': 'tanh', 'activation2': 'tanh', 'dropout': 0.1, 'lr': 0.01, 'weight_decay': 1e-05, 'opt': 'Adam'}. Best is trial 659 with value: 0.3259113683638972.[0m
[32m[I 2022-12-30 08:11:22,834][0m Trial 720 finished with value: 0.32326146956849344 and parameters: {'hidden_size': 512, 'activation1': 'tanh', 'activation2': 'tanh', 'dropout': 0.1, 'lr': 0.01, 'weight_decay': 1e-05, 'opt': 'Adam'}. Best is trial 659 with value: 0.3259113683638972.[0m
[32m[I 2022-12-30 08:11:32,998][0m Trial 721 finished with value: 0.32222728962061237 and parameters: {'hidden_size': 512, 'activation1': 'tanh', 'activation2': 'tanh', 'dropout': 0.1, 'lr': 0.01, 'weight_decay': 1e-05, 'opt': 'Adam'}. Best is trial 659 with value: 0.3259113683638972.[0m
[32m[I 2022-12-30 08:11:43,174][0m Trial 722 finished with value: 0.32671537835324177 and parameters: {'hidden_size': 512, 'activation1': 'tanh', 'activation2': 'tanh', 'dropout': 0.1, 'lr': 0.01, 'weight_decay': 1e-05, 'opt': 'Adam'}. Best is trial 722 with value: 0.32671537835324177.[0m
[32m[I 2022-12-30 08:11:53,307][0m Trial 723 finished with value: 0.32302829383460485 and parameters: {'hidden_size': 512, 'activation1': 'tanh', 'activation2': 'tanh', 'dropout': 0.1, 'lr': 0.01, 'weight_decay': 1e-05, 'opt': 'Adam'}. Best is trial 722 with value: 0.32671537835324177.[0m
[32m[I 2022-12-30 08:12:03,417][0m Trial 724 finished with value: 0.3226899176708161 and parameters: {'hidden_size': 512, 'activation1': 'tanh', 'activation2': 'tanh', 'dropout': 0.1, 'lr': 0.01, 'weight_decay': 1e-05, 'opt': 'Adam'}. Best is trial 722 with value: 0.32671537835324177.[0m
[32m[I 2022-12-30 08:12:13,602][0m Trial 725 finished with value: 0.324376227366827 and parameters: {'hidden_size': 512, 'activation1': 'tanh', 'activation2': 'tanh', 'dropout': 0.1, 'lr': 0.01, 'weight_decay': 1e-05, 'opt': 'Adam'}. Best is trial 722 with value: 0.32671537835324177.[0m
[32m[I 2022-12-30 08:12:23,977][0m Trial 726 finished with value: 0.26257590070276143 and parameters: {'hidden_size': 512, 'activation1': 'sigmoid', 'activation2': 'relu', 'dropout': 0.1, 'lr': 0.01, 'weight_decay': 1e-05, 'opt': 'Adam'}. Best is trial 722 with value: 0.32671537835324177.[0m
[32m[I 2022-12-30 08:12:33,995][0m Trial 727 finished with value: 0.32355735265802676 and parameters: {'hidden_size': 512, 'activation1': 'tanh', 'activation2': 'tanh', 'dropout': 0.2, 'lr': 0.01, 'weight_decay': 1e-05, 'opt': 'Adam'}. Best is trial 722 with value: 0.32671537835324177.[0m
[32m[I 2022-12-30 08:12:44,148][0m Trial 728 finished with value: 0.32329564975215475 and parameters: {'hidden_size': 512, 'activation1': 'tanh', 'activation2': 'tanh', 'dropout': 0.1, 'lr': 0.01, 'weight_decay': 1e-05, 'opt': 'Adam'}. Best is trial 722 with value: 0.32671537835324177.[0m
[32m[I 2022-12-30 08:12:54,108][0m Trial 729 finished with value: 0.32240224733294226 and parameters: {'hidden_size': 512, 'activation1': 'tanh', 'activation2': 'tanh', 'dropout': 0.1, 'lr': 0.01, 'weight_decay': 1e-05, 'opt': 'Adam'}. Best is trial 722 with value: 0.32671537835324177.[0m
[32m[I 2022-12-30 08:13:04,718][0m Trial 730 finished with value: 0.3230129438321442 and parameters: {'hidden_size': 512, 'activation1': 'tanh', 'activation2': 'tanh', 'dropout': 0.1, 'lr': 0.01, 'weight_decay': 1e-05, 'opt': 'Adam'}. Best is trial 722 with value: 0.32671537835324177.[0m
[32m[I 2022-12-30 08:13:15,230][0m Trial 731 finished with value: 0.3259420438416351 and parameters: {'hidden_size': 512, 'activation1': 'tanh', 'activation2': 'tanh', 'dropout': 0.1, 'lr': 0.01, 'weight_decay': 1e-05, 'opt': 'Adam'}. Best is trial 722 with value: 0.32671537835324177.[0m
[32m[I 2022-12-30 08:13:25,702][0m Trial 732 finished with value: 0.3224375398824205 and parameters: {'hidden_size': 512, 'activation1': 'tanh', 'activation2': 'tanh', 'dropout': 0.1, 'lr': 0.01, 'weight_decay': 1e-05, 'opt': 'Adam'}. Best is trial 722 with value: 0.32671537835324177.[0m
[32m[I 2022-12-30 08:13:35,883][0m Trial 733 finished with value: 0.32339431115692063 and parameters: {'hidden_size': 512, 'activation1': 'tanh', 'activation2': 'tanh', 'dropout': 0.1, 'lr': 0.01, 'weight_decay': 1e-05, 'opt': 'Adam'}. Best is trial 722 with value: 0.32671537835324177.[0m
[32m[I 2022-12-30 08:13:45,932][0m Trial 734 finished with value: 0.3232091839471559 and parameters: {'hidden_size': 512, 'activation1': 'tanh', 'activation2': 'tanh', 'dropout': 0.1, 'lr': 0.01, 'weight_decay': 1e-05, 'opt': 'Adam'}. Best is trial 722 with value: 0.32671537835324177.[0m
[32m[I 2022-12-30 08:13:56,186][0m Trial 735 finished with value: 0.3225531513847013 and parameters: {'hidden_size': 512, 'activation1': 'tanh', 'activation2': 'tanh', 'dropout': 0.1, 'lr': 0.01, 'weight_decay': 1e-05, 'opt': 'Adam'}. Best is trial 722 with value: 0.32671537835324177.[0m
[32m[I 2022-12-30 08:14:06,231][0m Trial 736 finished with value: 0.2972306867440995 and parameters: {'hidden_size': 128, 'activation1': 'relu', 'activation2': 'tanh', 'dropout': 0.1, 'lr': 0.01, 'weight_decay': 1e-05, 'opt': 'Adam'}. Best is trial 722 with value: 0.32671537835324177.[0m
[32m[I 2022-12-30 08:14:16,152][0m Trial 737 finished with value: 0.32472401647371407 and parameters: {'hidden_size': 512, 'activation1': 'tanh', 'activation2': 'tanh', 'dropout': 0.1, 'lr': 0.01, 'weight_decay': 1e-05, 'opt': 'Adam'}. Best is trial 722 with value: 0.32671537835324177.[0m
[32m[I 2022-12-30 08:14:26,205][0m Trial 738 finished with value: 0.23853252422418728 and parameters: {'hidden_size': 256, 'activation1': 'tanh', 'activation2': 'sigmoid', 'dropout': 0.1, 'lr': 0.01, 'weight_decay': 1e-05, 'opt': 'Adam'}. Best is trial 722 with value: 0.32671537835324177.[0m
[32m[I 2022-12-30 08:14:36,399][0m Trial 739 finished with value: 0.32203747716149644 and parameters: {'hidden_size': 512, 'activation1': 'tanh', 'activation2': 'tanh', 'dropout': 0.1, 'lr': 0.01, 'weight_decay': 1e-05, 'opt': 'Adam'}. Best is trial 722 with value: 0.32671537835324177.[0m
