[32m[I 2022-12-30 11:23:19,918][0m Trial 1854 finished with value: 0.3245152363626478 and parameters: {'hidden_size': 512, 'activation1': 'tanh', 'activation2': 'tanh', 'dropout': 0.05, 'lr': 0.01, 'weight_decay': 1e-05, 'opt': 'Adam'}. Best is trial 1799 with value: 0.32750146082422843.[0m
[32m[I 2022-12-30 11:23:29,166][0m Trial 1855 finished with value: 0.32435408548938316 and parameters: {'hidden_size': 512, 'activation1': 'tanh', 'activation2': 'tanh', 'dropout': 0.05, 'lr': 0.01, 'weight_decay': 1e-05, 'opt': 'Adam'}. Best is trial 1799 with value: 0.32750146082422843.[0m
[32m[I 2022-12-30 11:23:38,508][0m Trial 1856 finished with value: 0.2467023204915421 and parameters: {'hidden_size': 512, 'activation1': 'tanh', 'activation2': 'relu', 'dropout': 0.05, 'lr': 0.01, 'weight_decay': 1e-05, 'opt': 'Adam'}. Best is trial 1799 with value: 0.32750146082422843.[0m
[32m[I 2022-12-30 11:23:47,771][0m Trial 1857 finished with value: 0.3125662842176623 and parameters: {'hidden_size': 1024, 'activation1': 'tanh', 'activation2': 'tanh', 'dropout': 0.05, 'lr': 0.01, 'weight_decay': 3e-06, 'opt': 'Adam'}. Best is trial 1799 with value: 0.32750146082422843.[0m
[32m[I 2022-12-30 11:23:55,339][0m Trial 1858 finished with value: 0.2895604118035038 and parameters: {'hidden_size': 512, 'activation1': 'tanh', 'activation2': 'tanh', 'dropout': 0.2, 'lr': 0.0003, 'weight_decay': 1e-05, 'opt': 'SGD'}. Best is trial 1799 with value: 0.32750146082422843.[0m
[32m[I 2022-12-30 11:24:04,728][0m Trial 1859 finished with value: 0.32292773949663933 and parameters: {'hidden_size': 512, 'activation1': 'tanh', 'activation2': 'tanh', 'dropout': 0.05, 'lr': 0.01, 'weight_decay': 1e-05, 'opt': 'Adam'}. Best is trial 1799 with value: 0.32750146082422843.[0m
[32m[I 2022-12-30 11:24:14,046][0m Trial 1860 finished with value: 0.32314097440983863 and parameters: {'hidden_size': 512, 'activation1': 'tanh', 'activation2': 'tanh', 'dropout': 0.05, 'lr': 0.01, 'weight_decay': 1e-05, 'opt': 'Adam'}. Best is trial 1799 with value: 0.32750146082422843.[0m
[32m[I 2022-12-30 11:24:23,449][0m Trial 1861 finished with value: 0.3233262585656382 and parameters: {'hidden_size': 512, 'activation1': 'tanh', 'activation2': 'tanh', 'dropout': 0.05, 'lr': 0.01, 'weight_decay': 1e-05, 'opt': 'Adam'}. Best is trial 1799 with value: 0.32750146082422843.[0m
[32m[I 2022-12-30 11:24:32,859][0m Trial 1862 finished with value: 0.3231218361104272 and parameters: {'hidden_size': 512, 'activation1': 'tanh', 'activation2': 'tanh', 'dropout': 0.05, 'lr': 0.01, 'weight_decay': 1e-05, 'opt': 'Adam'}. Best is trial 1799 with value: 0.32750146082422843.[0m
[32m[I 2022-12-30 11:24:42,348][0m Trial 1863 finished with value: 0.3253853375491528 and parameters: {'hidden_size': 512, 'activation1': 'tanh', 'activation2': 'tanh', 'dropout': 0.05, 'lr': 0.01, 'weight_decay': 3e-06, 'opt': 'Adam'}. Best is trial 1799 with value: 0.32750146082422843.[0m
[32m[I 2022-12-30 11:24:51,922][0m Trial 1864 finished with value: 0.29888428974086656 and parameters: {'hidden_size': 512, 'activation1': 'relu', 'activation2': 'tanh', 'dropout': 0.05, 'lr': 0.01, 'weight_decay': 1e-05, 'opt': 'Adam'}. Best is trial 1799 with value: 0.32750146082422843.[0m
[32m[I 2022-12-30 11:25:01,488][0m Trial 1865 finished with value: 0.32270859728056456 and parameters: {'hidden_size': 512, 'activation1': 'tanh', 'activation2': 'tanh', 'dropout': 0.05, 'lr': 0.01, 'weight_decay': 1e-05, 'opt': 'Adam'}. Best is trial 1799 with value: 0.32750146082422843.[0m
[32m[I 2022-12-30 11:25:10,821][0m Trial 1866 finished with value: 0.32391841250154774 and parameters: {'hidden_size': 512, 'activation1': 'tanh', 'activation2': 'tanh', 'dropout': 0.05, 'lr': 0.01, 'weight_decay': 1e-05, 'opt': 'Adam'}. Best is trial 1799 with value: 0.32750146082422843.[0m
[32m[I 2022-12-30 11:25:20,170][0m Trial 1867 finished with value: 0.24638161858040517 and parameters: {'hidden_size': 512, 'activation1': 'tanh', 'activation2': 'sigmoid', 'dropout': 0.05, 'lr': 0.01, 'weight_decay': 1e-05, 'opt': 'Adam'}. Best is trial 1799 with value: 0.32750146082422843.[0m
[32m[I 2022-12-30 11:25:29,477][0m Trial 1868 finished with value: 0.3221370383466158 and parameters: {'hidden_size': 512, 'activation1': 'tanh', 'activation2': 'tanh', 'dropout': 0.05, 'lr': 0.01, 'weight_decay': 1e-05, 'opt': 'Adam'}. Best is trial 1799 with value: 0.32750146082422843.[0m
[32m[I 2022-12-30 11:25:38,796][0m Trial 1869 finished with value: 0.30248137771276146 and parameters: {'hidden_size': 128, 'activation1': 'tanh', 'activation2': 'tanh', 'dropout': 0.05, 'lr': 0.01, 'weight_decay': 1e-05, 'opt': 'Adam'}. Best is trial 1799 with value: 0.32750146082422843.[0m
[32m[I 2022-12-30 11:25:48,134][0m Trial 1870 finished with value: 0.3148040195501035 and parameters: {'hidden_size': 512, 'activation1': 'tanh', 'activation2': 'tanh', 'dropout': 0.05, 'lr': 0.003, 'weight_decay': 3e-06, 'opt': 'Adam'}. Best is trial 1799 with value: 0.32750146082422843.[0m
[32m[I 2022-12-30 11:25:57,641][0m Trial 1871 finished with value: 0.32344657491483886 and parameters: {'hidden_size': 512, 'activation1': 'tanh', 'activation2': 'tanh', 'dropout': 0.05, 'lr': 0.01, 'weight_decay': 1e-05, 'opt': 'Adam'}. Best is trial 1799 with value: 0.32750146082422843.[0m
[32m[I 2022-12-30 11:26:07,040][0m Trial 1872 finished with value: 0.3105172485346948 and parameters: {'hidden_size': 256, 'activation1': 'tanh', 'activation2': 'tanh', 'dropout': 0.05, 'lr': 0.01, 'weight_decay': 1e-05, 'opt': 'Adam'}. Best is trial 1799 with value: 0.32750146082422843.[0m
[32m[I 2022-12-30 11:26:16,120][0m Trial 1873 finished with value: 0.3251921560261918 and parameters: {'hidden_size': 512, 'activation1': 'tanh', 'activation2': 'tanh', 'dropout': 0, 'lr': 0.01, 'weight_decay': 1e-05, 'opt': 'Adam'}. Best is trial 1799 with value: 0.32750146082422843.[0m
[32m[I 2022-12-30 11:26:25,365][0m Trial 1874 finished with value: 0.32325469344377544 and parameters: {'hidden_size': 512, 'activation1': 'tanh', 'activation2': 'tanh', 'dropout': 0.05, 'lr': 0.01, 'weight_decay': 1e-05, 'opt': 'Adam'}. Best is trial 1799 with value: 0.32750146082422843.[0m
[32m[I 2022-12-30 11:26:34,712][0m Trial 1875 finished with value: 0.3255216040246095 and parameters: {'hidden_size': 512, 'activation1': 'tanh', 'activation2': 'tanh', 'dropout': 0.05, 'lr': 0.01, 'weight_decay': 1e-05, 'opt': 'Adam'}. Best is trial 1799 with value: 0.32750146082422843.[0m
[32m[I 2022-12-30 11:26:44,344][0m Trial 1876 finished with value: 0.2734391287812852 and parameters: {'hidden_size': 512, 'activation1': 'sigmoid', 'activation2': 'tanh', 'dropout': 0.2, 'lr': 0.01, 'weight_decay': 3e-06, 'opt': 'Adam'}. Best is trial 1799 with value: 0.32750146082422843.[0m
[32m[I 2022-12-30 11:26:53,708][0m Trial 1877 finished with value: 0.3233287627893443 and parameters: {'hidden_size': 512, 'activation1': 'tanh', 'activation2': 'tanh', 'dropout': 0.05, 'lr': 0.01, 'weight_decay': 1e-05, 'opt': 'Adam'}. Best is trial 1799 with value: 0.32750146082422843.[0m
[32m[I 2022-12-30 11:27:03,044][0m Trial 1878 finished with value: 0.2461424804547982 and parameters: {'hidden_size': 512, 'activation1': 'tanh', 'activation2': 'relu', 'dropout': 0.05, 'lr': 0.01, 'weight_decay': 1e-05, 'opt': 'Adam'}. Best is trial 1799 with value: 0.32750146082422843.[0m
[32m[I 2022-12-30 11:27:10,854][0m Trial 1879 finished with value: 0.07079253856437628 and parameters: {'hidden_size': 512, 'activation1': 'tanh', 'activation2': 'tanh', 'dropout': 0.05, 'lr': 0.01, 'weight_decay': 1e-05, 'opt': 'SGD'}. Best is trial 1799 with value: 0.32750146082422843.[0m
[32m[I 2022-12-30 11:27:22,213][0m Trial 1880 finished with value: 0.32216191310945186 and parameters: {'hidden_size': 512, 'activation1': 'tanh', 'activation2': 'tanh', 'dropout': 0.05, 'lr': 0.01, 'weight_decay': 1e-05, 'opt': 'Adam'}. Best is trial 1799 with value: 0.32750146082422843.[0m
[32m[I 2022-12-30 11:27:32,666][0m Trial 1881 finished with value: 0.3126524554972822 and parameters: {'hidden_size': 1024, 'activation1': 'tanh', 'activation2': 'tanh', 'dropout': 0.05, 'lr': 0.01, 'weight_decay': 1e-05, 'opt': 'Adam'}. Best is trial 1799 with value: 0.32750146082422843.[0m
[32m[I 2022-12-30 11:27:42,777][0m Trial 1882 finished with value: 0.31640658062878013 and parameters: {'hidden_size': 512, 'activation1': 'tanh', 'activation2': 'tanh', 'dropout': 0.05, 'lr': 0.0003, 'weight_decay': 3e-06, 'opt': 'Adam'}. Best is trial 1799 with value: 0.32750146082422843.[0m
[32m[I 2022-12-30 11:27:52,105][0m Trial 1883 finished with value: 0.3235071310986764 and parameters: {'hidden_size': 512, 'activation1': 'tanh', 'activation2': 'tanh', 'dropout': 0.05, 'lr': 0.01, 'weight_decay': 1e-05, 'opt': 'Adam'}. Best is trial 1799 with value: 0.32750146082422843.[0m
[32m[I 2022-12-30 11:28:01,545][0m Trial 1884 finished with value: 0.32332211673287836 and parameters: {'hidden_size': 512, 'activation1': 'tanh', 'activation2': 'tanh', 'dropout': 0.05, 'lr': 0.01, 'weight_decay': 1e-05, 'opt': 'Adam'}. Best is trial 1799 with value: 0.32750146082422843.[0m
[32m[I 2022-12-30 11:28:10,946][0m Trial 1885 finished with value: 0.32690511769224295 and parameters: {'hidden_size': 512, 'activation1': 'tanh', 'activation2': 'tanh', 'dropout': 0.05, 'lr': 0.01, 'weight_decay': 1e-05, 'opt': 'Adam'}. Best is trial 1799 with value: 0.32750146082422843.[0m
[32m[I 2022-12-30 11:28:20,534][0m Trial 1886 finished with value: 0.28932809121241665 and parameters: {'hidden_size': 512, 'activation1': 'relu', 'activation2': 'tanh', 'dropout': 0.05, 'lr': 0.01, 'weight_decay': 1e-05, 'opt': 'Adam'}. Best is trial 1799 with value: 0.32750146082422843.[0m
[32m[I 2022-12-30 11:28:29,917][0m Trial 1887 finished with value: 0.32428477200602757 and parameters: {'hidden_size': 512, 'activation1': 'tanh', 'activation2': 'tanh', 'dropout': 0.05, 'lr': 0.01, 'weight_decay': 1e-05, 'opt': 'Adam'}. Best is trial 1799 with value: 0.32750146082422843.[0m
[32m[I 2022-12-30 11:28:39,232][0m Trial 1888 finished with value: 0.32337818951590724 and parameters: {'hidden_size': 512, 'activation1': 'tanh', 'activation2': 'tanh', 'dropout': 0.05, 'lr': 0.01, 'weight_decay': 1e-05, 'opt': 'Adam'}. Best is trial 1799 with value: 0.32750146082422843.[0m
[32m[I 2022-12-30 11:28:48,660][0m Trial 1889 finished with value: 0.24542729090026255 and parameters: {'hidden_size': 512, 'activation1': 'tanh', 'activation2': 'sigmoid', 'dropout': 0.05, 'lr': 0.01, 'weight_decay': 1e-05, 'opt': 'Adam'}. Best is trial 1799 with value: 0.32750146082422843.[0m
[32m[I 2022-12-30 11:28:57,961][0m Trial 1890 finished with value: 0.32451207549897443 and parameters: {'hidden_size': 512, 'activation1': 'tanh', 'activation2': 'tanh', 'dropout': 0.05, 'lr': 0.01, 'weight_decay': 1e-05, 'opt': 'Adam'}. Best is trial 1799 with value: 0.32750146082422843.[0m
[32m[I 2022-12-30 11:29:07,009][0m Trial 1891 finished with value: 0.3208301824853197 and parameters: {'hidden_size': 512, 'activation1': 'tanh', 'activation2': 'tanh', 'dropout': 0, 'lr': 0.01, 'weight_decay': 1e-05, 'opt': 'Adam'}. Best is trial 1799 with value: 0.32750146082422843.[0m
[32m[I 2022-12-30 11:29:16,281][0m Trial 1892 finished with value: 0.3053617252237511 and parameters: {'hidden_size': 128, 'activation1': 'tanh', 'activation2': 'tanh', 'dropout': 0.05, 'lr': 0.01, 'weight_decay': 1e-05, 'opt': 'Adam'}. Best is trial 1799 with value: 0.32750146082422843.[0m
[32m[I 2022-12-30 11:29:25,636][0m Trial 1893 finished with value: 0.31851570472705965 and parameters: {'hidden_size': 512, 'activation1': 'tanh', 'activation2': 'tanh', 'dropout': 0.2, 'lr': 0.003, 'weight_decay': 1e-05, 'opt': 'Adam'}. Best is trial 1799 with value: 0.32750146082422843.[0m
[32m[I 2022-12-30 11:29:35,067][0m Trial 1894 finished with value: 0.3209849394779215 and parameters: {'hidden_size': 512, 'activation1': 'tanh', 'activation2': 'tanh', 'dropout': 0.05, 'lr': 0.01, 'weight_decay': 1e-05, 'opt': 'Adam'}. Best is trial 1799 with value: 0.32750146082422843.[0m
[32m[I 2022-12-30 11:29:44,484][0m Trial 1895 finished with value: 0.31177350155207023 and parameters: {'hidden_size': 256, 'activation1': 'tanh', 'activation2': 'tanh', 'dropout': 0.05, 'lr': 0.01, 'weight_decay': 1e-05, 'opt': 'Adam'}. Best is trial 1799 with value: 0.32750146082422843.[0m
[32m[I 2022-12-30 11:29:53,894][0m Trial 1896 finished with value: 0.323362298898514 and parameters: {'hidden_size': 512, 'activation1': 'tanh', 'activation2': 'tanh', 'dropout': 0.05, 'lr': 0.01, 'weight_decay': 1e-05, 'opt': 'Adam'}. Best is trial 1799 with value: 0.32750146082422843.[0m
[32m[I 2022-12-30 11:30:03,326][0m Trial 1897 finished with value: 0.32319731437943566 and parameters: {'hidden_size': 512, 'activation1': 'tanh', 'activation2': 'tanh', 'dropout': 0.05, 'lr': 0.01, 'weight_decay': 1e-05, 'opt': 'Adam'}. Best is trial 1799 with value: 0.32750146082422843.[0m
[32m[I 2022-12-30 11:30:12,955][0m Trial 1898 finished with value: 0.27511511528139243 and parameters: {'hidden_size': 512, 'activation1': 'sigmoid', 'activation2': 'tanh', 'dropout': 0.05, 'lr': 0.01, 'weight_decay': 1e-05, 'opt': 'Adam'}. Best is trial 1799 with value: 0.32750146082422843.[0m
[32m[I 2022-12-30 11:30:20,026][0m Trial 1899 finished with value: 0.034056806273878325 and parameters: {'hidden_size': 512, 'activation1': 'tanh', 'activation2': 'tanh', 'dropout': 0.05, 'lr': 0.01, 'weight_decay': 1e-05, 'opt': 'SGD'}. Best is trial 1799 with value: 0.32750146082422843.[0m
[32m[I 2022-12-30 11:30:29,373][0m Trial 1900 finished with value: 0.2448884151930284 and parameters: {'hidden_size': 512, 'activation1': 'tanh', 'activation2': 'relu', 'dropout': 0.05, 'lr': 0.01, 'weight_decay': 1e-05, 'opt': 'Adam'}. Best is trial 1799 with value: 0.32750146082422843.[0m
[32m[I 2022-12-30 11:30:38,895][0m Trial 1901 finished with value: 0.3256276398184754 and parameters: {'hidden_size': 512, 'activation1': 'tanh', 'activation2': 'tanh', 'dropout': 0.05, 'lr': 0.01, 'weight_decay': 1e-05, 'opt': 'Adam'}. Best is trial 1799 with value: 0.32750146082422843.[0m
[32m[I 2022-12-30 11:30:48,291][0m Trial 1902 finished with value: 0.3239922787592044 and parameters: {'hidden_size': 512, 'activation1': 'tanh', 'activation2': 'tanh', 'dropout': 0.05, 'lr': 0.01, 'weight_decay': 1e-05, 'opt': 'Adam'}. Best is trial 1799 with value: 0.32750146082422843.[0m
[32m[I 2022-12-30 11:30:57,671][0m Trial 1903 finished with value: 0.32496485568530414 and parameters: {'hidden_size': 512, 'activation1': 'tanh', 'activation2': 'tanh', 'dropout': 0.05, 'lr': 0.01, 'weight_decay': 1e-05, 'opt': 'Adam'}. Best is trial 1799 with value: 0.32750146082422843.[0m
[32m[I 2022-12-30 11:31:07,044][0m Trial 1904 finished with value: 0.32617417215570366 and parameters: {'hidden_size': 512, 'activation1': 'tanh', 'activation2': 'tanh', 'dropout': 0.05, 'lr': 0.01, 'weight_decay': 1e-05, 'opt': 'Adam'}. Best is trial 1799 with value: 0.32750146082422843.[0m
[32m[I 2022-12-30 11:31:16,598][0m Trial 1905 finished with value: 0.31318244294740677 and parameters: {'hidden_size': 1024, 'activation1': 'tanh', 'activation2': 'tanh', 'dropout': 0.05, 'lr': 0.0003, 'weight_decay': 1e-05, 'opt': 'Adam'}. Best is trial 1799 with value: 0.32750146082422843.[0m
[32m[I 2022-12-30 11:31:25,867][0m Trial 1906 finished with value: 0.3271162676262758 and parameters: {'hidden_size': 512, 'activation1': 'tanh', 'activation2': 'tanh', 'dropout': 0.05, 'lr': 0.01, 'weight_decay': 1e-05, 'opt': 'Adam'}. Best is trial 1799 with value: 0.32750146082422843.[0m
[32m[I 2022-12-30 11:31:35,197][0m Trial 1907 finished with value: 0.32279877308375343 and parameters: {'hidden_size': 512, 'activation1': 'tanh', 'activation2': 'tanh', 'dropout': 0.05, 'lr': 0.01, 'weight_decay': 1e-05, 'opt': 'Adam'}. Best is trial 1799 with value: 0.32750146082422843.[0m
[32m[I 2022-12-30 11:31:44,352][0m Trial 1908 finished with value: 0.32297879086369086 and parameters: {'hidden_size': 512, 'activation1': 'tanh', 'activation2': 'tanh', 'dropout': 0, 'lr': 0.01, 'weight_decay': 1e-05, 'opt': 'Adam'}. Best is trial 1799 with value: 0.32750146082422843.[0m
[32m[I 2022-12-30 11:31:53,801][0m Trial 1909 finished with value: 0.2961647238867724 and parameters: {'hidden_size': 512, 'activation1': 'relu', 'activation2': 'tanh', 'dropout': 0.05, 'lr': 0.01, 'weight_decay': 1e-05, 'opt': 'Adam'}. Best is trial 1799 with value: 0.32750146082422843.[0m
[32m[I 2022-12-30 11:32:03,220][0m Trial 1910 finished with value: 0.32502293591754794 and parameters: {'hidden_size': 512, 'activation1': 'tanh', 'activation2': 'tanh', 'dropout': 0.05, 'lr': 0.01, 'weight_decay': 1e-05, 'opt': 'Adam'}. Best is trial 1799 with value: 0.32750146082422843.[0m
[32m[I 2022-12-30 11:32:12,554][0m Trial 1911 finished with value: 0.3215267135164302 and parameters: {'hidden_size': 512, 'activation1': 'tanh', 'activation2': 'tanh', 'dropout': 0.05, 'lr': 0.01, 'weight_decay': 1e-05, 'opt': 'Adam'}. Best is trial 1799 with value: 0.32750146082422843.[0m
[32m[I 2022-12-30 11:32:22,160][0m Trial 1912 finished with value: 0.24345787569272598 and parameters: {'hidden_size': 512, 'activation1': 'tanh', 'activation2': 'sigmoid', 'dropout': 0.05, 'lr': 0.01, 'weight_decay': 1e-05, 'opt': 'Adam'}. Best is trial 1799 with value: 0.32750146082422843.[0m
[32m[I 2022-12-30 11:32:32,047][0m Trial 1913 finished with value: 0.32547327890436717 and parameters: {'hidden_size': 512, 'activation1': 'tanh', 'activation2': 'tanh', 'dropout': 0.05, 'lr': 0.01, 'weight_decay': 1e-05, 'opt': 'Adam'}. Best is trial 1799 with value: 0.32750146082422843.[0m
[32m[I 2022-12-30 11:32:42,002][0m Trial 1914 finished with value: 0.32329983428902836 and parameters: {'hidden_size': 512, 'activation1': 'tanh', 'activation2': 'tanh', 'dropout': 0.05, 'lr': 0.01, 'weight_decay': 1e-05, 'opt': 'Adam'}. Best is trial 1799 with value: 0.32750146082422843.[0m
[32m[I 2022-12-30 11:32:52,067][0m Trial 1915 finished with value: 0.3194515060866293 and parameters: {'hidden_size': 512, 'activation1': 'tanh', 'activation2': 'tanh', 'dropout': 0.2, 'lr': 0.01, 'weight_decay': 1e-05, 'opt': 'Adam'}. Best is trial 1799 with value: 0.32750146082422843.[0m
[32m[I 2022-12-30 11:33:01,909][0m Trial 1916 finished with value: 0.307747406361561 and parameters: {'hidden_size': 128, 'activation1': 'tanh', 'activation2': 'tanh', 'dropout': 0.05, 'lr': 0.003, 'weight_decay': 1e-05, 'opt': 'Adam'}. Best is trial 1799 with value: 0.32750146082422843.[0m
[32m[I 2022-12-30 11:33:11,756][0m Trial 1917 finished with value: 0.32484978688558375 and parameters: {'hidden_size': 512, 'activation1': 'tanh', 'activation2': 'tanh', 'dropout': 0.05, 'lr': 0.01, 'weight_decay': 1e-05, 'opt': 'Adam'}. Best is trial 1799 with value: 0.32750146082422843.[0m
[32m[I 2022-12-30 11:33:21,752][0m Trial 1918 finished with value: 0.3242815055172142 and parameters: {'hidden_size': 512, 'activation1': 'tanh', 'activation2': 'tanh', 'dropout': 0.05, 'lr': 0.01, 'weight_decay': 1e-05, 'opt': 'Adam'}. Best is trial 1799 with value: 0.32750146082422843.[0m
[32m[I 2022-12-30 11:33:31,556][0m Trial 1919 finished with value: 0.3219070540953696 and parameters: {'hidden_size': 512, 'activation1': 'tanh', 'activation2': 'tanh', 'dropout': 0.05, 'lr': 0.01, 'weight_decay': 1e-05, 'opt': 'Adam'}. Best is trial 1799 with value: 0.32750146082422843.[0m
[32m[I 2022-12-30 11:33:41,877][0m Trial 1920 finished with value: 0.28445569995452563 and parameters: {'hidden_size': 512, 'activation1': 'sigmoid', 'activation2': 'tanh', 'dropout': 0.05, 'lr': 0.01, 'weight_decay': 1e-05, 'opt': 'Adam'}. Best is trial 1799 with value: 0.32750146082422843.[0m
[32m[I 2022-12-30 11:33:51,887][0m Trial 1921 finished with value: 0.3226448160786627 and parameters: {'hidden_size': 512, 'activation1': 'tanh', 'activation2': 'tanh', 'dropout': 0.05, 'lr': 0.01, 'weight_decay': 1e-05, 'opt': 'Adam'}. Best is trial 1799 with value: 0.32750146082422843.[0m
[32m[I 2022-12-30 11:33:59,745][0m Trial 1922 finished with value: 0.3038237126080598 and parameters: {'hidden_size': 512, 'activation1': 'tanh', 'activation2': 'relu', 'dropout': 0.05, 'lr': 0.01, 'weight_decay': 1e-05, 'opt': 'SGD'}. Best is trial 1799 with value: 0.32750146082422843.[0m
[32m[I 2022-12-30 11:34:09,758][0m Trial 1923 finished with value: 0.31050403939719834 and parameters: {'hidden_size': 256, 'activation1': 'tanh', 'activation2': 'tanh', 'dropout': 0.05, 'lr': 0.01, 'weight_decay': 1e-05, 'opt': 'Adam'}. Best is trial 1799 with value: 0.32750146082422843.[0m
[32m[I 2022-12-30 11:34:19,712][0m Trial 1924 finished with value: 0.32476086380383595 and parameters: {'hidden_size': 512, 'activation1': 'tanh', 'activation2': 'tanh', 'dropout': 0.05, 'lr': 0.01, 'weight_decay': 1e-05, 'opt': 'Adam'}. Best is trial 1799 with value: 0.32750146082422843.[0m
[32m[I 2022-12-30 11:34:29,609][0m Trial 1925 finished with value: 0.3238904219549008 and parameters: {'hidden_size': 512, 'activation1': 'tanh', 'activation2': 'tanh', 'dropout': 0.05, 'lr': 0.01, 'weight_decay': 1e-05, 'opt': 'Adam'}. Best is trial 1799 with value: 0.32750146082422843.[0m
[32m[I 2022-12-30 11:34:39,286][0m Trial 1926 finished with value: 0.32236175312645116 and parameters: {'hidden_size': 512, 'activation1': 'tanh', 'activation2': 'tanh', 'dropout': 0, 'lr': 0.01, 'weight_decay': 1e-05, 'opt': 'Adam'}. Best is trial 1799 with value: 0.32750146082422843.[0m
[32m[I 2022-12-30 11:34:49,047][0m Trial 1927 finished with value: 0.32248907851770325 and parameters: {'hidden_size': 512, 'activation1': 'tanh', 'activation2': 'tanh', 'dropout': 0.05, 'lr': 0.01, 'weight_decay': 1e-05, 'opt': 'Adam'}. Best is trial 1799 with value: 0.32750146082422843.[0m
