[32m[I 2022-12-30 11:34:58,755][0m Trial 1928 finished with value: 0.3155080222726166 and parameters: {'hidden_size': 512, 'activation1': 'tanh', 'activation2': 'tanh', 'dropout': 0.2, 'lr': 0.0003, 'weight_decay': 1e-05, 'opt': 'Adam'}. Best is trial 1799 with value: 0.32750146082422843.[0m
[32m[I 2022-12-30 11:35:08,175][0m Trial 1929 finished with value: 0.32181681676063 and parameters: {'hidden_size': 512, 'activation1': 'tanh', 'activation2': 'tanh', 'dropout': 0.05, 'lr': 0.01, 'weight_decay': 1e-05, 'opt': 'Adam'}. Best is trial 1799 with value: 0.32750146082422843.[0m
[32m[I 2022-12-30 11:35:17,590][0m Trial 1930 finished with value: 0.2636876329726496 and parameters: {'hidden_size': 1024, 'activation1': 'relu', 'activation2': 'tanh', 'dropout': 0.05, 'lr': 0.01, 'weight_decay': 1e-05, 'opt': 'Adam'}. Best is trial 1799 with value: 0.32750146082422843.[0m
[32m[I 2022-12-30 11:35:26,773][0m Trial 1931 finished with value: 0.32291413553554194 and parameters: {'hidden_size': 512, 'activation1': 'tanh', 'activation2': 'tanh', 'dropout': 0.05, 'lr': 0.01, 'weight_decay': 1e-05, 'opt': 'Adam'}. Best is trial 1799 with value: 0.32750146082422843.[0m
[32m[I 2022-12-30 11:35:36,085][0m Trial 1932 finished with value: 0.32273074744857666 and parameters: {'hidden_size': 512, 'activation1': 'tanh', 'activation2': 'tanh', 'dropout': 0.05, 'lr': 0.01, 'weight_decay': 1e-05, 'opt': 'Adam'}. Best is trial 1799 with value: 0.32750146082422843.[0m
[32m[I 2022-12-30 11:35:45,298][0m Trial 1933 finished with value: 0.3243891998086153 and parameters: {'hidden_size': 512, 'activation1': 'tanh', 'activation2': 'tanh', 'dropout': 0.05, 'lr': 0.01, 'weight_decay': 1e-05, 'opt': 'Adam'}. Best is trial 1799 with value: 0.32750146082422843.[0m
[32m[I 2022-12-30 11:35:54,584][0m Trial 1934 finished with value: 0.24153411860431798 and parameters: {'hidden_size': 512, 'activation1': 'tanh', 'activation2': 'sigmoid', 'dropout': 0.05, 'lr': 0.01, 'weight_decay': 1e-05, 'opt': 'Adam'}. Best is trial 1799 with value: 0.32750146082422843.[0m
[32m[I 2022-12-30 11:36:03,834][0m Trial 1935 finished with value: 0.3212438493843782 and parameters: {'hidden_size': 512, 'activation1': 'tanh', 'activation2': 'tanh', 'dropout': 0.05, 'lr': 0.01, 'weight_decay': 1e-05, 'opt': 'Adam'}. Best is trial 1799 with value: 0.32750146082422843.[0m
[32m[I 2022-12-30 11:36:13,105][0m Trial 1936 finished with value: 0.32496767831789075 and parameters: {'hidden_size': 512, 'activation1': 'tanh', 'activation2': 'tanh', 'dropout': 0.05, 'lr': 0.01, 'weight_decay': 1e-05, 'opt': 'Adam'}. Best is trial 1799 with value: 0.32750146082422843.[0m
[32m[I 2022-12-30 11:36:22,444][0m Trial 1937 finished with value: 0.3246827820625443 and parameters: {'hidden_size': 512, 'activation1': 'tanh', 'activation2': 'tanh', 'dropout': 0.05, 'lr': 0.01, 'weight_decay': 1e-05, 'opt': 'Adam'}. Best is trial 1799 with value: 0.32750146082422843.[0m
[32m[I 2022-12-30 11:36:31,770][0m Trial 1938 finished with value: 0.32540698288653325 and parameters: {'hidden_size': 512, 'activation1': 'tanh', 'activation2': 'tanh', 'dropout': 0.05, 'lr': 0.01, 'weight_decay': 1e-05, 'opt': 'Adam'}. Best is trial 1799 with value: 0.32750146082422843.[0m
[32m[I 2022-12-30 11:36:41,315][0m Trial 1939 finished with value: 0.31876038562729675 and parameters: {'hidden_size': 512, 'activation1': 'tanh', 'activation2': 'tanh', 'dropout': 0.05, 'lr': 0.003, 'weight_decay': 1e-05, 'opt': 'Adam'}. Best is trial 1799 with value: 0.32750146082422843.[0m
[32m[I 2022-12-30 11:36:50,529][0m Trial 1940 finished with value: 0.30562477270230193 and parameters: {'hidden_size': 128, 'activation1': 'tanh', 'activation2': 'tanh', 'dropout': 0.05, 'lr': 0.01, 'weight_decay': 1e-05, 'opt': 'Adam'}. Best is trial 1799 with value: 0.32750146082422843.[0m
[32m[I 2022-12-30 11:37:00,103][0m Trial 1941 finished with value: 0.26737067561559463 and parameters: {'hidden_size': 512, 'activation1': 'sigmoid', 'activation2': 'tanh', 'dropout': 0.05, 'lr': 0.01, 'weight_decay': 1e-05, 'opt': 'Adam'}. Best is trial 1799 with value: 0.32750146082422843.[0m
[32m[I 2022-12-30 11:37:07,118][0m Trial 1942 finished with value: 0.05913642817749589 and parameters: {'hidden_size': 512, 'activation1': 'tanh', 'activation2': 'tanh', 'dropout': 0.05, 'lr': 0.01, 'weight_decay': 1e-05, 'opt': 'SGD'}. Best is trial 1799 with value: 0.32750146082422843.[0m
[32m[I 2022-12-30 11:37:16,559][0m Trial 1943 finished with value: 0.32601110926359433 and parameters: {'hidden_size': 512, 'activation1': 'tanh', 'activation2': 'tanh', 'dropout': 0.05, 'lr': 0.01, 'weight_decay': 1e-05, 'opt': 'Adam'}. Best is trial 1799 with value: 0.32750146082422843.[0m
[32m[I 2022-12-30 11:37:25,988][0m Trial 1944 finished with value: 0.24244189447785694 and parameters: {'hidden_size': 256, 'activation1': 'tanh', 'activation2': 'relu', 'dropout': 0.05, 'lr': 0.01, 'weight_decay': 1e-05, 'opt': 'Adam'}. Best is trial 1799 with value: 0.32750146082422843.[0m
[32m[I 2022-12-30 11:37:35,377][0m Trial 1945 finished with value: 0.3200953174995769 and parameters: {'hidden_size': 512, 'activation1': 'tanh', 'activation2': 'tanh', 'dropout': 0.2, 'lr': 0.01, 'weight_decay': 1e-05, 'opt': 'Adam'}. Best is trial 1799 with value: 0.32750146082422843.[0m
[32m[I 2022-12-30 11:37:44,354][0m Trial 1946 finished with value: 0.3204967399381248 and parameters: {'hidden_size': 512, 'activation1': 'tanh', 'activation2': 'tanh', 'dropout': 0, 'lr': 0.01, 'weight_decay': 1e-05, 'opt': 'Adam'}. Best is trial 1799 with value: 0.32750146082422843.[0m
[32m[I 2022-12-30 11:37:53,704][0m Trial 1947 finished with value: 0.3210881556185002 and parameters: {'hidden_size': 512, 'activation1': 'tanh', 'activation2': 'tanh', 'dropout': 0.05, 'lr': 0.01, 'weight_decay': 1e-05, 'opt': 'Adam'}. Best is trial 1799 with value: 0.32750146082422843.[0m
[32m[I 2022-12-30 11:38:03,239][0m Trial 1948 finished with value: 0.3205227596798886 and parameters: {'hidden_size': 512, 'activation1': 'tanh', 'activation2': 'tanh', 'dropout': 0.05, 'lr': 0.01, 'weight_decay': 1e-05, 'opt': 'Adam'}. Best is trial 1799 with value: 0.32750146082422843.[0m
[32m[I 2022-12-30 11:38:12,459][0m Trial 1949 finished with value: 0.3239079462072275 and parameters: {'hidden_size': 512, 'activation1': 'tanh', 'activation2': 'tanh', 'dropout': 0.05, 'lr': 0.01, 'weight_decay': 1e-05, 'opt': 'Adam'}. Best is trial 1799 with value: 0.32750146082422843.[0m
[32m[I 2022-12-30 11:38:21,856][0m Trial 1950 finished with value: 0.32469475154834104 and parameters: {'hidden_size': 512, 'activation1': 'tanh', 'activation2': 'tanh', 'dropout': 0.05, 'lr': 0.01, 'weight_decay': 1e-05, 'opt': 'Adam'}. Best is trial 1799 with value: 0.32750146082422843.[0m
[32m[I 2022-12-30 11:38:31,296][0m Trial 1951 finished with value: 0.3255189082193034 and parameters: {'hidden_size': 512, 'activation1': 'tanh', 'activation2': 'tanh', 'dropout': 0.05, 'lr': 0.01, 'weight_decay': 1e-05, 'opt': 'Adam'}. Best is trial 1799 with value: 0.32750146082422843.[0m
[32m[I 2022-12-30 11:38:41,057][0m Trial 1952 finished with value: 0.316969259312526 and parameters: {'hidden_size': 512, 'activation1': 'tanh', 'activation2': 'tanh', 'dropout': 0.05, 'lr': 0.0003, 'weight_decay': 1e-05, 'opt': 'Adam'}. Best is trial 1799 with value: 0.32750146082422843.[0m
[32m[I 2022-12-30 11:38:50,565][0m Trial 1953 finished with value: 0.2985879098711806 and parameters: {'hidden_size': 512, 'activation1': 'relu', 'activation2': 'tanh', 'dropout': 0.05, 'lr': 0.01, 'weight_decay': 1e-05, 'opt': 'Adam'}. Best is trial 1799 with value: 0.32750146082422843.[0m
[32m[I 2022-12-30 11:39:00,025][0m Trial 1954 finished with value: 0.3254596995299223 and parameters: {'hidden_size': 512, 'activation1': 'tanh', 'activation2': 'tanh', 'dropout': 0.05, 'lr': 0.01, 'weight_decay': 1e-05, 'opt': 'Adam'}. Best is trial 1799 with value: 0.32750146082422843.[0m
[32m[I 2022-12-30 11:39:09,530][0m Trial 1955 finished with value: 0.3243034190306305 and parameters: {'hidden_size': 512, 'activation1': 'tanh', 'activation2': 'tanh', 'dropout': 0.05, 'lr': 0.01, 'weight_decay': 1e-05, 'opt': 'Adam'}. Best is trial 1799 with value: 0.32750146082422843.[0m
[32m[I 2022-12-30 11:39:19,101][0m Trial 1956 finished with value: 0.261807145546102 and parameters: {'hidden_size': 1024, 'activation1': 'tanh', 'activation2': 'sigmoid', 'dropout': 0.05, 'lr': 0.01, 'weight_decay': 1e-05, 'opt': 'Adam'}. Best is trial 1799 with value: 0.32750146082422843.[0m
[32m[I 2022-12-30 11:39:28,495][0m Trial 1957 finished with value: 0.3219117587230893 and parameters: {'hidden_size': 512, 'activation1': 'tanh', 'activation2': 'tanh', 'dropout': 0.05, 'lr': 0.01, 'weight_decay': 1e-05, 'opt': 'Adam'}. Best is trial 1799 with value: 0.32750146082422843.[0m
[32m[I 2022-12-30 11:39:37,975][0m Trial 1958 finished with value: 0.3196984172338344 and parameters: {'hidden_size': 512, 'activation1': 'tanh', 'activation2': 'tanh', 'dropout': 0.05, 'lr': 0.01, 'weight_decay': 1e-05, 'opt': 'Adam'}. Best is trial 1799 with value: 0.32750146082422843.[0m
[32m[I 2022-12-30 11:39:47,506][0m Trial 1959 finished with value: 0.3249973583578768 and parameters: {'hidden_size': 512, 'activation1': 'tanh', 'activation2': 'tanh', 'dropout': 0.05, 'lr': 0.01, 'weight_decay': 1e-05, 'opt': 'Adam'}. Best is trial 1799 with value: 0.32750146082422843.[0m
[32m[I 2022-12-30 11:39:57,045][0m Trial 1960 finished with value: 0.3240251757897714 and parameters: {'hidden_size': 512, 'activation1': 'tanh', 'activation2': 'tanh', 'dropout': 0.05, 'lr': 0.01, 'weight_decay': 1e-05, 'opt': 'Adam'}. Best is trial 1799 with value: 0.32750146082422843.[0m
[32m[I 2022-12-30 11:40:06,526][0m Trial 1961 finished with value: 0.32301991502757976 and parameters: {'hidden_size': 512, 'activation1': 'tanh', 'activation2': 'tanh', 'dropout': 0.05, 'lr': 0.01, 'weight_decay': 1e-05, 'opt': 'Adam'}. Best is trial 1799 with value: 0.32750146082422843.[0m
[32m[I 2022-12-30 11:40:15,574][0m Trial 1962 finished with value: 0.32719990869622667 and parameters: {'hidden_size': 512, 'activation1': 'tanh', 'activation2': 'tanh', 'dropout': 0, 'lr': 0.01, 'weight_decay': 1e-05, 'opt': 'Adam'}. Best is trial 1799 with value: 0.32750146082422843.[0m
[32m[I 2022-12-30 11:40:24,686][0m Trial 1963 finished with value: 0.3147295280648359 and parameters: {'hidden_size': 512, 'activation1': 'tanh', 'activation2': 'tanh', 'dropout': 0, 'lr': 0.003, 'weight_decay': 1e-05, 'opt': 'Adam'}. Best is trial 1799 with value: 0.32750146082422843.[0m
[32m[I 2022-12-30 11:40:31,426][0m Trial 1964 finished with value: 0.0 and parameters: {'hidden_size': 512, 'activation1': 'sigmoid', 'activation2': 'tanh', 'dropout': 0, 'lr': 0.01, 'weight_decay': 1e-05, 'opt': 'SGD'}. Best is trial 1799 with value: 0.32750146082422843.[0m
[32m[I 2022-12-30 11:40:40,370][0m Trial 1965 finished with value: 0.3018112828678487 and parameters: {'hidden_size': 128, 'activation1': 'tanh', 'activation2': 'tanh', 'dropout': 0, 'lr': 0.01, 'weight_decay': 1e-05, 'opt': 'Adam'}. Best is trial 1799 with value: 0.32750146082422843.[0m
[32m[I 2022-12-30 11:40:49,389][0m Trial 1966 finished with value: 0.32446010346698606 and parameters: {'hidden_size': 512, 'activation1': 'tanh', 'activation2': 'tanh', 'dropout': 0, 'lr': 0.01, 'weight_decay': 1e-05, 'opt': 'Adam'}. Best is trial 1799 with value: 0.32750146082422843.[0m
[32m[I 2022-12-30 11:40:58,374][0m Trial 1967 finished with value: 0.32394903068007636 and parameters: {'hidden_size': 512, 'activation1': 'tanh', 'activation2': 'tanh', 'dropout': 0, 'lr': 0.01, 'weight_decay': 1e-05, 'opt': 'Adam'}. Best is trial 1799 with value: 0.32750146082422843.[0m
[32m[I 2022-12-30 11:41:07,512][0m Trial 1968 finished with value: 0.23917726375029877 and parameters: {'hidden_size': 256, 'activation1': 'tanh', 'activation2': 'relu', 'dropout': 0, 'lr': 0.01, 'weight_decay': 1e-05, 'opt': 'Adam'}. Best is trial 1799 with value: 0.32750146082422843.[0m
[32m[I 2022-12-30 11:41:16,520][0m Trial 1969 finished with value: 0.3240659100160813 and parameters: {'hidden_size': 512, 'activation1': 'tanh', 'activation2': 'tanh', 'dropout': 0, 'lr': 0.01, 'weight_decay': 1e-05, 'opt': 'Adam'}. Best is trial 1799 with value: 0.32750146082422843.[0m
[32m[I 2022-12-30 11:41:25,532][0m Trial 1970 finished with value: 0.3251415308793503 and parameters: {'hidden_size': 512, 'activation1': 'tanh', 'activation2': 'tanh', 'dropout': 0, 'lr': 0.01, 'weight_decay': 1e-05, 'opt': 'Adam'}. Best is trial 1799 with value: 0.32750146082422843.[0m
[32m[I 2022-12-30 11:41:34,586][0m Trial 1971 finished with value: 0.32349938600936834 and parameters: {'hidden_size': 512, 'activation1': 'tanh', 'activation2': 'tanh', 'dropout': 0, 'lr': 0.01, 'weight_decay': 1e-05, 'opt': 'Adam'}. Best is trial 1799 with value: 0.32750146082422843.[0m
[32m[I 2022-12-30 11:41:43,724][0m Trial 1972 finished with value: 0.32467307617709895 and parameters: {'hidden_size': 512, 'activation1': 'tanh', 'activation2': 'tanh', 'dropout': 0, 'lr': 0.01, 'weight_decay': 1e-05, 'opt': 'Adam'}. Best is trial 1799 with value: 0.32750146082422843.[0m
[32m[I 2022-12-30 11:41:52,784][0m Trial 1973 finished with value: 0.32481210508893554 and parameters: {'hidden_size': 512, 'activation1': 'tanh', 'activation2': 'tanh', 'dropout': 0, 'lr': 0.01, 'weight_decay': 1e-05, 'opt': 'Adam'}. Best is trial 1799 with value: 0.32750146082422843.[0m
[32m[I 2022-12-30 11:42:01,799][0m Trial 1974 finished with value: 0.3230304510501712 and parameters: {'hidden_size': 512, 'activation1': 'tanh', 'activation2': 'tanh', 'dropout': 0, 'lr': 0.01, 'weight_decay': 1e-05, 'opt': 'Adam'}. Best is trial 1799 with value: 0.32750146082422843.[0m
[32m[I 2022-12-30 11:42:11,721][0m Trial 1975 finished with value: 0.3105433134042248 and parameters: {'hidden_size': 512, 'activation1': 'relu', 'activation2': 'tanh', 'dropout': 0.05, 'lr': 0.0003, 'weight_decay': 1e-05, 'opt': 'Adam'}. Best is trial 1799 with value: 0.32750146082422843.[0m
[32m[I 2022-12-30 11:42:21,054][0m Trial 1976 finished with value: 0.32344068191471476 and parameters: {'hidden_size': 512, 'activation1': 'tanh', 'activation2': 'tanh', 'dropout': 0.2, 'lr': 0.01, 'weight_decay': 1e-05, 'opt': 'Adam'}. Best is trial 1799 with value: 0.32750146082422843.[0m
[32m[I 2022-12-30 11:42:30,138][0m Trial 1977 finished with value: 0.32326330090048816 and parameters: {'hidden_size': 512, 'activation1': 'tanh', 'activation2': 'tanh', 'dropout': 0, 'lr': 0.01, 'weight_decay': 1e-05, 'opt': 'Adam'}. Best is trial 1799 with value: 0.32750146082422843.[0m
[32m[I 2022-12-30 11:42:39,261][0m Trial 1978 finished with value: 0.31270311563813596 and parameters: {'hidden_size': 1024, 'activation1': 'tanh', 'activation2': 'tanh', 'dropout': 0, 'lr': 0.01, 'weight_decay': 1e-05, 'opt': 'Adam'}. Best is trial 1799 with value: 0.32750146082422843.[0m
[32m[I 2022-12-30 11:42:48,418][0m Trial 1979 finished with value: 0.32399263587945637 and parameters: {'hidden_size': 512, 'activation1': 'tanh', 'activation2': 'tanh', 'dropout': 0, 'lr': 0.01, 'weight_decay': 1e-05, 'opt': 'Adam'}. Best is trial 1799 with value: 0.32750146082422843.[0m
[32m[I 2022-12-30 11:42:57,627][0m Trial 1980 finished with value: 0.24472813799601617 and parameters: {'hidden_size': 512, 'activation1': 'tanh', 'activation2': 'sigmoid', 'dropout': 0, 'lr': 0.01, 'weight_decay': 1e-05, 'opt': 'Adam'}. Best is trial 1799 with value: 0.32750146082422843.[0m
[32m[I 2022-12-30 11:43:06,709][0m Trial 1981 finished with value: 0.32623897876053115 and parameters: {'hidden_size': 512, 'activation1': 'tanh', 'activation2': 'tanh', 'dropout': 0, 'lr': 0.01, 'weight_decay': 1e-05, 'opt': 'Adam'}. Best is trial 1799 with value: 0.32750146082422843.[0m
[32m[I 2022-12-30 11:43:15,851][0m Trial 1982 finished with value: 0.32640138656058426 and parameters: {'hidden_size': 512, 'activation1': 'tanh', 'activation2': 'tanh', 'dropout': 0, 'lr': 0.01, 'weight_decay': 1e-05, 'opt': 'Adam'}. Best is trial 1799 with value: 0.32750146082422843.[0m
[32m[I 2022-12-30 11:43:24,874][0m Trial 1983 finished with value: 0.32371135884153646 and parameters: {'hidden_size': 512, 'activation1': 'tanh', 'activation2': 'tanh', 'dropout': 0, 'lr': 0.01, 'weight_decay': 1e-05, 'opt': 'Adam'}. Best is trial 1799 with value: 0.32750146082422843.[0m
[32m[I 2022-12-30 11:43:31,650][0m Trial 1984 finished with value: 0.03574137118748788 and parameters: {'hidden_size': 512, 'activation1': 'tanh', 'activation2': 'tanh', 'dropout': 0, 'lr': 0.01, 'weight_decay': 1e-05, 'opt': 'SGD'}. Best is trial 1799 with value: 0.32750146082422843.[0m
[32m[I 2022-12-30 11:43:40,832][0m Trial 1985 finished with value: 0.3240963590371015 and parameters: {'hidden_size': 512, 'activation1': 'tanh', 'activation2': 'tanh', 'dropout': 0, 'lr': 0.01, 'weight_decay': 1e-05, 'opt': 'Adam'}. Best is trial 1799 with value: 0.32750146082422843.[0m
[32m[I 2022-12-30 11:43:50,392][0m Trial 1986 finished with value: 0.2639259219962266 and parameters: {'hidden_size': 512, 'activation1': 'sigmoid', 'activation2': 'tanh', 'dropout': 0, 'lr': 0.01, 'weight_decay': 1e-05, 'opt': 'Adam'}. Best is trial 1799 with value: 0.32750146082422843.[0m
[32m[I 2022-12-30 11:43:59,641][0m Trial 1987 finished with value: 0.3176943633779426 and parameters: {'hidden_size': 512, 'activation1': 'tanh', 'activation2': 'tanh', 'dropout': 0, 'lr': 0.003, 'weight_decay': 1e-05, 'opt': 'Adam'}. Best is trial 1799 with value: 0.32750146082422843.[0m
[32m[I 2022-12-30 11:44:08,733][0m Trial 1988 finished with value: 0.3244905162461925 and parameters: {'hidden_size': 512, 'activation1': 'tanh', 'activation2': 'tanh', 'dropout': 0, 'lr': 0.01, 'weight_decay': 1e-05, 'opt': 'Adam'}. Best is trial 1799 with value: 0.32750146082422843.[0m
[32m[I 2022-12-30 11:44:17,732][0m Trial 1989 finished with value: 0.32477006997148 and parameters: {'hidden_size': 512, 'activation1': 'tanh', 'activation2': 'tanh', 'dropout': 0, 'lr': 0.01, 'weight_decay': 1e-05, 'opt': 'Adam'}. Best is trial 1799 with value: 0.32750146082422843.[0m
[32m[I 2022-12-30 11:44:26,850][0m Trial 1990 finished with value: 0.24113617062960718 and parameters: {'hidden_size': 512, 'activation1': 'tanh', 'activation2': 'relu', 'dropout': 0, 'lr': 0.01, 'weight_decay': 1e-05, 'opt': 'Adam'}. Best is trial 1799 with value: 0.32750146082422843.[0m
[32m[I 2022-12-30 11:44:35,931][0m Trial 1991 finished with value: 0.32381571386825375 and parameters: {'hidden_size': 512, 'activation1': 'tanh', 'activation2': 'tanh', 'dropout': 0, 'lr': 0.01, 'weight_decay': 1e-05, 'opt': 'Adam'}. Best is trial 1799 with value: 0.32750146082422843.[0m
[32m[I 2022-12-30 11:44:45,082][0m Trial 1992 finished with value: 0.30402115167232574 and parameters: {'hidden_size': 128, 'activation1': 'tanh', 'activation2': 'tanh', 'dropout': 0, 'lr': 0.01, 'weight_decay': 1e-05, 'opt': 'Adam'}. Best is trial 1799 with value: 0.32750146082422843.[0m
[32m[I 2022-12-30 11:44:54,279][0m Trial 1993 finished with value: 0.3117986006147837 and parameters: {'hidden_size': 256, 'activation1': 'tanh', 'activation2': 'tanh', 'dropout': 0, 'lr': 0.01, 'weight_decay': 1e-05, 'opt': 'Adam'}. Best is trial 1799 with value: 0.32750146082422843.[0m
[32m[I 2022-12-30 11:45:03,673][0m Trial 1994 finished with value: 0.3226038571877612 and parameters: {'hidden_size': 512, 'activation1': 'tanh', 'activation2': 'tanh', 'dropout': 0, 'lr': 0.01, 'weight_decay': 1e-05, 'opt': 'Adam'}. Best is trial 1799 with value: 0.32750146082422843.[0m
[32m[I 2022-12-30 11:45:13,015][0m Trial 1995 finished with value: 0.32448216036923794 and parameters: {'hidden_size': 512, 'activation1': 'tanh', 'activation2': 'tanh', 'dropout': 0, 'lr': 0.01, 'weight_decay': 1e-05, 'opt': 'Adam'}. Best is trial 1799 with value: 0.32750146082422843.[0m
[32m[I 2022-12-30 11:45:22,402][0m Trial 1996 finished with value: 0.32373109010786216 and parameters: {'hidden_size': 512, 'activation1': 'tanh', 'activation2': 'tanh', 'dropout': 0, 'lr': 0.01, 'weight_decay': 1e-05, 'opt': 'Adam'}. Best is trial 1799 with value: 0.32750146082422843.[0m
[32m[I 2022-12-30 11:45:31,926][0m Trial 1997 finished with value: 0.2900119153481497 and parameters: {'hidden_size': 512, 'activation1': 'relu', 'activation2': 'tanh', 'dropout': 0, 'lr': 0.01, 'weight_decay': 1e-05, 'opt': 'Adam'}. Best is trial 1799 with value: 0.32750146082422843.[0m
[32m[I 2022-12-30 11:45:41,324][0m Trial 1998 finished with value: 0.3228951203730664 and parameters: {'hidden_size': 512, 'activation1': 'tanh', 'activation2': 'tanh', 'dropout': 0, 'lr': 0.01, 'weight_decay': 1e-05, 'opt': 'Adam'}. Best is trial 1799 with value: 0.32750146082422843.[0m
[32m[I 2022-12-30 11:45:50,713][0m Trial 1999 finished with value: 0.3219027044150278 and parameters: {'hidden_size': 512, 'activation1': 'tanh', 'activation2': 'tanh', 'dropout': 0, 'lr': 0.01, 'weight_decay': 1e-05, 'opt': 'Adam'}. Best is trial 1799 with value: 0.32750146082422843.[0m
{'hidden_size': 512, 'activation1': 'tanh', 'activation2': 'tanh', 'dropout': 0.05, 'lr': 0.01, 'weight_decay': 1e-05, 'opt': 'Adam'}
