[32m[I 2022-12-30 07:19:21,626][0m Trial 369 finished with value: 0.32173943422909296 and parameters: {'hidden_size': 512, 'activation1': 'tanh', 'activation2': 'tanh', 'dropout': 0, 'lr': 0.001, 'weight_decay': 3e-05, 'opt': 'RMSprop'}. Best is trial 323 with value: 0.32512486453416034.[0m
[32m[I 2022-12-30 07:19:29,586][0m Trial 370 finished with value: 0.32302688341329866 and parameters: {'hidden_size': 512, 'activation1': 'tanh', 'activation2': 'tanh', 'dropout': 0, 'lr': 0.001, 'weight_decay': 3e-05, 'opt': 'RMSprop'}. Best is trial 323 with value: 0.32512486453416034.[0m
[32m[I 2022-12-30 07:19:37,710][0m Trial 371 finished with value: 0.255890389597793 and parameters: {'hidden_size': 512, 'activation1': 'tanh', 'activation2': 'sigmoid', 'dropout': 0, 'lr': 0.001, 'weight_decay': 3e-05, 'opt': 'RMSprop'}. Best is trial 323 with value: 0.32512486453416034.[0m
[32m[I 2022-12-30 07:19:45,685][0m Trial 372 finished with value: 0.3222768644052529 and parameters: {'hidden_size': 512, 'activation1': 'tanh', 'activation2': 'tanh', 'dropout': 0, 'lr': 0.001, 'weight_decay': 3e-05, 'opt': 'RMSprop'}. Best is trial 323 with value: 0.32512486453416034.[0m
[32m[I 2022-12-30 07:19:53,679][0m Trial 373 finished with value: 0.32303271265176325 and parameters: {'hidden_size': 512, 'activation1': 'tanh', 'activation2': 'tanh', 'dropout': 0, 'lr': 0.001, 'weight_decay': 3e-05, 'opt': 'RMSprop'}. Best is trial 323 with value: 0.32512486453416034.[0m
[32m[I 2022-12-30 07:20:01,749][0m Trial 374 finished with value: 0.3107075682920809 and parameters: {'hidden_size': 128, 'activation1': 'tanh', 'activation2': 'tanh', 'dropout': 0, 'lr': 0.001, 'weight_decay': 3e-05, 'opt': 'RMSprop'}. Best is trial 323 with value: 0.32512486453416034.[0m
[32m[I 2022-12-30 07:20:09,740][0m Trial 375 finished with value: 0.3233809871866782 and parameters: {'hidden_size': 512, 'activation1': 'tanh', 'activation2': 'tanh', 'dropout': 0, 'lr': 0.001, 'weight_decay': 3e-05, 'opt': 'RMSprop'}. Best is trial 323 with value: 0.32512486453416034.[0m
[32m[I 2022-12-30 07:20:17,796][0m Trial 376 finished with value: 0.31944703985231193 and parameters: {'hidden_size': 256, 'activation1': 'tanh', 'activation2': 'tanh', 'dropout': 0, 'lr': 0.001, 'weight_decay': 3e-05, 'opt': 'RMSprop'}. Best is trial 323 with value: 0.32512486453416034.[0m
[32m[I 2022-12-30 07:20:25,792][0m Trial 377 finished with value: 0.3234131037574727 and parameters: {'hidden_size': 512, 'activation1': 'tanh', 'activation2': 'tanh', 'dropout': 0, 'lr': 0.001, 'weight_decay': 3e-05, 'opt': 'RMSprop'}. Best is trial 323 with value: 0.32512486453416034.[0m
[32m[I 2022-12-30 07:20:33,895][0m Trial 378 finished with value: 0.3233576892364914 and parameters: {'hidden_size': 512, 'activation1': 'tanh', 'activation2': 'tanh', 'dropout': 0, 'lr': 0.001, 'weight_decay': 3e-05, 'opt': 'RMSprop'}. Best is trial 323 with value: 0.32512486453416034.[0m
[32m[I 2022-12-30 07:20:41,936][0m Trial 379 finished with value: 0.3229748153320805 and parameters: {'hidden_size': 512, 'activation1': 'tanh', 'activation2': 'tanh', 'dropout': 0, 'lr': 0.001, 'weight_decay': 3e-05, 'opt': 'RMSprop'}. Best is trial 323 with value: 0.32512486453416034.[0m
[32m[I 2022-12-30 07:20:50,086][0m Trial 380 finished with value: 0.26142455190051433 and parameters: {'hidden_size': 512, 'activation1': 'sigmoid', 'activation2': 'tanh', 'dropout': 0, 'lr': 0.01, 'weight_decay': 3e-05, 'opt': 'RMSprop'}. Best is trial 323 with value: 0.32512486453416034.[0m
[32m[I 2022-12-30 07:20:58,110][0m Trial 381 finished with value: 0.32326513210231256 and parameters: {'hidden_size': 512, 'activation1': 'tanh', 'activation2': 'tanh', 'dropout': 0, 'lr': 0.001, 'weight_decay': 3e-05, 'opt': 'RMSprop'}. Best is trial 323 with value: 0.32512486453416034.[0m
[32m[I 2022-12-30 07:21:06,153][0m Trial 382 finished with value: 0.32180366286308565 and parameters: {'hidden_size': 512, 'activation1': 'tanh', 'activation2': 'tanh', 'dropout': 0, 'lr': 0.001, 'weight_decay': 3e-05, 'opt': 'RMSprop'}. Best is trial 323 with value: 0.32512486453416034.[0m
[32m[I 2022-12-30 07:21:14,145][0m Trial 383 finished with value: 0.3228101225455828 and parameters: {'hidden_size': 512, 'activation1': 'tanh', 'activation2': 'tanh', 'dropout': 0, 'lr': 0.001, 'weight_decay': 3e-05, 'opt': 'RMSprop'}. Best is trial 323 with value: 0.32512486453416034.[0m
[32m[I 2022-12-30 07:21:22,231][0m Trial 384 finished with value: 0.2555359216183156 and parameters: {'hidden_size': 512, 'activation1': 'tanh', 'activation2': 'relu', 'dropout': 0, 'lr': 0.001, 'weight_decay': 3e-05, 'opt': 'RMSprop'}. Best is trial 323 with value: 0.32512486453416034.[0m
[32m[I 2022-12-30 07:21:30,258][0m Trial 385 finished with value: 0.3212703291657199 and parameters: {'hidden_size': 512, 'activation1': 'tanh', 'activation2': 'tanh', 'dropout': 0, 'lr': 0.001, 'weight_decay': 1e-05, 'opt': 'RMSprop'}. Best is trial 323 with value: 0.32512486453416034.[0m
[32m[I 2022-12-30 07:21:38,298][0m Trial 386 finished with value: 0.32271074269446354 and parameters: {'hidden_size': 512, 'activation1': 'tanh', 'activation2': 'tanh', 'dropout': 0, 'lr': 0.001, 'weight_decay': 3e-05, 'opt': 'RMSprop'}. Best is trial 323 with value: 0.32512486453416034.[0m
[32m[I 2022-12-30 07:21:46,255][0m Trial 387 finished with value: 0.30644872619045516 and parameters: {'hidden_size': 512, 'activation1': 'tanh', 'activation2': 'tanh', 'dropout': 0, 'lr': 0.003, 'weight_decay': 3e-05, 'opt': 'RMSprop'}. Best is trial 323 with value: 0.32512486453416034.[0m
[32m[I 2022-12-30 07:21:54,197][0m Trial 388 finished with value: 0.3215288915522711 and parameters: {'hidden_size': 512, 'activation1': 'tanh', 'activation2': 'tanh', 'dropout': 0, 'lr': 0.001, 'weight_decay': 3e-05, 'opt': 'RMSprop'}. Best is trial 323 with value: 0.32512486453416034.[0m
[32m[I 2022-12-30 07:22:03,361][0m Trial 389 finished with value: 0.3148488260756558 and parameters: {'hidden_size': 512, 'activation1': 'tanh', 'activation2': 'tanh', 'dropout': 0, 'lr': 0.001, 'weight_decay': 3e-05, 'opt': 'Adam'}. Best is trial 323 with value: 0.32512486453416034.[0m
[32m[I 2022-12-30 07:22:11,395][0m Trial 390 finished with value: 0.32319810509121505 and parameters: {'hidden_size': 512, 'activation1': 'tanh', 'activation2': 'tanh', 'dropout': 0, 'lr': 0.001, 'weight_decay': 3e-05, 'opt': 'RMSprop'}. Best is trial 323 with value: 0.32512486453416034.[0m
[32m[I 2022-12-30 07:22:18,688][0m Trial 391 finished with value: 0.30359647545964413 and parameters: {'hidden_size': 512, 'activation1': 'relu', 'activation2': 'tanh', 'dropout': 0, 'lr': 0.001, 'weight_decay': 3e-05, 'opt': 'SGD'}. Best is trial 323 with value: 0.32512486453416034.[0m
[32m[I 2022-12-30 07:22:26,675][0m Trial 392 finished with value: 0.32158859975790766 and parameters: {'hidden_size': 512, 'activation1': 'tanh', 'activation2': 'tanh', 'dropout': 0, 'lr': 0.001, 'weight_decay': 3e-05, 'opt': 'RMSprop'}. Best is trial 323 with value: 0.32512486453416034.[0m
[32m[I 2022-12-30 07:22:34,689][0m Trial 393 finished with value: 0.3237193000897963 and parameters: {'hidden_size': 512, 'activation1': 'tanh', 'activation2': 'tanh', 'dropout': 0, 'lr': 0.001, 'weight_decay': 3e-05, 'opt': 'RMSprop'}. Best is trial 323 with value: 0.32512486453416034.[0m
[32m[I 2022-12-30 07:22:42,748][0m Trial 394 finished with value: 0.2546666721745135 and parameters: {'hidden_size': 512, 'activation1': 'tanh', 'activation2': 'sigmoid', 'dropout': 0, 'lr': 0.001, 'weight_decay': 3e-05, 'opt': 'RMSprop'}. Best is trial 323 with value: 0.32512486453416034.[0m
[32m[I 2022-12-30 07:22:50,713][0m Trial 395 finished with value: 0.32296376284713685 and parameters: {'hidden_size': 512, 'activation1': 'tanh', 'activation2': 'tanh', 'dropout': 0, 'lr': 0.001, 'weight_decay': 3e-05, 'opt': 'RMSprop'}. Best is trial 323 with value: 0.32512486453416034.[0m
[32m[I 2022-12-30 07:22:58,690][0m Trial 396 finished with value: 0.3213674059973835 and parameters: {'hidden_size': 512, 'activation1': 'tanh', 'activation2': 'tanh', 'dropout': 0, 'lr': 0.001, 'weight_decay': 3e-05, 'opt': 'RMSprop'}. Best is trial 323 with value: 0.32512486453416034.[0m
[32m[I 2022-12-30 07:23:06,619][0m Trial 397 finished with value: 0.32212819346965565 and parameters: {'hidden_size': 512, 'activation1': 'tanh', 'activation2': 'tanh', 'dropout': 0, 'lr': 0.001, 'weight_decay': 3e-05, 'opt': 'RMSprop'}. Best is trial 323 with value: 0.32512486453416034.[0m
[32m[I 2022-12-30 07:23:14,621][0m Trial 398 finished with value: 0.30923827920675 and parameters: {'hidden_size': 128, 'activation1': 'tanh', 'activation2': 'tanh', 'dropout': 0, 'lr': 0.001, 'weight_decay': 3e-05, 'opt': 'RMSprop'}. Best is trial 323 with value: 0.32512486453416034.[0m
[32m[I 2022-12-30 07:23:22,570][0m Trial 399 finished with value: 0.3234967077606429 and parameters: {'hidden_size': 512, 'activation1': 'tanh', 'activation2': 'tanh', 'dropout': 0, 'lr': 0.001, 'weight_decay': 3e-05, 'opt': 'RMSprop'}. Best is trial 323 with value: 0.32512486453416034.[0m
[32m[I 2022-12-30 07:23:30,594][0m Trial 400 finished with value: 0.3204532292614914 and parameters: {'hidden_size': 256, 'activation1': 'tanh', 'activation2': 'tanh', 'dropout': 0, 'lr': 0.001, 'weight_decay': 3e-05, 'opt': 'RMSprop'}. Best is trial 323 with value: 0.32512486453416034.[0m
[32m[I 2022-12-30 07:23:38,595][0m Trial 401 finished with value: 0.32194524481755926 and parameters: {'hidden_size': 512, 'activation1': 'tanh', 'activation2': 'tanh', 'dropout': 0, 'lr': 0.001, 'weight_decay': 3e-05, 'opt': 'RMSprop'}. Best is trial 323 with value: 0.32512486453416034.[0m
[32m[I 2022-12-30 07:23:46,834][0m Trial 402 finished with value: 0.3186378589634957 and parameters: {'hidden_size': 512, 'activation1': 'tanh', 'activation2': 'tanh', 'dropout': 0.2, 'lr': 0.001, 'weight_decay': 3e-05, 'opt': 'RMSprop'}. Best is trial 323 with value: 0.32512486453416034.[0m
[32m[I 2022-12-30 07:23:54,959][0m Trial 403 finished with value: 0.30926936475227373 and parameters: {'hidden_size': 512, 'activation1': 'sigmoid', 'activation2': 'tanh', 'dropout': 0, 'lr': 0.001, 'weight_decay': 3e-05, 'opt': 'RMSprop'}. Best is trial 323 with value: 0.32512486453416034.[0m
[32m[I 2022-12-30 07:24:02,953][0m Trial 404 finished with value: 0.28350688237434263 and parameters: {'hidden_size': 512, 'activation1': 'tanh', 'activation2': 'tanh', 'dropout': 0, 'lr': 0.01, 'weight_decay': 3e-05, 'opt': 'RMSprop'}. Best is trial 323 with value: 0.32512486453416034.[0m
[32m[I 2022-12-30 07:24:11,079][0m Trial 405 finished with value: 0.25458973326226814 and parameters: {'hidden_size': 512, 'activation1': 'tanh', 'activation2': 'relu', 'dropout': 0, 'lr': 0.001, 'weight_decay': 3e-05, 'opt': 'RMSprop'}. Best is trial 323 with value: 0.32512486453416034.[0m
[32m[I 2022-12-30 07:24:19,181][0m Trial 406 finished with value: 0.32309474867083976 and parameters: {'hidden_size': 512, 'activation1': 'tanh', 'activation2': 'tanh', 'dropout': 0, 'lr': 0.001, 'weight_decay': 1e-05, 'opt': 'RMSprop'}. Best is trial 323 with value: 0.32512486453416034.[0m
[32m[I 2022-12-30 07:24:27,258][0m Trial 407 finished with value: 0.32201988077646027 and parameters: {'hidden_size': 512, 'activation1': 'tanh', 'activation2': 'tanh', 'dropout': 0, 'lr': 0.001, 'weight_decay': 1e-05, 'opt': 'RMSprop'}. Best is trial 323 with value: 0.32512486453416034.[0m
[32m[I 2022-12-30 07:24:35,285][0m Trial 408 finished with value: 0.3234863387338792 and parameters: {'hidden_size': 512, 'activation1': 'tanh', 'activation2': 'tanh', 'dropout': 0, 'lr': 0.001, 'weight_decay': 1e-05, 'opt': 'RMSprop'}. Best is trial 323 with value: 0.32512486453416034.[0m
[32m[I 2022-12-30 07:24:43,579][0m Trial 409 finished with value: 0.3101890449321303 and parameters: {'hidden_size': 512, 'activation1': 'tanh', 'activation2': 'tanh', 'dropout': 0, 'lr': 0.003, 'weight_decay': 3e-05, 'opt': 'RMSprop'}. Best is trial 323 with value: 0.32512486453416034.[0m
[32m[I 2022-12-30 07:24:51,219][0m Trial 410 finished with value: 0.30404981665860886 and parameters: {'hidden_size': 512, 'activation1': 'tanh', 'activation2': 'tanh', 'dropout': 0, 'lr': 0.001, 'weight_decay': 1e-05, 'opt': 'SGD'}. Best is trial 323 with value: 0.32512486453416034.[0m
[32m[I 2022-12-30 07:24:59,198][0m Trial 411 finished with value: 0.32220840734564493 and parameters: {'hidden_size': 512, 'activation1': 'tanh', 'activation2': 'tanh', 'dropout': 0, 'lr': 0.001, 'weight_decay': 1e-05, 'opt': 'RMSprop'}. Best is trial 323 with value: 0.32512486453416034.[0m
[32m[I 2022-12-30 07:25:07,159][0m Trial 412 finished with value: 0.3232079348505786 and parameters: {'hidden_size': 512, 'activation1': 'tanh', 'activation2': 'tanh', 'dropout': 0, 'lr': 0.001, 'weight_decay': 1e-05, 'opt': 'RMSprop'}. Best is trial 323 with value: 0.32512486453416034.[0m
[32m[I 2022-12-30 07:25:15,439][0m Trial 413 finished with value: 0.3204827645168417 and parameters: {'hidden_size': 512, 'activation1': 'tanh', 'activation2': 'tanh', 'dropout': 0.2, 'lr': 0.001, 'weight_decay': 1e-05, 'opt': 'RMSprop'}. Best is trial 323 with value: 0.32512486453416034.[0m
[32m[I 2022-12-30 07:25:24,724][0m Trial 414 finished with value: 0.30680684314058304 and parameters: {'hidden_size': 512, 'activation1': 'relu', 'activation2': 'tanh', 'dropout': 0, 'lr': 0.001, 'weight_decay': 1e-05, 'opt': 'Adam'}. Best is trial 323 with value: 0.32512486453416034.[0m
[32m[I 2022-12-30 07:25:32,815][0m Trial 415 finished with value: 0.3232003581650232 and parameters: {'hidden_size': 512, 'activation1': 'tanh', 'activation2': 'tanh', 'dropout': 0, 'lr': 0.001, 'weight_decay': 1e-05, 'opt': 'RMSprop'}. Best is trial 323 with value: 0.32512486453416034.[0m
[32m[I 2022-12-30 07:25:40,905][0m Trial 416 finished with value: 0.32220531542959574 and parameters: {'hidden_size': 512, 'activation1': 'tanh', 'activation2': 'tanh', 'dropout': 0, 'lr': 0.001, 'weight_decay': 1e-05, 'opt': 'RMSprop'}. Best is trial 323 with value: 0.32512486453416034.[0m
[32m[I 2022-12-30 07:25:49,114][0m Trial 417 finished with value: 0.254038631606173 and parameters: {'hidden_size': 512, 'activation1': 'tanh', 'activation2': 'sigmoid', 'dropout': 0, 'lr': 0.001, 'weight_decay': 1e-05, 'opt': 'RMSprop'}. Best is trial 323 with value: 0.32512486453416034.[0m
[32m[I 2022-12-30 07:25:57,203][0m Trial 418 finished with value: 0.3211213555435818 and parameters: {'hidden_size': 512, 'activation1': 'tanh', 'activation2': 'tanh', 'dropout': 0, 'lr': 0.001, 'weight_decay': 1e-05, 'opt': 'RMSprop'}. Best is trial 323 with value: 0.32512486453416034.[0m
[32m[I 2022-12-30 07:26:05,263][0m Trial 419 finished with value: 0.32100845053559995 and parameters: {'hidden_size': 512, 'activation1': 'tanh', 'activation2': 'tanh', 'dropout': 0, 'lr': 0.001, 'weight_decay': 1e-05, 'opt': 'RMSprop'}. Best is trial 323 with value: 0.32512486453416034.[0m
[32m[I 2022-12-30 07:26:13,330][0m Trial 420 finished with value: 0.32331347011512257 and parameters: {'hidden_size': 512, 'activation1': 'tanh', 'activation2': 'tanh', 'dropout': 0, 'lr': 0.001, 'weight_decay': 1e-05, 'opt': 'RMSprop'}. Best is trial 323 with value: 0.32512486453416034.[0m
[32m[I 2022-12-30 07:26:21,331][0m Trial 421 finished with value: 0.32210520534894166 and parameters: {'hidden_size': 512, 'activation1': 'tanh', 'activation2': 'tanh', 'dropout': 0, 'lr': 0.001, 'weight_decay': 1e-05, 'opt': 'RMSprop'}. Best is trial 323 with value: 0.32512486453416034.[0m
[32m[I 2022-12-30 07:26:29,343][0m Trial 422 finished with value: 0.3226775236876761 and parameters: {'hidden_size': 512, 'activation1': 'tanh', 'activation2': 'tanh', 'dropout': 0, 'lr': 0.001, 'weight_decay': 1e-05, 'opt': 'RMSprop'}. Best is trial 323 with value: 0.32512486453416034.[0m
[32m[I 2022-12-30 07:26:37,334][0m Trial 423 finished with value: 0.32259139067973885 and parameters: {'hidden_size': 512, 'activation1': 'tanh', 'activation2': 'tanh', 'dropout': 0, 'lr': 0.001, 'weight_decay': 1e-05, 'opt': 'RMSprop'}. Best is trial 323 with value: 0.32512486453416034.[0m
[32m[I 2022-12-30 07:26:45,501][0m Trial 424 finished with value: 0.309965100988022 and parameters: {'hidden_size': 128, 'activation1': 'tanh', 'activation2': 'tanh', 'dropout': 0, 'lr': 0.001, 'weight_decay': 1e-05, 'opt': 'RMSprop'}. Best is trial 323 with value: 0.32512486453416034.[0m
[32m[I 2022-12-30 07:26:53,993][0m Trial 425 finished with value: 0.30552724360462635 and parameters: {'hidden_size': 256, 'activation1': 'sigmoid', 'activation2': 'tanh', 'dropout': 0.2, 'lr': 0.001, 'weight_decay': 3e-05, 'opt': 'RMSprop'}. Best is trial 323 with value: 0.32512486453416034.[0m
[32m[I 2022-12-30 07:27:01,983][0m Trial 426 finished with value: 0.32297477285349163 and parameters: {'hidden_size': 512, 'activation1': 'tanh', 'activation2': 'tanh', 'dropout': 0, 'lr': 0.001, 'weight_decay': 3e-05, 'opt': 'RMSprop'}. Best is trial 323 with value: 0.32512486453416034.[0m
[32m[I 2022-12-30 07:27:10,092][0m Trial 427 finished with value: 0.3234619972911605 and parameters: {'hidden_size': 512, 'activation1': 'tanh', 'activation2': 'tanh', 'dropout': 0, 'lr': 0.001, 'weight_decay': 3e-05, 'opt': 'RMSprop'}. Best is trial 323 with value: 0.32512486453416034.[0m
[32m[I 2022-12-30 07:27:18,172][0m Trial 428 finished with value: 0.2802801808387323 and parameters: {'hidden_size': 512, 'activation1': 'tanh', 'activation2': 'tanh', 'dropout': 0, 'lr': 0.01, 'weight_decay': 3e-05, 'opt': 'RMSprop'}. Best is trial 323 with value: 0.32512486453416034.[0m
[32m[I 2022-12-30 07:27:26,200][0m Trial 429 finished with value: 0.25509102529126276 and parameters: {'hidden_size': 512, 'activation1': 'tanh', 'activation2': 'relu', 'dropout': 0, 'lr': 0.001, 'weight_decay': 3e-05, 'opt': 'RMSprop'}. Best is trial 323 with value: 0.32512486453416034.[0m
[32m[I 2022-12-30 07:27:34,128][0m Trial 430 finished with value: 0.32328752085141926 and parameters: {'hidden_size': 512, 'activation1': 'tanh', 'activation2': 'tanh', 'dropout': 0, 'lr': 0.001, 'weight_decay': 3e-05, 'opt': 'RMSprop'}. Best is trial 323 with value: 0.32512486453416034.[0m
[32m[I 2022-12-30 07:27:43,261][0m Trial 431 finished with value: 0.32077329255060755 and parameters: {'hidden_size': 512, 'activation1': 'tanh', 'activation2': 'tanh', 'dropout': 0, 'lr': 0.001, 'weight_decay': 3e-05, 'opt': 'RMSprop'}. Best is trial 323 with value: 0.32512486453416034.[0m
[32m[I 2022-12-30 07:27:51,287][0m Trial 432 finished with value: 0.32355771618186846 and parameters: {'hidden_size': 512, 'activation1': 'tanh', 'activation2': 'tanh', 'dropout': 0, 'lr': 0.001, 'weight_decay': 3e-05, 'opt': 'RMSprop'}. Best is trial 323 with value: 0.32512486453416034.[0m
[32m[I 2022-12-30 07:27:58,368][0m Trial 433 finished with value: 0.29880821404863706 and parameters: {'hidden_size': 512, 'activation1': 'tanh', 'activation2': 'tanh', 'dropout': 0, 'lr': 0.003, 'weight_decay': 3e-05, 'opt': 'SGD'}. Best is trial 323 with value: 0.32512486453416034.[0m
[32m[I 2022-12-30 07:28:06,270][0m Trial 434 finished with value: 0.32183073399679063 and parameters: {'hidden_size': 512, 'activation1': 'tanh', 'activation2': 'tanh', 'dropout': 0, 'lr': 0.001, 'weight_decay': 3e-05, 'opt': 'RMSprop'}. Best is trial 323 with value: 0.32512486453416034.[0m
[32m[I 2022-12-30 07:28:14,198][0m Trial 435 finished with value: 0.32238190089622093 and parameters: {'hidden_size': 512, 'activation1': 'tanh', 'activation2': 'tanh', 'dropout': 0, 'lr': 0.001, 'weight_decay': 3e-05, 'opt': 'RMSprop'}. Best is trial 323 with value: 0.32512486453416034.[0m
[32m[I 2022-12-30 07:28:22,149][0m Trial 436 finished with value: 0.32349850923794493 and parameters: {'hidden_size': 512, 'activation1': 'tanh', 'activation2': 'tanh', 'dropout': 0, 'lr': 0.001, 'weight_decay': 3e-05, 'opt': 'RMSprop'}. Best is trial 323 with value: 0.32512486453416034.[0m
[32m[I 2022-12-30 07:28:30,050][0m Trial 437 finished with value: 0.3228344915985593 and parameters: {'hidden_size': 512, 'activation1': 'tanh', 'activation2': 'tanh', 'dropout': 0, 'lr': 0.001, 'weight_decay': 3e-05, 'opt': 'RMSprop'}. Best is trial 323 with value: 0.32512486453416034.[0m
[32m[I 2022-12-30 07:28:39,361][0m Trial 438 finished with value: 0.3070079326431835 and parameters: {'hidden_size': 512, 'activation1': 'relu', 'activation2': 'tanh', 'dropout': 0, 'lr': 0.001, 'weight_decay': 3e-05, 'opt': 'Adam'}. Best is trial 323 with value: 0.32512486453416034.[0m
[32m[I 2022-12-30 07:28:47,349][0m Trial 439 finished with value: 0.3218584014564863 and parameters: {'hidden_size': 512, 'activation1': 'tanh', 'activation2': 'tanh', 'dropout': 0, 'lr': 0.001, 'weight_decay': 3e-05, 'opt': 'RMSprop'}. Best is trial 323 with value: 0.32512486453416034.[0m
[32m[I 2022-12-30 07:28:55,390][0m Trial 440 finished with value: 0.25513736579958 and parameters: {'hidden_size': 512, 'activation1': 'tanh', 'activation2': 'sigmoid', 'dropout': 0, 'lr': 0.001, 'weight_decay': 3e-05, 'opt': 'RMSprop'}. Best is trial 323 with value: 0.32512486453416034.[0m
[32m[I 2022-12-30 07:29:03,322][0m Trial 441 finished with value: 0.32354144215965724 and parameters: {'hidden_size': 512, 'activation1': 'tanh', 'activation2': 'tanh', 'dropout': 0, 'lr': 0.001, 'weight_decay': 3e-05, 'opt': 'RMSprop'}. Best is trial 323 with value: 0.32512486453416034.[0m
[32m[I 2022-12-30 07:29:11,329][0m Trial 442 finished with value: 0.3227808040265478 and parameters: {'hidden_size': 512, 'activation1': 'tanh', 'activation2': 'tanh', 'dropout': 0, 'lr': 0.001, 'weight_decay': 3e-05, 'opt': 'RMSprop'}. Best is trial 323 with value: 0.32512486453416034.[0m
