[32m[I 2022-12-30 11:11:53,669][0m Trial 1780 finished with value: 0.32321409656653205 and parameters: {'hidden_size': 512, 'activation1': 'tanh', 'activation2': 'tanh', 'dropout': 0.05, 'lr': 0.01, 'weight_decay': 1e-05, 'opt': 'Adam'}. Best is trial 722 with value: 0.32671537835324177.[0m
[32m[I 2022-12-30 11:12:03,192][0m Trial 1781 finished with value: 0.3244237948186253 and parameters: {'hidden_size': 512, 'activation1': 'tanh', 'activation2': 'tanh', 'dropout': 0.05, 'lr': 0.01, 'weight_decay': 1e-05, 'opt': 'Adam'}. Best is trial 722 with value: 0.32671537835324177.[0m
[32m[I 2022-12-30 11:12:12,524][0m Trial 1782 finished with value: 0.32477879375738283 and parameters: {'hidden_size': 512, 'activation1': 'tanh', 'activation2': 'tanh', 'dropout': 0.05, 'lr': 0.01, 'weight_decay': 1e-05, 'opt': 'Adam'}. Best is trial 722 with value: 0.32671537835324177.[0m
[32m[I 2022-12-30 11:12:21,787][0m Trial 1783 finished with value: 0.3247147160447583 and parameters: {'hidden_size': 512, 'activation1': 'tanh', 'activation2': 'tanh', 'dropout': 0.05, 'lr': 0.01, 'weight_decay': 1e-05, 'opt': 'Adam'}. Best is trial 722 with value: 0.32671537835324177.[0m
[32m[I 2022-12-30 11:12:31,109][0m Trial 1784 finished with value: 0.3037803407823594 and parameters: {'hidden_size': 1024, 'activation1': 'tanh', 'activation2': 'tanh', 'dropout': 0.2, 'lr': 0.01, 'weight_decay': 1e-05, 'opt': 'Adam'}. Best is trial 722 with value: 0.32671537835324177.[0m
[32m[I 2022-12-30 11:12:40,507][0m Trial 1785 finished with value: 0.3214032289145711 and parameters: {'hidden_size': 512, 'activation1': 'tanh', 'activation2': 'tanh', 'dropout': 0.05, 'lr': 0.01, 'weight_decay': 1e-05, 'opt': 'Adam'}. Best is trial 722 with value: 0.32671537835324177.[0m
[32m[I 2022-12-30 11:12:49,834][0m Trial 1786 finished with value: 0.3243003398477109 and parameters: {'hidden_size': 512, 'activation1': 'tanh', 'activation2': 'tanh', 'dropout': 0.05, 'lr': 0.01, 'weight_decay': 1e-05, 'opt': 'Adam'}. Best is trial 722 with value: 0.32671537835324177.[0m
[32m[I 2022-12-30 11:12:59,371][0m Trial 1787 finished with value: 0.27351058551087826 and parameters: {'hidden_size': 512, 'activation1': 'sigmoid', 'activation2': 'tanh', 'dropout': 0.05, 'lr': 0.01, 'weight_decay': 1e-05, 'opt': 'Adam'}. Best is trial 722 with value: 0.32671537835324177.[0m
[32m[I 2022-12-30 11:13:08,868][0m Trial 1788 finished with value: 0.32494665652883675 and parameters: {'hidden_size': 512, 'activation1': 'tanh', 'activation2': 'tanh', 'dropout': 0.05, 'lr': 0.01, 'weight_decay': 1e-05, 'opt': 'Adam'}. Best is trial 722 with value: 0.32671537835324177.[0m
[32m[I 2022-12-30 11:13:18,704][0m Trial 1789 finished with value: 0.31619462309426166 and parameters: {'hidden_size': 512, 'activation1': 'tanh', 'activation2': 'tanh', 'dropout': 0.05, 'lr': 0.0003, 'weight_decay': 1e-05, 'opt': 'Adam'}. Best is trial 722 with value: 0.32671537835324177.[0m
[32m[I 2022-12-30 11:13:28,258][0m Trial 1790 finished with value: 0.24370318514742637 and parameters: {'hidden_size': 512, 'activation1': 'tanh', 'activation2': 'relu', 'dropout': 0.05, 'lr': 0.01, 'weight_decay': 1e-05, 'opt': 'Adam'}. Best is trial 722 with value: 0.32671537835324177.[0m
[32m[I 2022-12-30 11:13:37,711][0m Trial 1791 finished with value: 0.3225149029094694 and parameters: {'hidden_size': 512, 'activation1': 'tanh', 'activation2': 'tanh', 'dropout': 0.05, 'lr': 0.01, 'weight_decay': 1e-05, 'opt': 'Adam'}. Best is trial 722 with value: 0.32671537835324177.[0m
[32m[I 2022-12-30 11:13:47,117][0m Trial 1792 finished with value: 0.3221264250557052 and parameters: {'hidden_size': 512, 'activation1': 'tanh', 'activation2': 'tanh', 'dropout': 0.05, 'lr': 0.01, 'weight_decay': 1e-05, 'opt': 'Adam'}. Best is trial 722 with value: 0.32671537835324177.[0m
[32m[I 2022-12-30 11:13:56,502][0m Trial 1793 finished with value: 0.32405078984682784 and parameters: {'hidden_size': 512, 'activation1': 'tanh', 'activation2': 'tanh', 'dropout': 0.05, 'lr': 0.01, 'weight_decay': 1e-05, 'opt': 'Adam'}. Best is trial 722 with value: 0.32671537835324177.[0m
[32m[I 2022-12-30 11:14:05,827][0m Trial 1794 finished with value: 0.3242756652520197 and parameters: {'hidden_size': 512, 'activation1': 'tanh', 'activation2': 'tanh', 'dropout': 0.05, 'lr': 0.01, 'weight_decay': 1e-05, 'opt': 'Adam'}. Best is trial 722 with value: 0.32671537835324177.[0m
[32m[I 2022-12-30 11:14:15,010][0m Trial 1795 finished with value: 0.3032503162733726 and parameters: {'hidden_size': 128, 'activation1': 'tanh', 'activation2': 'tanh', 'dropout': 0.05, 'lr': 0.01, 'weight_decay': 1e-05, 'opt': 'Adam'}. Best is trial 722 with value: 0.32671537835324177.[0m
[32m[I 2022-12-30 11:14:22,048][0m Trial 1796 finished with value: 0.08158466955664076 and parameters: {'hidden_size': 512, 'activation1': 'tanh', 'activation2': 'tanh', 'dropout': 0.05, 'lr': 0.01, 'weight_decay': 1e-05, 'opt': 'SGD'}. Best is trial 722 with value: 0.32671537835324177.[0m
[32m[I 2022-12-30 11:14:31,361][0m Trial 1797 finished with value: 0.3222246988741693 and parameters: {'hidden_size': 512, 'activation1': 'tanh', 'activation2': 'tanh', 'dropout': 0.05, 'lr': 0.01, 'weight_decay': 1e-05, 'opt': 'Adam'}. Best is trial 722 with value: 0.32671537835324177.[0m
[32m[I 2022-12-30 11:14:40,788][0m Trial 1798 finished with value: 0.293450306314316 and parameters: {'hidden_size': 256, 'activation1': 'relu', 'activation2': 'tanh', 'dropout': 0.2, 'lr': 0.01, 'weight_decay': 1e-05, 'opt': 'Adam'}. Best is trial 722 with value: 0.32671537835324177.[0m
[32m[I 2022-12-30 11:14:50,088][0m Trial 1799 finished with value: 0.32750146082422843 and parameters: {'hidden_size': 512, 'activation1': 'tanh', 'activation2': 'tanh', 'dropout': 0.05, 'lr': 0.01, 'weight_decay': 1e-05, 'opt': 'Adam'}. Best is trial 1799 with value: 0.32750146082422843.[0m
[32m[I 2022-12-30 11:14:59,410][0m Trial 1800 finished with value: 0.3149932086670855 and parameters: {'hidden_size': 512, 'activation1': 'tanh', 'activation2': 'tanh', 'dropout': 0.05, 'lr': 0.003, 'weight_decay': 1e-05, 'opt': 'Adam'}. Best is trial 1799 with value: 0.32750146082422843.[0m
[32m[I 2022-12-30 11:15:08,708][0m Trial 1801 finished with value: 0.32583635886550955 and parameters: {'hidden_size': 512, 'activation1': 'tanh', 'activation2': 'tanh', 'dropout': 0.05, 'lr': 0.01, 'weight_decay': 1e-05, 'opt': 'Adam'}. Best is trial 1799 with value: 0.32750146082422843.[0m
[32m[I 2022-12-30 11:15:18,012][0m Trial 1802 finished with value: 0.24776137810729387 and parameters: {'hidden_size': 512, 'activation1': 'tanh', 'activation2': 'sigmoid', 'dropout': 0.05, 'lr': 0.01, 'weight_decay': 1e-05, 'opt': 'Adam'}. Best is trial 1799 with value: 0.32750146082422843.[0m
[32m[I 2022-12-30 11:15:27,271][0m Trial 1803 finished with value: 0.3229061873122191 and parameters: {'hidden_size': 512, 'activation1': 'tanh', 'activation2': 'tanh', 'dropout': 0.05, 'lr': 0.01, 'weight_decay': 1e-05, 'opt': 'Adam'}. Best is trial 1799 with value: 0.32750146082422843.[0m
[32m[I 2022-12-30 11:15:36,550][0m Trial 1804 finished with value: 0.3207959317979173 and parameters: {'hidden_size': 512, 'activation1': 'tanh', 'activation2': 'tanh', 'dropout': 0.05, 'lr': 0.01, 'weight_decay': 1e-05, 'opt': 'Adam'}. Best is trial 1799 with value: 0.32750146082422843.[0m
[32m[I 2022-12-30 11:15:45,727][0m Trial 1805 finished with value: 0.3261599220151468 and parameters: {'hidden_size': 512, 'activation1': 'tanh', 'activation2': 'tanh', 'dropout': 0.05, 'lr': 0.01, 'weight_decay': 1e-05, 'opt': 'Adam'}. Best is trial 1799 with value: 0.32750146082422843.[0m
[32m[I 2022-12-30 11:15:54,907][0m Trial 1806 finished with value: 0.3229548475513944 and parameters: {'hidden_size': 512, 'activation1': 'tanh', 'activation2': 'tanh', 'dropout': 0.05, 'lr': 0.01, 'weight_decay': 1e-05, 'opt': 'Adam'}. Best is trial 1799 with value: 0.32750146082422843.[0m
[32m[I 2022-12-30 11:16:04,135][0m Trial 1807 finished with value: 0.32376705803583083 and parameters: {'hidden_size': 512, 'activation1': 'tanh', 'activation2': 'tanh', 'dropout': 0.05, 'lr': 0.01, 'weight_decay': 1e-05, 'opt': 'Adam'}. Best is trial 1799 with value: 0.32750146082422843.[0m
[32m[I 2022-12-30 11:16:13,467][0m Trial 1808 finished with value: 0.3254234308872786 and parameters: {'hidden_size': 512, 'activation1': 'tanh', 'activation2': 'tanh', 'dropout': 0.05, 'lr': 0.01, 'weight_decay': 1e-05, 'opt': 'Adam'}. Best is trial 1799 with value: 0.32750146082422843.[0m
[32m[I 2022-12-30 11:16:22,815][0m Trial 1809 finished with value: 0.3060386254671913 and parameters: {'hidden_size': 1024, 'activation1': 'tanh', 'activation2': 'tanh', 'dropout': 0.05, 'lr': 0.01, 'weight_decay': 1e-05, 'opt': 'Adam'}. Best is trial 1799 with value: 0.32750146082422843.[0m
[32m[I 2022-12-30 11:16:32,082][0m Trial 1810 finished with value: 0.3241682712046779 and parameters: {'hidden_size': 512, 'activation1': 'tanh', 'activation2': 'tanh', 'dropout': 0.05, 'lr': 0.01, 'weight_decay': 1e-05, 'opt': 'Adam'}. Best is trial 1799 with value: 0.32750146082422843.[0m
[32m[I 2022-12-30 11:16:41,608][0m Trial 1811 finished with value: 0.2736703254767435 and parameters: {'hidden_size': 512, 'activation1': 'sigmoid', 'activation2': 'tanh', 'dropout': 0.05, 'lr': 0.01, 'weight_decay': 1e-05, 'opt': 'Adam'}. Best is trial 1799 with value: 0.32750146082422843.[0m
[32m[I 2022-12-30 11:16:51,405][0m Trial 1812 finished with value: 0.2527973151052545 and parameters: {'hidden_size': 512, 'activation1': 'tanh', 'activation2': 'relu', 'dropout': 0.05, 'lr': 0.0003, 'weight_decay': 1e-05, 'opt': 'Adam'}. Best is trial 1799 with value: 0.32750146082422843.[0m
[32m[I 2022-12-30 11:17:00,645][0m Trial 1813 finished with value: 0.3233253283801546 and parameters: {'hidden_size': 512, 'activation1': 'tanh', 'activation2': 'tanh', 'dropout': 0.05, 'lr': 0.01, 'weight_decay': 1e-05, 'opt': 'Adam'}. Best is trial 1799 with value: 0.32750146082422843.[0m
[32m[I 2022-12-30 11:17:09,998][0m Trial 1814 finished with value: 0.32464399745749156 and parameters: {'hidden_size': 512, 'activation1': 'tanh', 'activation2': 'tanh', 'dropout': 0.05, 'lr': 0.01, 'weight_decay': 1e-05, 'opt': 'Adam'}. Best is trial 1799 with value: 0.32750146082422843.[0m
[32m[I 2022-12-30 11:17:19,348][0m Trial 1815 finished with value: 0.32317706515121325 and parameters: {'hidden_size': 512, 'activation1': 'tanh', 'activation2': 'tanh', 'dropout': 0.05, 'lr': 0.01, 'weight_decay': 1e-05, 'opt': 'Adam'}. Best is trial 1799 with value: 0.32750146082422843.[0m
[32m[I 2022-12-30 11:17:28,807][0m Trial 1816 finished with value: 0.32303245646397355 and parameters: {'hidden_size': 512, 'activation1': 'tanh', 'activation2': 'tanh', 'dropout': 0.05, 'lr': 0.01, 'weight_decay': 1e-05, 'opt': 'Adam'}. Best is trial 1799 with value: 0.32750146082422843.[0m
[32m[I 2022-12-30 11:17:35,772][0m Trial 1817 finished with value: 0.01984674496704708 and parameters: {'hidden_size': 512, 'activation1': 'tanh', 'activation2': 'tanh', 'dropout': 0.05, 'lr': 0.01, 'weight_decay': 1e-05, 'opt': 'SGD'}. Best is trial 1799 with value: 0.32750146082422843.[0m
[32m[I 2022-12-30 11:17:44,990][0m Trial 1818 finished with value: 0.32245127066816803 and parameters: {'hidden_size': 512, 'activation1': 'tanh', 'activation2': 'tanh', 'dropout': 0.05, 'lr': 0.01, 'weight_decay': 1e-05, 'opt': 'Adam'}. Best is trial 1799 with value: 0.32750146082422843.[0m
[32m[I 2022-12-30 11:17:54,135][0m Trial 1819 finished with value: 0.30868465628528313 and parameters: {'hidden_size': 128, 'activation1': 'tanh', 'activation2': 'tanh', 'dropout': 0.05, 'lr': 0.01, 'weight_decay': 1e-05, 'opt': 'Adam'}. Best is trial 1799 with value: 0.32750146082422843.[0m
[32m[I 2022-12-30 11:18:03,403][0m Trial 1820 finished with value: 0.3236256927537925 and parameters: {'hidden_size': 512, 'activation1': 'tanh', 'activation2': 'tanh', 'dropout': 0.05, 'lr': 0.01, 'weight_decay': 1e-05, 'opt': 'Adam'}. Best is trial 1799 with value: 0.32750146082422843.[0m
[32m[I 2022-12-30 11:18:12,833][0m Trial 1821 finished with value: 0.29344547712003466 and parameters: {'hidden_size': 512, 'activation1': 'relu', 'activation2': 'tanh', 'dropout': 0.05, 'lr': 0.01, 'weight_decay': 1e-05, 'opt': 'Adam'}. Best is trial 1799 with value: 0.32750146082422843.[0m
[32m[I 2022-12-30 11:18:22,171][0m Trial 1822 finished with value: 0.32418167280184323 and parameters: {'hidden_size': 512, 'activation1': 'tanh', 'activation2': 'tanh', 'dropout': 0.05, 'lr': 0.01, 'weight_decay': 1e-05, 'opt': 'Adam'}. Best is trial 1799 with value: 0.32750146082422843.[0m
[32m[I 2022-12-30 11:18:31,466][0m Trial 1823 finished with value: 0.24349622810946464 and parameters: {'hidden_size': 256, 'activation1': 'tanh', 'activation2': 'sigmoid', 'dropout': 0.05, 'lr': 0.01, 'weight_decay': 1e-05, 'opt': 'Adam'}. Best is trial 1799 with value: 0.32750146082422843.[0m
[32m[I 2022-12-30 11:18:40,784][0m Trial 1824 finished with value: 0.3234551925567667 and parameters: {'hidden_size': 512, 'activation1': 'tanh', 'activation2': 'tanh', 'dropout': 0.05, 'lr': 0.01, 'weight_decay': 1e-05, 'opt': 'Adam'}. Best is trial 1799 with value: 0.32750146082422843.[0m
[32m[I 2022-12-30 11:18:50,154][0m Trial 1825 finished with value: 0.3160696584444626 and parameters: {'hidden_size': 512, 'activation1': 'tanh', 'activation2': 'tanh', 'dropout': 0.05, 'lr': 0.003, 'weight_decay': 1e-05, 'opt': 'Adam'}. Best is trial 1799 with value: 0.32750146082422843.[0m
[32m[I 2022-12-30 11:18:59,389][0m Trial 1826 finished with value: 0.32287730044131185 and parameters: {'hidden_size': 512, 'activation1': 'tanh', 'activation2': 'tanh', 'dropout': 0.05, 'lr': 0.01, 'weight_decay': 1e-05, 'opt': 'Adam'}. Best is trial 1799 with value: 0.32750146082422843.[0m
[32m[I 2022-12-30 11:19:08,646][0m Trial 1827 finished with value: 0.324345856374041 and parameters: {'hidden_size': 512, 'activation1': 'tanh', 'activation2': 'tanh', 'dropout': 0.05, 'lr': 0.01, 'weight_decay': 1e-05, 'opt': 'Adam'}. Best is trial 1799 with value: 0.32750146082422843.[0m
[32m[I 2022-12-30 11:19:17,893][0m Trial 1828 finished with value: 0.3230419436048767 and parameters: {'hidden_size': 512, 'activation1': 'tanh', 'activation2': 'tanh', 'dropout': 0.05, 'lr': 0.01, 'weight_decay': 1e-05, 'opt': 'Adam'}. Best is trial 1799 with value: 0.32750146082422843.[0m
[32m[I 2022-12-30 11:19:27,221][0m Trial 1829 finished with value: 0.32354927392817323 and parameters: {'hidden_size': 512, 'activation1': 'tanh', 'activation2': 'tanh', 'dropout': 0.05, 'lr': 0.01, 'weight_decay': 1e-05, 'opt': 'Adam'}. Best is trial 1799 with value: 0.32750146082422843.[0m
[32m[I 2022-12-30 11:19:36,470][0m Trial 1830 finished with value: 0.324327867827466 and parameters: {'hidden_size': 512, 'activation1': 'tanh', 'activation2': 'tanh', 'dropout': 0.05, 'lr': 0.01, 'weight_decay': 1e-05, 'opt': 'Adam'}. Best is trial 1799 with value: 0.32750146082422843.[0m
[32m[I 2022-12-30 11:19:45,686][0m Trial 1831 finished with value: 0.3233060152412923 and parameters: {'hidden_size': 512, 'activation1': 'tanh', 'activation2': 'tanh', 'dropout': 0.05, 'lr': 0.01, 'weight_decay': 1e-05, 'opt': 'Adam'}. Best is trial 1799 with value: 0.32750146082422843.[0m
[32m[I 2022-12-30 11:19:55,118][0m Trial 1832 finished with value: 0.2731752921684289 and parameters: {'hidden_size': 512, 'activation1': 'sigmoid', 'activation2': 'tanh', 'dropout': 0.05, 'lr': 0.01, 'weight_decay': 1e-05, 'opt': 'Adam'}. Best is trial 1799 with value: 0.32750146082422843.[0m
[32m[I 2022-12-30 11:20:04,445][0m Trial 1833 finished with value: 0.306564837185276 and parameters: {'hidden_size': 1024, 'activation1': 'tanh', 'activation2': 'tanh', 'dropout': 0.05, 'lr': 0.01, 'weight_decay': 1e-05, 'opt': 'Adam'}. Best is trial 1799 with value: 0.32750146082422843.[0m
[32m[I 2022-12-30 11:20:13,677][0m Trial 1834 finished with value: 0.3231092553720888 and parameters: {'hidden_size': 512, 'activation1': 'tanh', 'activation2': 'tanh', 'dropout': 0.05, 'lr': 0.01, 'weight_decay': 1e-05, 'opt': 'Adam'}. Best is trial 1799 with value: 0.32750146082422843.[0m
[32m[I 2022-12-30 11:20:23,505][0m Trial 1835 finished with value: 0.2542577604632649 and parameters: {'hidden_size': 512, 'activation1': 'tanh', 'activation2': 'relu', 'dropout': 0.05, 'lr': 0.0003, 'weight_decay': 1e-05, 'opt': 'Adam'}. Best is trial 1799 with value: 0.32750146082422843.[0m
[32m[I 2022-12-30 11:20:32,958][0m Trial 1836 finished with value: 0.3248907980162663 and parameters: {'hidden_size': 512, 'activation1': 'tanh', 'activation2': 'tanh', 'dropout': 0.05, 'lr': 0.01, 'weight_decay': 1e-05, 'opt': 'Adam'}. Best is trial 1799 with value: 0.32750146082422843.[0m
[32m[I 2022-12-30 11:20:42,268][0m Trial 1837 finished with value: 0.3253589048274811 and parameters: {'hidden_size': 512, 'activation1': 'tanh', 'activation2': 'tanh', 'dropout': 0.05, 'lr': 0.01, 'weight_decay': 1e-05, 'opt': 'Adam'}. Best is trial 1799 with value: 0.32750146082422843.[0m
[32m[I 2022-12-30 11:20:49,336][0m Trial 1838 finished with value: 0.04794902102342593 and parameters: {'hidden_size': 512, 'activation1': 'tanh', 'activation2': 'tanh', 'dropout': 0.05, 'lr': 0.01, 'weight_decay': 1e-05, 'opt': 'SGD'}. Best is trial 1799 with value: 0.32750146082422843.[0m
[32m[I 2022-12-30 11:20:58,683][0m Trial 1839 finished with value: 0.3215806608833754 and parameters: {'hidden_size': 512, 'activation1': 'tanh', 'activation2': 'tanh', 'dropout': 0.05, 'lr': 0.01, 'weight_decay': 1e-05, 'opt': 'Adam'}. Best is trial 1799 with value: 0.32750146082422843.[0m
[32m[I 2022-12-30 11:21:08,074][0m Trial 1840 finished with value: 0.3242268868850584 and parameters: {'hidden_size': 512, 'activation1': 'tanh', 'activation2': 'tanh', 'dropout': 0.05, 'lr': 0.01, 'weight_decay': 1e-05, 'opt': 'Adam'}. Best is trial 1799 with value: 0.32750146082422843.[0m
[32m[I 2022-12-30 11:21:17,417][0m Trial 1841 finished with value: 0.3224247584597503 and parameters: {'hidden_size': 512, 'activation1': 'tanh', 'activation2': 'tanh', 'dropout': 0.05, 'lr': 0.01, 'weight_decay': 1e-05, 'opt': 'Adam'}. Best is trial 1799 with value: 0.32750146082422843.[0m
[32m[I 2022-12-30 11:21:26,896][0m Trial 1842 finished with value: 0.3209263955976458 and parameters: {'hidden_size': 512, 'activation1': 'tanh', 'activation2': 'tanh', 'dropout': 0.2, 'lr': 0.01, 'weight_decay': 1e-05, 'opt': 'Adam'}. Best is trial 1799 with value: 0.32750146082422843.[0m
[32m[I 2022-12-30 11:21:36,233][0m Trial 1843 finished with value: 0.3249934874772278 and parameters: {'hidden_size': 512, 'activation1': 'tanh', 'activation2': 'tanh', 'dropout': 0.05, 'lr': 0.01, 'weight_decay': 1e-05, 'opt': 'Adam'}. Best is trial 1799 with value: 0.32750146082422843.[0m
[32m[I 2022-12-30 11:21:45,704][0m Trial 1844 finished with value: 0.2811973632235306 and parameters: {'hidden_size': 512, 'activation1': 'relu', 'activation2': 'tanh', 'dropout': 0.05, 'lr': 0.01, 'weight_decay': 3e-06, 'opt': 'Adam'}. Best is trial 1799 with value: 0.32750146082422843.[0m
[32m[I 2022-12-30 11:21:55,054][0m Trial 1845 finished with value: 0.2429542573900796 and parameters: {'hidden_size': 128, 'activation1': 'tanh', 'activation2': 'sigmoid', 'dropout': 0.05, 'lr': 0.01, 'weight_decay': 1e-05, 'opt': 'Adam'}. Best is trial 1799 with value: 0.32750146082422843.[0m
[32m[I 2022-12-30 11:22:04,574][0m Trial 1846 finished with value: 0.32461207479353293 and parameters: {'hidden_size': 512, 'activation1': 'tanh', 'activation2': 'tanh', 'dropout': 0.05, 'lr': 0.01, 'weight_decay': 1e-05, 'opt': 'Adam'}. Best is trial 1799 with value: 0.32750146082422843.[0m
[32m[I 2022-12-30 11:22:14,002][0m Trial 1847 finished with value: 0.322962508770551 and parameters: {'hidden_size': 512, 'activation1': 'tanh', 'activation2': 'tanh', 'dropout': 0.05, 'lr': 0.01, 'weight_decay': 1e-05, 'opt': 'Adam'}. Best is trial 1799 with value: 0.32750146082422843.[0m
[32m[I 2022-12-30 11:22:23,573][0m Trial 1848 finished with value: 0.3109559597448867 and parameters: {'hidden_size': 256, 'activation1': 'tanh', 'activation2': 'tanh', 'dropout': 0.05, 'lr': 0.003, 'weight_decay': 1e-05, 'opt': 'Adam'}. Best is trial 1799 with value: 0.32750146082422843.[0m
[32m[I 2022-12-30 11:22:33,057][0m Trial 1849 finished with value: 0.3247790433063467 and parameters: {'hidden_size': 512, 'activation1': 'tanh', 'activation2': 'tanh', 'dropout': 0.05, 'lr': 0.01, 'weight_decay': 1e-05, 'opt': 'Adam'}. Best is trial 1799 with value: 0.32750146082422843.[0m
[32m[I 2022-12-30 11:22:42,396][0m Trial 1850 finished with value: 0.3237522284043879 and parameters: {'hidden_size': 512, 'activation1': 'tanh', 'activation2': 'tanh', 'dropout': 0.05, 'lr': 0.01, 'weight_decay': 1e-05, 'opt': 'Adam'}. Best is trial 1799 with value: 0.32750146082422843.[0m
[32m[I 2022-12-30 11:22:51,636][0m Trial 1851 finished with value: 0.32270664071669036 and parameters: {'hidden_size': 512, 'activation1': 'tanh', 'activation2': 'tanh', 'dropout': 0.05, 'lr': 0.01, 'weight_decay': 3e-06, 'opt': 'Adam'}. Best is trial 1799 with value: 0.32750146082422843.[0m
[32m[I 2022-12-30 11:23:00,961][0m Trial 1852 finished with value: 0.32357816714197457 and parameters: {'hidden_size': 512, 'activation1': 'tanh', 'activation2': 'tanh', 'dropout': 0.05, 'lr': 0.01, 'weight_decay': 1e-05, 'opt': 'Adam'}. Best is trial 1799 with value: 0.32750146082422843.[0m
[32m[I 2022-12-30 11:23:10,614][0m Trial 1853 finished with value: 0.2790273421355573 and parameters: {'hidden_size': 512, 'activation1': 'sigmoid', 'activation2': 'tanh', 'dropout': 0.05, 'lr': 0.01, 'weight_decay': 1e-05, 'opt': 'Adam'}. Best is trial 1799 with value: 0.32750146082422843.[0m
