[32m[I 2022-12-30 06:58:37,158][0m Trial 221 finished with value: 0.31677654822996076 and parameters: {'hidden_size': 1024, 'activation1': 'tanh', 'activation2': 'tanh', 'dropout': 0.05, 'lr': 0.0003, 'weight_decay': 3e-06, 'opt': 'RMSprop'}. Best is trial 153 with value: 0.31816274463260114.[0m
[32m[I 2022-12-30 06:58:45,657][0m Trial 222 finished with value: 0.3155054246263293 and parameters: {'hidden_size': 1024, 'activation1': 'tanh', 'activation2': 'tanh', 'dropout': 0.05, 'lr': 0.0003, 'weight_decay': 3e-06, 'opt': 'RMSprop'}. Best is trial 153 with value: 0.31816274463260114.[0m
[32m[I 2022-12-30 06:58:54,137][0m Trial 223 finished with value: 0.3160304447770833 and parameters: {'hidden_size': 1024, 'activation1': 'tanh', 'activation2': 'tanh', 'dropout': 0.05, 'lr': 0.0003, 'weight_decay': 3e-06, 'opt': 'RMSprop'}. Best is trial 153 with value: 0.31816274463260114.[0m
[32m[I 2022-12-30 06:59:02,606][0m Trial 224 finished with value: 0.31652916014737215 and parameters: {'hidden_size': 1024, 'activation1': 'tanh', 'activation2': 'tanh', 'dropout': 0.05, 'lr': 0.0003, 'weight_decay': 3e-06, 'opt': 'RMSprop'}. Best is trial 153 with value: 0.31816274463260114.[0m
[32m[I 2022-12-30 06:59:11,701][0m Trial 225 finished with value: 0.30477739521913155 and parameters: {'hidden_size': 128, 'activation1': 'tanh', 'activation2': 'tanh', 'dropout': 0.05, 'lr': 0.0003, 'weight_decay': 3e-06, 'opt': 'RMSprop'}. Best is trial 153 with value: 0.31816274463260114.[0m
[32m[I 2022-12-30 06:59:20,402][0m Trial 226 finished with value: 0.31779353878238925 and parameters: {'hidden_size': 1024, 'activation1': 'tanh', 'activation2': 'tanh', 'dropout': 0.05, 'lr': 0.0003, 'weight_decay': 3e-06, 'opt': 'RMSprop'}. Best is trial 153 with value: 0.31816274463260114.[0m
[32m[I 2022-12-30 06:59:29,172][0m Trial 227 finished with value: 0.31284758740441887 and parameters: {'hidden_size': 256, 'activation1': 'tanh', 'activation2': 'tanh', 'dropout': 0, 'lr': 0.0003, 'weight_decay': 3e-06, 'opt': 'RMSprop'}. Best is trial 153 with value: 0.31816274463260114.[0m
[32m[I 2022-12-30 06:59:37,775][0m Trial 228 finished with value: 0.2574787610363531 and parameters: {'hidden_size': 1024, 'activation1': 'tanh', 'activation2': 'relu', 'dropout': 0.05, 'lr': 0.0003, 'weight_decay': 3e-05, 'opt': 'RMSprop'}. Best is trial 153 with value: 0.31816274463260114.[0m
[32m[I 2022-12-30 06:59:46,250][0m Trial 229 finished with value: 0.3167740533100768 and parameters: {'hidden_size': 1024, 'activation1': 'tanh', 'activation2': 'tanh', 'dropout': 0.05, 'lr': 0.0003, 'weight_decay': 3e-06, 'opt': 'RMSprop'}. Best is trial 153 with value: 0.31816274463260114.[0m
[32m[I 2022-12-30 06:59:54,817][0m Trial 230 finished with value: 0.318454146220179 and parameters: {'hidden_size': 512, 'activation1': 'tanh', 'activation2': 'tanh', 'dropout': 0.1, 'lr': 0.0003, 'weight_decay': 3e-06, 'opt': 'RMSprop'}. Best is trial 230 with value: 0.318454146220179.[0m
[32m[I 2022-12-30 07:00:03,409][0m Trial 231 finished with value: 0.3170980716831601 and parameters: {'hidden_size': 512, 'activation1': 'tanh', 'activation2': 'tanh', 'dropout': 0.1, 'lr': 0.0003, 'weight_decay': 3e-06, 'opt': 'RMSprop'}. Best is trial 230 with value: 0.318454146220179.[0m
[32m[I 2022-12-30 07:00:12,012][0m Trial 232 finished with value: 0.31637179018541 and parameters: {'hidden_size': 512, 'activation1': 'tanh', 'activation2': 'tanh', 'dropout': 0.1, 'lr': 0.0003, 'weight_decay': 3e-06, 'opt': 'RMSprop'}. Best is trial 230 with value: 0.318454146220179.[0m
[32m[I 2022-12-30 07:00:20,596][0m Trial 233 finished with value: 0.31695063670587753 and parameters: {'hidden_size': 512, 'activation1': 'tanh', 'activation2': 'tanh', 'dropout': 0.1, 'lr': 0.0003, 'weight_decay': 3e-06, 'opt': 'RMSprop'}. Best is trial 230 with value: 0.318454146220179.[0m
[32m[I 2022-12-30 07:00:29,202][0m Trial 234 finished with value: 0.31771619947433083 and parameters: {'hidden_size': 512, 'activation1': 'tanh', 'activation2': 'tanh', 'dropout': 0.1, 'lr': 0.0003, 'weight_decay': 3e-06, 'opt': 'RMSprop'}. Best is trial 230 with value: 0.318454146220179.[0m
[32m[I 2022-12-30 07:00:37,819][0m Trial 235 finished with value: 0.31741330614365754 and parameters: {'hidden_size': 512, 'activation1': 'tanh', 'activation2': 'tanh', 'dropout': 0.1, 'lr': 0.0003, 'weight_decay': 3e-06, 'opt': 'RMSprop'}. Best is trial 230 with value: 0.318454146220179.[0m
[32m[I 2022-12-30 07:00:46,513][0m Trial 236 finished with value: 0.31785515809066106 and parameters: {'hidden_size': 512, 'activation1': 'tanh', 'activation2': 'tanh', 'dropout': 0.1, 'lr': 0.0003, 'weight_decay': 3e-06, 'opt': 'RMSprop'}. Best is trial 230 with value: 0.318454146220179.[0m
[32m[I 2022-12-30 07:00:54,366][0m Trial 237 finished with value: 0.293712638789005 and parameters: {'hidden_size': 512, 'activation1': 'tanh', 'activation2': 'tanh', 'dropout': 0.1, 'lr': 0.0003, 'weight_decay': 3e-06, 'opt': 'SGD'}. Best is trial 230 with value: 0.318454146220179.[0m
[32m[I 2022-12-30 07:01:03,028][0m Trial 238 finished with value: 0.3174451161088019 and parameters: {'hidden_size': 512, 'activation1': 'tanh', 'activation2': 'tanh', 'dropout': 0.1, 'lr': 0.0003, 'weight_decay': 3e-06, 'opt': 'RMSprop'}. Best is trial 230 with value: 0.318454146220179.[0m
[32m[I 2022-12-30 07:01:12,943][0m Trial 239 finished with value: 0.315589663856578 and parameters: {'hidden_size': 512, 'activation1': 'tanh', 'activation2': 'tanh', 'dropout': 0.1, 'lr': 0.0003, 'weight_decay': 3e-06, 'opt': 'Adam'}. Best is trial 230 with value: 0.318454146220179.[0m
[32m[I 2022-12-30 07:01:21,312][0m Trial 240 finished with value: 0.27596997473484863 and parameters: {'hidden_size': 512, 'activation1': 'tanh', 'activation2': 'tanh', 'dropout': 0.1, 'lr': 0.01, 'weight_decay': 3e-06, 'opt': 'RMSprop'}. Best is trial 230 with value: 0.318454146220179.[0m
[32m[I 2022-12-30 07:01:29,817][0m Trial 241 finished with value: 0.3166530425522001 and parameters: {'hidden_size': 512, 'activation1': 'tanh', 'activation2': 'tanh', 'dropout': 0.1, 'lr': 0.0003, 'weight_decay': 3e-06, 'opt': 'RMSprop'}. Best is trial 230 with value: 0.318454146220179.[0m
[32m[I 2022-12-30 07:01:38,342][0m Trial 242 finished with value: 0.318667130409243 and parameters: {'hidden_size': 512, 'activation1': 'tanh', 'activation2': 'tanh', 'dropout': 0.1, 'lr': 0.0003, 'weight_decay': 3e-06, 'opt': 'RMSprop'}. Best is trial 242 with value: 0.318667130409243.[0m
[32m[I 2022-12-30 07:01:46,858][0m Trial 243 finished with value: 0.31670228869538775 and parameters: {'hidden_size': 512, 'activation1': 'tanh', 'activation2': 'tanh', 'dropout': 0.1, 'lr': 0.0003, 'weight_decay': 3e-06, 'opt': 'RMSprop'}. Best is trial 242 with value: 0.318667130409243.[0m
[32m[I 2022-12-30 07:01:55,384][0m Trial 244 finished with value: 0.31658938364833983 and parameters: {'hidden_size': 512, 'activation1': 'tanh', 'activation2': 'tanh', 'dropout': 0.1, 'lr': 0.0003, 'weight_decay': 3e-06, 'opt': 'RMSprop'}. Best is trial 242 with value: 0.318667130409243.[0m
[32m[I 2022-12-30 07:02:03,940][0m Trial 245 finished with value: 0.3176509891151039 and parameters: {'hidden_size': 512, 'activation1': 'tanh', 'activation2': 'tanh', 'dropout': 0.1, 'lr': 0.0003, 'weight_decay': 3e-06, 'opt': 'RMSprop'}. Best is trial 242 with value: 0.318667130409243.[0m
[32m[I 2022-12-30 07:02:12,427][0m Trial 246 finished with value: 0.3179713863221604 and parameters: {'hidden_size': 512, 'activation1': 'tanh', 'activation2': 'tanh', 'dropout': 0.1, 'lr': 0.0003, 'weight_decay': 3e-06, 'opt': 'RMSprop'}. Best is trial 242 with value: 0.318667130409243.[0m
[32m[I 2022-12-30 07:02:21,234][0m Trial 247 finished with value: 0.3070774825589974 and parameters: {'hidden_size': 512, 'activation1': 'relu', 'activation2': 'tanh', 'dropout': 0.1, 'lr': 0.0003, 'weight_decay': 1e-05, 'opt': 'RMSprop'}. Best is trial 242 with value: 0.318667130409243.[0m
[32m[I 2022-12-30 07:02:30,005][0m Trial 248 finished with value: 0.25279923377345703 and parameters: {'hidden_size': 512, 'activation1': 'tanh', 'activation2': 'sigmoid', 'dropout': 0.1, 'lr': 0.0003, 'weight_decay': 3e-06, 'opt': 'RMSprop'}. Best is trial 242 with value: 0.318667130409243.[0m
[32m[I 2022-12-30 07:02:38,568][0m Trial 249 finished with value: 0.31724220534347003 and parameters: {'hidden_size': 512, 'activation1': 'tanh', 'activation2': 'tanh', 'dropout': 0.1, 'lr': 0.0003, 'weight_decay': 3e-06, 'opt': 'RMSprop'}. Best is trial 242 with value: 0.318667130409243.[0m
[32m[I 2022-12-30 07:02:47,136][0m Trial 250 finished with value: 0.3171813548848471 and parameters: {'hidden_size': 512, 'activation1': 'tanh', 'activation2': 'tanh', 'dropout': 0.1, 'lr': 0.0003, 'weight_decay': 3e-06, 'opt': 'RMSprop'}. Best is trial 242 with value: 0.318667130409243.[0m
[32m[I 2022-12-30 07:02:55,680][0m Trial 251 finished with value: 0.31829136345931924 and parameters: {'hidden_size': 512, 'activation1': 'tanh', 'activation2': 'tanh', 'dropout': 0.1, 'lr': 0.0003, 'weight_decay': 3e-06, 'opt': 'RMSprop'}. Best is trial 242 with value: 0.318667130409243.[0m
[32m[I 2022-12-30 07:03:04,129][0m Trial 252 finished with value: 0.3170966507604831 and parameters: {'hidden_size': 512, 'activation1': 'tanh', 'activation2': 'tanh', 'dropout': 0.1, 'lr': 0.0003, 'weight_decay': 3e-06, 'opt': 'RMSprop'}. Best is trial 242 with value: 0.318667130409243.[0m
[32m[I 2022-12-30 07:03:12,636][0m Trial 253 finished with value: 0.3178461046330796 and parameters: {'hidden_size': 512, 'activation1': 'tanh', 'activation2': 'tanh', 'dropout': 0.1, 'lr': 0.0003, 'weight_decay': 3e-06, 'opt': 'RMSprop'}. Best is trial 242 with value: 0.318667130409243.[0m
[32m[I 2022-12-30 07:03:21,183][0m Trial 254 finished with value: 0.31775200753312227 and parameters: {'hidden_size': 512, 'activation1': 'tanh', 'activation2': 'tanh', 'dropout': 0.1, 'lr': 0.0003, 'weight_decay': 3e-06, 'opt': 'RMSprop'}. Best is trial 242 with value: 0.318667130409243.[0m
[32m[I 2022-12-30 07:03:29,504][0m Trial 255 finished with value: 0.30772898018023553 and parameters: {'hidden_size': 512, 'activation1': 'tanh', 'activation2': 'tanh', 'dropout': 0.1, 'lr': 0.003, 'weight_decay': 3e-06, 'opt': 'RMSprop'}. Best is trial 242 with value: 0.318667130409243.[0m
[32m[I 2022-12-30 07:03:38,016][0m Trial 256 finished with value: 0.31731511543272967 and parameters: {'hidden_size': 512, 'activation1': 'tanh', 'activation2': 'tanh', 'dropout': 0.1, 'lr': 0.0003, 'weight_decay': 3e-06, 'opt': 'RMSprop'}. Best is trial 242 with value: 0.318667130409243.[0m
[32m[I 2022-12-30 07:03:46,521][0m Trial 257 finished with value: 0.31712999680838805 and parameters: {'hidden_size': 512, 'activation1': 'tanh', 'activation2': 'tanh', 'dropout': 0.1, 'lr': 0.0003, 'weight_decay': 3e-06, 'opt': 'RMSprop'}. Best is trial 242 with value: 0.318667130409243.[0m
[32m[I 2022-12-30 07:03:55,045][0m Trial 258 finished with value: 0.31844799518397204 and parameters: {'hidden_size': 512, 'activation1': 'tanh', 'activation2': 'tanh', 'dropout': 0.1, 'lr': 0.0003, 'weight_decay': 3e-06, 'opt': 'RMSprop'}. Best is trial 242 with value: 0.318667130409243.[0m
[32m[I 2022-12-30 07:04:03,568][0m Trial 259 finished with value: 0.3182792660444057 and parameters: {'hidden_size': 512, 'activation1': 'tanh', 'activation2': 'tanh', 'dropout': 0.1, 'lr': 0.0003, 'weight_decay': 3e-06, 'opt': 'RMSprop'}. Best is trial 242 with value: 0.318667130409243.[0m
[32m[I 2022-12-30 07:04:12,252][0m Trial 260 finished with value: 0.3098010992182997 and parameters: {'hidden_size': 512, 'activation1': 'sigmoid', 'activation2': 'tanh', 'dropout': 0.1, 'lr': 0.0003, 'weight_decay': 3e-06, 'opt': 'RMSprop'}. Best is trial 242 with value: 0.318667130409243.[0m
[32m[I 2022-12-30 07:04:20,611][0m Trial 261 finished with value: 0.3209732392378269 and parameters: {'hidden_size': 512, 'activation1': 'tanh', 'activation2': 'tanh', 'dropout': 0.1, 'lr': 0.001, 'weight_decay': 3e-06, 'opt': 'RMSprop'}. Best is trial 261 with value: 0.3209732392378269.[0m
[32m[I 2022-12-30 07:04:29,105][0m Trial 262 finished with value: 0.2536043951828558 and parameters: {'hidden_size': 512, 'activation1': 'tanh', 'activation2': 'relu', 'dropout': 0.1, 'lr': 0.001, 'weight_decay': 3e-06, 'opt': 'RMSprop'}. Best is trial 261 with value: 0.3209732392378269.[0m
[32m[I 2022-12-30 07:04:37,515][0m Trial 263 finished with value: 0.32231910211986603 and parameters: {'hidden_size': 512, 'activation1': 'tanh', 'activation2': 'tanh', 'dropout': 0.1, 'lr': 0.001, 'weight_decay': 3e-06, 'opt': 'RMSprop'}. Best is trial 263 with value: 0.32231910211986603.[0m
[32m[I 2022-12-30 07:04:45,858][0m Trial 264 finished with value: 0.32059365161899 and parameters: {'hidden_size': 512, 'activation1': 'tanh', 'activation2': 'tanh', 'dropout': 0.1, 'lr': 0.001, 'weight_decay': 3e-06, 'opt': 'RMSprop'}. Best is trial 263 with value: 0.32231910211986603.[0m
[32m[I 2022-12-30 07:04:54,167][0m Trial 265 finished with value: 0.3222404173164822 and parameters: {'hidden_size': 512, 'activation1': 'tanh', 'activation2': 'tanh', 'dropout': 0.1, 'lr': 0.001, 'weight_decay': 3e-05, 'opt': 'RMSprop'}. Best is trial 263 with value: 0.32231910211986603.[0m
[32m[I 2022-12-30 07:05:02,541][0m Trial 266 finished with value: 0.3225204594091676 and parameters: {'hidden_size': 512, 'activation1': 'tanh', 'activation2': 'tanh', 'dropout': 0.1, 'lr': 0.001, 'weight_decay': 3e-05, 'opt': 'RMSprop'}. Best is trial 266 with value: 0.3225204594091676.[0m
[32m[I 2022-12-30 07:05:10,083][0m Trial 267 finished with value: 0.3029550375980396 and parameters: {'hidden_size': 512, 'activation1': 'tanh', 'activation2': 'tanh', 'dropout': 0.1, 'lr': 0.001, 'weight_decay': 3e-05, 'opt': 'SGD'}. Best is trial 266 with value: 0.3225204594091676.[0m
[32m[I 2022-12-30 07:05:18,411][0m Trial 268 finished with value: 0.32181449848241617 and parameters: {'hidden_size': 512, 'activation1': 'tanh', 'activation2': 'tanh', 'dropout': 0.1, 'lr': 0.001, 'weight_decay': 3e-05, 'opt': 'RMSprop'}. Best is trial 266 with value: 0.3225204594091676.[0m
[32m[I 2022-12-30 07:05:26,707][0m Trial 269 finished with value: 0.3213021669955222 and parameters: {'hidden_size': 512, 'activation1': 'tanh', 'activation2': 'tanh', 'dropout': 0.1, 'lr': 0.001, 'weight_decay': 3e-05, 'opt': 'RMSprop'}. Best is trial 266 with value: 0.3225204594091676.[0m
[32m[I 2022-12-30 07:05:36,212][0m Trial 270 finished with value: 0.3139665113918202 and parameters: {'hidden_size': 512, 'activation1': 'tanh', 'activation2': 'tanh', 'dropout': 0.1, 'lr': 0.001, 'weight_decay': 3e-05, 'opt': 'Adam'}. Best is trial 266 with value: 0.3225204594091676.[0m
[32m[I 2022-12-30 07:05:44,568][0m Trial 271 finished with value: 0.3216978052575305 and parameters: {'hidden_size': 512, 'activation1': 'tanh', 'activation2': 'tanh', 'dropout': 0.1, 'lr': 0.001, 'weight_decay': 3e-05, 'opt': 'RMSprop'}. Best is trial 266 with value: 0.3225204594091676.[0m
[32m[I 2022-12-30 07:05:52,865][0m Trial 272 finished with value: 0.32098434049037705 and parameters: {'hidden_size': 512, 'activation1': 'tanh', 'activation2': 'tanh', 'dropout': 0.1, 'lr': 0.001, 'weight_decay': 3e-05, 'opt': 'RMSprop'}. Best is trial 266 with value: 0.3225204594091676.[0m
[32m[I 2022-12-30 07:06:01,234][0m Trial 273 finished with value: 0.31475021911012124 and parameters: {'hidden_size': 512, 'activation1': 'relu', 'activation2': 'tanh', 'dropout': 0.1, 'lr': 0.001, 'weight_decay': 3e-05, 'opt': 'RMSprop'}. Best is trial 266 with value: 0.3225204594091676.[0m
[32m[I 2022-12-30 07:06:09,511][0m Trial 274 finished with value: 0.3220724063172726 and parameters: {'hidden_size': 512, 'activation1': 'tanh', 'activation2': 'tanh', 'dropout': 0.1, 'lr': 0.001, 'weight_decay': 3e-05, 'opt': 'RMSprop'}. Best is trial 266 with value: 0.3225204594091676.[0m
[32m[I 2022-12-30 07:06:18,041][0m Trial 275 finished with value: 0.2529456294671486 and parameters: {'hidden_size': 512, 'activation1': 'tanh', 'activation2': 'sigmoid', 'dropout': 0.1, 'lr': 0.001, 'weight_decay': 3e-05, 'opt': 'RMSprop'}. Best is trial 266 with value: 0.3225204594091676.[0m
[32m[I 2022-12-30 07:06:26,696][0m Trial 276 finished with value: 0.32187889098082845 and parameters: {'hidden_size': 512, 'activation1': 'tanh', 'activation2': 'tanh', 'dropout': 0.1, 'lr': 0.001, 'weight_decay': 3e-05, 'opt': 'RMSprop'}. Best is trial 266 with value: 0.3225204594091676.[0m
[32m[I 2022-12-30 07:06:35,195][0m Trial 277 finished with value: 0.32296361054426126 and parameters: {'hidden_size': 512, 'activation1': 'tanh', 'activation2': 'tanh', 'dropout': 0.1, 'lr': 0.001, 'weight_decay': 3e-05, 'opt': 'RMSprop'}. Best is trial 277 with value: 0.32296361054426126.[0m
[32m[I 2022-12-30 07:06:43,476][0m Trial 278 finished with value: 0.3227533529283063 and parameters: {'hidden_size': 512, 'activation1': 'tanh', 'activation2': 'tanh', 'dropout': 0.1, 'lr': 0.001, 'weight_decay': 3e-05, 'opt': 'RMSprop'}. Best is trial 277 with value: 0.32296361054426126.[0m
[32m[I 2022-12-30 07:06:51,735][0m Trial 279 finished with value: 0.32168671188698966 and parameters: {'hidden_size': 512, 'activation1': 'tanh', 'activation2': 'tanh', 'dropout': 0.1, 'lr': 0.001, 'weight_decay': 3e-05, 'opt': 'RMSprop'}. Best is trial 277 with value: 0.32296361054426126.[0m
[32m[I 2022-12-30 07:07:00,071][0m Trial 280 finished with value: 0.32173757338187253 and parameters: {'hidden_size': 512, 'activation1': 'tanh', 'activation2': 'tanh', 'dropout': 0.1, 'lr': 0.001, 'weight_decay': 3e-05, 'opt': 'RMSprop'}. Best is trial 277 with value: 0.32296361054426126.[0m
[32m[I 2022-12-30 07:07:08,440][0m Trial 281 finished with value: 0.3216011650764846 and parameters: {'hidden_size': 512, 'activation1': 'tanh', 'activation2': 'tanh', 'dropout': 0.1, 'lr': 0.001, 'weight_decay': 3e-05, 'opt': 'RMSprop'}. Best is trial 277 with value: 0.32296361054426126.[0m
[32m[I 2022-12-30 07:07:16,648][0m Trial 282 finished with value: 0.3213437752376057 and parameters: {'hidden_size': 512, 'activation1': 'tanh', 'activation2': 'tanh', 'dropout': 0.1, 'lr': 0.001, 'weight_decay': 3e-05, 'opt': 'RMSprop'}. Best is trial 277 with value: 0.32296361054426126.[0m
[32m[I 2022-12-30 07:07:24,910][0m Trial 283 finished with value: 0.32223541815900936 and parameters: {'hidden_size': 512, 'activation1': 'tanh', 'activation2': 'tanh', 'dropout': 0.1, 'lr': 0.001, 'weight_decay': 3e-05, 'opt': 'RMSprop'}. Best is trial 277 with value: 0.32296361054426126.[0m
[32m[I 2022-12-30 07:07:33,355][0m Trial 284 finished with value: 0.32246989633281914 and parameters: {'hidden_size': 512, 'activation1': 'tanh', 'activation2': 'tanh', 'dropout': 0.1, 'lr': 0.001, 'weight_decay': 3e-05, 'opt': 'RMSprop'}. Best is trial 277 with value: 0.32296361054426126.[0m
[32m[I 2022-12-30 07:07:42,253][0m Trial 285 finished with value: 0.3105551786975534 and parameters: {'hidden_size': 512, 'activation1': 'sigmoid', 'activation2': 'tanh', 'dropout': 0.1, 'lr': 0.001, 'weight_decay': 3e-05, 'opt': 'RMSprop'}. Best is trial 277 with value: 0.32296361054426126.[0m
[32m[I 2022-12-30 07:07:51,115][0m Trial 286 finished with value: 0.3213348927396101 and parameters: {'hidden_size': 512, 'activation1': 'tanh', 'activation2': 'tanh', 'dropout': 0.1, 'lr': 0.001, 'weight_decay': 3e-05, 'opt': 'RMSprop'}. Best is trial 277 with value: 0.32296361054426126.[0m
[32m[I 2022-12-30 07:07:59,880][0m Trial 287 finished with value: 0.3225729756973627 and parameters: {'hidden_size': 512, 'activation1': 'tanh', 'activation2': 'tanh', 'dropout': 0.1, 'lr': 0.001, 'weight_decay': 3e-05, 'opt': 'RMSprop'}. Best is trial 277 with value: 0.32296361054426126.[0m
[32m[I 2022-12-30 07:08:08,861][0m Trial 288 finished with value: 0.2535642489336558 and parameters: {'hidden_size': 512, 'activation1': 'tanh', 'activation2': 'relu', 'dropout': 0.1, 'lr': 0.001, 'weight_decay': 3e-05, 'opt': 'RMSprop'}. Best is trial 277 with value: 0.32296361054426126.[0m
[32m[I 2022-12-30 07:08:17,658][0m Trial 289 finished with value: 0.32148240472849243 and parameters: {'hidden_size': 512, 'activation1': 'tanh', 'activation2': 'tanh', 'dropout': 0.1, 'lr': 0.001, 'weight_decay': 3e-05, 'opt': 'RMSprop'}. Best is trial 277 with value: 0.32296361054426126.[0m
[32m[I 2022-12-30 07:08:26,443][0m Trial 290 finished with value: 0.321403171096756 and parameters: {'hidden_size': 512, 'activation1': 'tanh', 'activation2': 'tanh', 'dropout': 0.1, 'lr': 0.001, 'weight_decay': 3e-05, 'opt': 'RMSprop'}. Best is trial 277 with value: 0.32296361054426126.[0m
[32m[I 2022-12-30 07:08:35,298][0m Trial 291 finished with value: 0.324002965992213 and parameters: {'hidden_size': 512, 'activation1': 'tanh', 'activation2': 'tanh', 'dropout': 0.1, 'lr': 0.001, 'weight_decay': 3e-05, 'opt': 'RMSprop'}. Best is trial 291 with value: 0.324002965992213.[0m
[32m[I 2022-12-30 07:08:44,121][0m Trial 292 finished with value: 0.32268491913409875 and parameters: {'hidden_size': 512, 'activation1': 'tanh', 'activation2': 'tanh', 'dropout': 0.1, 'lr': 0.001, 'weight_decay': 3e-05, 'opt': 'RMSprop'}. Best is trial 291 with value: 0.324002965992213.[0m
[32m[I 2022-12-30 07:08:52,091][0m Trial 293 finished with value: 0.302204651377662 and parameters: {'hidden_size': 512, 'activation1': 'tanh', 'activation2': 'tanh', 'dropout': 0.1, 'lr': 0.001, 'weight_decay': 3e-05, 'opt': 'SGD'}. Best is trial 291 with value: 0.324002965992213.[0m
[32m[I 2022-12-30 07:09:00,897][0m Trial 294 finished with value: 0.3226907557572406 and parameters: {'hidden_size': 512, 'activation1': 'tanh', 'activation2': 'tanh', 'dropout': 0.1, 'lr': 0.001, 'weight_decay': 3e-05, 'opt': 'RMSprop'}. Best is trial 291 with value: 0.324002965992213.[0m
