[32m[I 2022-12-30 09:18:57,579][0m Trial 1114 finished with value: 0.3251352462250555 and parameters: {'hidden_size': 512, 'activation1': 'tanh', 'activation2': 'tanh', 'dropout': 0.1, 'lr': 0.01, 'weight_decay': 1e-05, 'opt': 'Adam'}. Best is trial 722 with value: 0.32671537835324177.[0m
[32m[I 2022-12-30 09:19:07,921][0m Trial 1115 finished with value: 0.24145387914789734 and parameters: {'hidden_size': 256, 'activation1': 'tanh', 'activation2': 'sigmoid', 'dropout': 0.05, 'lr': 0.01, 'weight_decay': 1e-05, 'opt': 'Adam'}. Best is trial 722 with value: 0.32671537835324177.[0m
[32m[I 2022-12-30 09:19:18,701][0m Trial 1116 finished with value: 0.3247306022607812 and parameters: {'hidden_size': 512, 'activation1': 'tanh', 'activation2': 'tanh', 'dropout': 0.1, 'lr': 0.01, 'weight_decay': 1e-05, 'opt': 'Adam'}. Best is trial 722 with value: 0.32671537835324177.[0m
[32m[I 2022-12-30 09:19:29,573][0m Trial 1117 finished with value: 0.3249760092404551 and parameters: {'hidden_size': 512, 'activation1': 'tanh', 'activation2': 'tanh', 'dropout': 0.1, 'lr': 0.01, 'weight_decay': 1e-05, 'opt': 'Adam'}. Best is trial 722 with value: 0.32671537835324177.[0m
[32m[I 2022-12-30 09:19:39,721][0m Trial 1118 finished with value: 0.32083541682924394 and parameters: {'hidden_size': 512, 'activation1': 'tanh', 'activation2': 'tanh', 'dropout': 0.1, 'lr': 0.01, 'weight_decay': 1e-05, 'opt': 'Adam'}. Best is trial 722 with value: 0.32671537835324177.[0m
[32m[I 2022-12-30 09:19:50,222][0m Trial 1119 finished with value: 0.32079537917994844 and parameters: {'hidden_size': 512, 'activation1': 'tanh', 'activation2': 'tanh', 'dropout': 0.1, 'lr': 0.01, 'weight_decay': 1e-05, 'opt': 'Adam'}. Best is trial 722 with value: 0.32671537835324177.[0m
[32m[I 2022-12-30 09:20:01,249][0m Trial 1120 finished with value: 0.3246962204197482 and parameters: {'hidden_size': 512, 'activation1': 'tanh', 'activation2': 'tanh', 'dropout': 0.1, 'lr': 0.01, 'weight_decay': 1e-05, 'opt': 'Adam'}. Best is trial 722 with value: 0.32671537835324177.[0m
[32m[I 2022-12-30 09:20:11,951][0m Trial 1121 finished with value: 0.32333415038638724 and parameters: {'hidden_size': 512, 'activation1': 'tanh', 'activation2': 'tanh', 'dropout': 0.1, 'lr': 0.01, 'weight_decay': 1e-05, 'opt': 'Adam'}. Best is trial 722 with value: 0.32671537835324177.[0m
[32m[I 2022-12-30 09:20:22,832][0m Trial 1122 finished with value: 0.3246602541199077 and parameters: {'hidden_size': 512, 'activation1': 'tanh', 'activation2': 'tanh', 'dropout': 0.1, 'lr': 0.01, 'weight_decay': 1e-05, 'opt': 'Adam'}. Best is trial 722 with value: 0.32671537835324177.[0m
[32m[I 2022-12-30 09:20:33,406][0m Trial 1123 finished with value: 0.3234171399790605 and parameters: {'hidden_size': 512, 'activation1': 'tanh', 'activation2': 'tanh', 'dropout': 0.1, 'lr': 0.01, 'weight_decay': 1e-05, 'opt': 'Adam'}. Best is trial 722 with value: 0.32671537835324177.[0m
[32m[I 2022-12-30 09:20:44,444][0m Trial 1124 finished with value: 0.2808482328630303 and parameters: {'hidden_size': 512, 'activation1': 'sigmoid', 'activation2': 'tanh', 'dropout': 0.1, 'lr': 0.01, 'weight_decay': 1e-05, 'opt': 'Adam'}. Best is trial 722 with value: 0.32671537835324177.[0m
[32m[I 2022-12-30 09:20:54,741][0m Trial 1125 finished with value: 0.3227002559479377 and parameters: {'hidden_size': 512, 'activation1': 'tanh', 'activation2': 'tanh', 'dropout': 0.1, 'lr': 0.01, 'weight_decay': 1e-05, 'opt': 'Adam'}. Best is trial 722 with value: 0.32671537835324177.[0m
[32m[I 2022-12-30 09:21:05,097][0m Trial 1126 finished with value: 0.2462235958054916 and parameters: {'hidden_size': 512, 'activation1': 'tanh', 'activation2': 'relu', 'dropout': 0.1, 'lr': 0.01, 'weight_decay': 1e-05, 'opt': 'Adam'}. Best is trial 722 with value: 0.32671537835324177.[0m
[32m[I 2022-12-30 09:21:15,765][0m Trial 1127 finished with value: 0.3238810691136022 and parameters: {'hidden_size': 512, 'activation1': 'tanh', 'activation2': 'tanh', 'dropout': 0.1, 'lr': 0.01, 'weight_decay': 1e-05, 'opt': 'Adam'}. Best is trial 722 with value: 0.32671537835324177.[0m
[32m[I 2022-12-30 09:21:26,838][0m Trial 1128 finished with value: 0.3231393360094167 and parameters: {'hidden_size': 512, 'activation1': 'tanh', 'activation2': 'tanh', 'dropout': 0.1, 'lr': 0.01, 'weight_decay': 1e-05, 'opt': 'Adam'}. Best is trial 722 with value: 0.32671537835324177.[0m
[32m[I 2022-12-30 09:21:37,326][0m Trial 1129 finished with value: 0.3018690514420085 and parameters: {'hidden_size': 1024, 'activation1': 'tanh', 'activation2': 'tanh', 'dropout': 0.1, 'lr': 0.01, 'weight_decay': 1e-05, 'opt': 'Adam'}. Best is trial 722 with value: 0.32671537835324177.[0m
[32m[I 2022-12-30 09:21:47,633][0m Trial 1130 finished with value: 0.3217003022967197 and parameters: {'hidden_size': 512, 'activation1': 'tanh', 'activation2': 'tanh', 'dropout': 0.2, 'lr': 0.01, 'weight_decay': 1e-05, 'opt': 'Adam'}. Best is trial 722 with value: 0.32671537835324177.[0m
[32m[I 2022-12-30 09:21:57,863][0m Trial 1131 finished with value: 0.32417668073607836 and parameters: {'hidden_size': 512, 'activation1': 'tanh', 'activation2': 'tanh', 'dropout': 0.1, 'lr': 0.01, 'weight_decay': 1e-05, 'opt': 'Adam'}. Best is trial 722 with value: 0.32671537835324177.[0m
[32m[I 2022-12-30 09:22:08,307][0m Trial 1132 finished with value: 0.3168024728316371 and parameters: {'hidden_size': 512, 'activation1': 'tanh', 'activation2': 'tanh', 'dropout': 0.1, 'lr': 0.003, 'weight_decay': 1e-05, 'opt': 'Adam'}. Best is trial 722 with value: 0.32671537835324177.[0m
[32m[I 2022-12-30 09:22:19,260][0m Trial 1133 finished with value: 0.3263109785403392 and parameters: {'hidden_size': 512, 'activation1': 'tanh', 'activation2': 'tanh', 'dropout': 0.1, 'lr': 0.01, 'weight_decay': 1e-05, 'opt': 'Adam'}. Best is trial 722 with value: 0.32671537835324177.[0m
[32m[I 2022-12-30 09:22:29,599][0m Trial 1134 finished with value: 0.3231142898103921 and parameters: {'hidden_size': 512, 'activation1': 'tanh', 'activation2': 'tanh', 'dropout': 0.1, 'lr': 0.01, 'weight_decay': 1e-05, 'opt': 'Adam'}. Best is trial 722 with value: 0.32671537835324177.[0m
[32m[I 2022-12-30 09:22:40,429][0m Trial 1135 finished with value: 0.29374820500977367 and parameters: {'hidden_size': 512, 'activation1': 'relu', 'activation2': 'tanh', 'dropout': 0.1, 'lr': 0.01, 'weight_decay': 1e-05, 'opt': 'Adam'}. Best is trial 722 with value: 0.32671537835324177.[0m
[32m[I 2022-12-30 09:22:50,685][0m Trial 1136 finished with value: 0.32296958355110406 and parameters: {'hidden_size': 512, 'activation1': 'tanh', 'activation2': 'tanh', 'dropout': 0.1, 'lr': 0.01, 'weight_decay': 1e-05, 'opt': 'Adam'}. Best is trial 722 with value: 0.32671537835324177.[0m
[32m[I 2022-12-30 09:23:01,699][0m Trial 1137 finished with value: 0.3070684727994764 and parameters: {'hidden_size': 128, 'activation1': 'tanh', 'activation2': 'tanh', 'dropout': 0.1, 'lr': 0.01, 'weight_decay': 1e-05, 'opt': 'Adam'}. Best is trial 722 with value: 0.32671537835324177.[0m
[32m[I 2022-12-30 09:23:11,938][0m Trial 1138 finished with value: 0.2442910851027551 and parameters: {'hidden_size': 512, 'activation1': 'tanh', 'activation2': 'sigmoid', 'dropout': 0.05, 'lr': 0.01, 'weight_decay': 1e-05, 'opt': 'Adam'}. Best is trial 722 with value: 0.32671537835324177.[0m
[32m[I 2022-12-30 09:23:22,086][0m Trial 1139 finished with value: 0.3113965620189974 and parameters: {'hidden_size': 256, 'activation1': 'tanh', 'activation2': 'tanh', 'dropout': 0.1, 'lr': 0.01, 'weight_decay': 1e-05, 'opt': 'Adam'}. Best is trial 722 with value: 0.32671537835324177.[0m
[32m[I 2022-12-30 09:23:32,341][0m Trial 1140 finished with value: 0.3242033213043265 and parameters: {'hidden_size': 512, 'activation1': 'tanh', 'activation2': 'tanh', 'dropout': 0.1, 'lr': 0.01, 'weight_decay': 1e-05, 'opt': 'Adam'}. Best is trial 722 with value: 0.32671537835324177.[0m
[32m[I 2022-12-30 09:23:39,970][0m Trial 1141 finished with value: 0.029858179004556916 and parameters: {'hidden_size': 512, 'activation1': 'tanh', 'activation2': 'tanh', 'dropout': 0.1, 'lr': 0.01, 'weight_decay': 1e-05, 'opt': 'SGD'}. Best is trial 722 with value: 0.32671537835324177.[0m
[32m[I 2022-12-30 09:23:50,338][0m Trial 1142 finished with value: 0.3210309547450601 and parameters: {'hidden_size': 512, 'activation1': 'tanh', 'activation2': 'tanh', 'dropout': 0.1, 'lr': 0.01, 'weight_decay': 1e-05, 'opt': 'Adam'}. Best is trial 722 with value: 0.32671537835324177.[0m
[32m[I 2022-12-30 09:24:00,467][0m Trial 1143 finished with value: 0.3222654403964073 and parameters: {'hidden_size': 512, 'activation1': 'tanh', 'activation2': 'tanh', 'dropout': 0.1, 'lr': 0.01, 'weight_decay': 1e-05, 'opt': 'Adam'}. Best is trial 722 with value: 0.32671537835324177.[0m
[32m[I 2022-12-30 09:24:10,815][0m Trial 1144 finished with value: 0.3238967969512701 and parameters: {'hidden_size': 512, 'activation1': 'tanh', 'activation2': 'tanh', 'dropout': 0.1, 'lr': 0.01, 'weight_decay': 1e-05, 'opt': 'Adam'}. Best is trial 722 with value: 0.32671537835324177.[0m
[32m[I 2022-12-30 09:24:21,040][0m Trial 1145 finished with value: 0.32344280450328144 and parameters: {'hidden_size': 512, 'activation1': 'tanh', 'activation2': 'tanh', 'dropout': 0.1, 'lr': 0.01, 'weight_decay': 1e-05, 'opt': 'Adam'}. Best is trial 722 with value: 0.32671537835324177.[0m
[32m[I 2022-12-30 09:24:31,635][0m Trial 1146 finished with value: 0.27538239104604634 and parameters: {'hidden_size': 512, 'activation1': 'sigmoid', 'activation2': 'tanh', 'dropout': 0.1, 'lr': 0.01, 'weight_decay': 1e-05, 'opt': 'Adam'}. Best is trial 722 with value: 0.32671537835324177.[0m
[32m[I 2022-12-30 09:24:42,181][0m Trial 1147 finished with value: 0.322068009631284 and parameters: {'hidden_size': 512, 'activation1': 'tanh', 'activation2': 'tanh', 'dropout': 0.1, 'lr': 0.01, 'weight_decay': 1e-05, 'opt': 'Adam'}. Best is trial 722 with value: 0.32671537835324177.[0m
[32m[I 2022-12-30 09:24:52,506][0m Trial 1148 finished with value: 0.32047490100599685 and parameters: {'hidden_size': 512, 'activation1': 'tanh', 'activation2': 'tanh', 'dropout': 0.1, 'lr': 0.01, 'weight_decay': 1e-05, 'opt': 'Adam'}. Best is trial 722 with value: 0.32671537835324177.[0m
[32m[I 2022-12-30 09:25:02,936][0m Trial 1149 finished with value: 0.24580500329737812 and parameters: {'hidden_size': 512, 'activation1': 'tanh', 'activation2': 'relu', 'dropout': 0.1, 'lr': 0.01, 'weight_decay': 1e-05, 'opt': 'Adam'}. Best is trial 722 with value: 0.32671537835324177.[0m
[32m[I 2022-12-30 09:25:13,401][0m Trial 1150 finished with value: 0.3252605837671444 and parameters: {'hidden_size': 512, 'activation1': 'tanh', 'activation2': 'tanh', 'dropout': 0.1, 'lr': 0.01, 'weight_decay': 1e-05, 'opt': 'Adam'}. Best is trial 722 with value: 0.32671537835324177.[0m
[32m[I 2022-12-30 09:25:23,774][0m Trial 1151 finished with value: 0.32417704370744194 and parameters: {'hidden_size': 512, 'activation1': 'tanh', 'activation2': 'tanh', 'dropout': 0.1, 'lr': 0.01, 'weight_decay': 1e-05, 'opt': 'Adam'}. Best is trial 722 with value: 0.32671537835324177.[0m
[32m[I 2022-12-30 09:25:34,083][0m Trial 1152 finished with value: 0.32384720925934685 and parameters: {'hidden_size': 512, 'activation1': 'tanh', 'activation2': 'tanh', 'dropout': 0.1, 'lr': 0.01, 'weight_decay': 1e-05, 'opt': 'Adam'}. Best is trial 722 with value: 0.32671537835324177.[0m
[32m[I 2022-12-30 09:25:44,358][0m Trial 1153 finished with value: 0.3236396853294482 and parameters: {'hidden_size': 512, 'activation1': 'tanh', 'activation2': 'tanh', 'dropout': 0.1, 'lr': 0.01, 'weight_decay': 1e-05, 'opt': 'Adam'}. Best is trial 722 with value: 0.32671537835324177.[0m
[32m[I 2022-12-30 09:25:54,726][0m Trial 1154 finished with value: 0.3140915678541353 and parameters: {'hidden_size': 1024, 'activation1': 'tanh', 'activation2': 'tanh', 'dropout': 0.2, 'lr': 0.003, 'weight_decay': 1e-05, 'opt': 'Adam'}. Best is trial 722 with value: 0.32671537835324177.[0m
[32m[I 2022-12-30 09:26:05,187][0m Trial 1155 finished with value: 0.32329496764977284 and parameters: {'hidden_size': 512, 'activation1': 'tanh', 'activation2': 'tanh', 'dropout': 0.1, 'lr': 0.01, 'weight_decay': 1e-05, 'opt': 'Adam'}. Best is trial 722 with value: 0.32671537835324177.[0m
[32m[I 2022-12-30 09:26:15,661][0m Trial 1156 finished with value: 0.3239070437947838 and parameters: {'hidden_size': 512, 'activation1': 'tanh', 'activation2': 'tanh', 'dropout': 0.1, 'lr': 0.01, 'weight_decay': 1e-05, 'opt': 'Adam'}. Best is trial 722 with value: 0.32671537835324177.[0m
[32m[I 2022-12-30 09:26:26,643][0m Trial 1157 finished with value: 0.32196401976880296 and parameters: {'hidden_size': 512, 'activation1': 'tanh', 'activation2': 'tanh', 'dropout': 0.1, 'lr': 0.01, 'weight_decay': 1e-05, 'opt': 'Adam'}. Best is trial 722 with value: 0.32671537835324177.[0m
[32m[I 2022-12-30 09:26:36,850][0m Trial 1158 finished with value: 0.3232045024120172 and parameters: {'hidden_size': 512, 'activation1': 'tanh', 'activation2': 'tanh', 'dropout': 0.1, 'lr': 0.01, 'weight_decay': 1e-05, 'opt': 'Adam'}. Best is trial 722 with value: 0.32671537835324177.[0m
[32m[I 2022-12-30 09:26:47,482][0m Trial 1159 finished with value: 0.24695885753205368 and parameters: {'hidden_size': 512, 'activation1': 'tanh', 'activation2': 'sigmoid', 'dropout': 0.1, 'lr': 0.01, 'weight_decay': 1e-05, 'opt': 'Adam'}. Best is trial 722 with value: 0.32671537835324177.[0m
[32m[I 2022-12-30 09:26:57,913][0m Trial 1160 finished with value: 0.2989769260222861 and parameters: {'hidden_size': 512, 'activation1': 'relu', 'activation2': 'tanh', 'dropout': 0.1, 'lr': 0.01, 'weight_decay': 1e-05, 'opt': 'Adam'}. Best is trial 722 with value: 0.32671537835324177.[0m
[32m[I 2022-12-30 09:27:08,239][0m Trial 1161 finished with value: 0.32439042369795495 and parameters: {'hidden_size': 512, 'activation1': 'tanh', 'activation2': 'tanh', 'dropout': 0.05, 'lr': 0.01, 'weight_decay': 1e-05, 'opt': 'Adam'}. Best is trial 722 with value: 0.32671537835324177.[0m
[32m[I 2022-12-30 09:27:16,004][0m Trial 1162 finished with value: 0.05445276735669937 and parameters: {'hidden_size': 512, 'activation1': 'tanh', 'activation2': 'tanh', 'dropout': 0.1, 'lr': 0.01, 'weight_decay': 1e-05, 'opt': 'SGD'}. Best is trial 722 with value: 0.32671537835324177.[0m
[32m[I 2022-12-30 09:27:26,165][0m Trial 1163 finished with value: 0.31123378323322815 and parameters: {'hidden_size': 256, 'activation1': 'tanh', 'activation2': 'tanh', 'dropout': 0.1, 'lr': 0.01, 'weight_decay': 1e-05, 'opt': 'Adam'}. Best is trial 722 with value: 0.32671537835324177.[0m
[32m[I 2022-12-30 09:27:36,208][0m Trial 1164 finished with value: 0.32236885351316036 and parameters: {'hidden_size': 512, 'activation1': 'tanh', 'activation2': 'tanh', 'dropout': 0.1, 'lr': 0.01, 'weight_decay': 1e-05, 'opt': 'Adam'}. Best is trial 722 with value: 0.32671537835324177.[0m
[32m[I 2022-12-30 09:27:46,461][0m Trial 1165 finished with value: 0.32257036809280565 and parameters: {'hidden_size': 512, 'activation1': 'tanh', 'activation2': 'tanh', 'dropout': 0.1, 'lr': 0.01, 'weight_decay': 1e-05, 'opt': 'Adam'}. Best is trial 722 with value: 0.32671537835324177.[0m
[32m[I 2022-12-30 09:27:56,658][0m Trial 1166 finished with value: 0.30874615691395907 and parameters: {'hidden_size': 128, 'activation1': 'tanh', 'activation2': 'tanh', 'dropout': 0.1, 'lr': 0.01, 'weight_decay': 1e-05, 'opt': 'Adam'}. Best is trial 722 with value: 0.32671537835324177.[0m
[32m[I 2022-12-30 09:28:07,101][0m Trial 1167 finished with value: 0.3232487690272641 and parameters: {'hidden_size': 512, 'activation1': 'tanh', 'activation2': 'tanh', 'dropout': 0.1, 'lr': 0.01, 'weight_decay': 1e-05, 'opt': 'Adam'}. Best is trial 722 with value: 0.32671537835324177.[0m
[32m[I 2022-12-30 09:28:18,944][0m Trial 1168 finished with value: 0.32295721060245014 and parameters: {'hidden_size': 512, 'activation1': 'tanh', 'activation2': 'tanh', 'dropout': 0.1, 'lr': 0.01, 'weight_decay': 1e-05, 'opt': 'Adam'}. Best is trial 722 with value: 0.32671537835324177.[0m
[32m[I 2022-12-30 09:28:29,578][0m Trial 1169 finished with value: 0.2771852646669167 and parameters: {'hidden_size': 512, 'activation1': 'sigmoid', 'activation2': 'tanh', 'dropout': 0.1, 'lr': 0.01, 'weight_decay': 1e-05, 'opt': 'Adam'}. Best is trial 722 with value: 0.32671537835324177.[0m
[32m[I 2022-12-30 09:28:40,549][0m Trial 1170 finished with value: 0.2522935921188215 and parameters: {'hidden_size': 512, 'activation1': 'tanh', 'activation2': 'relu', 'dropout': 0.1, 'lr': 0.01, 'weight_decay': 1e-05, 'opt': 'Adam'}. Best is trial 722 with value: 0.32671537835324177.[0m
[32m[I 2022-12-30 09:28:52,555][0m Trial 1171 finished with value: 0.3213612202005908 and parameters: {'hidden_size': 512, 'activation1': 'tanh', 'activation2': 'tanh', 'dropout': 0.1, 'lr': 0.01, 'weight_decay': 1e-05, 'opt': 'Adam'}. Best is trial 722 with value: 0.32671537835324177.[0m
[32m[I 2022-12-30 09:29:06,813][0m Trial 1172 finished with value: 0.3238091838517716 and parameters: {'hidden_size': 512, 'activation1': 'tanh', 'activation2': 'tanh', 'dropout': 0.1, 'lr': 0.01, 'weight_decay': 1e-05, 'opt': 'Adam'}. Best is trial 722 with value: 0.32671537835324177.[0m
[32m[I 2022-12-30 09:29:20,205][0m Trial 1173 finished with value: 0.3233767680343492 and parameters: {'hidden_size': 512, 'activation1': 'tanh', 'activation2': 'tanh', 'dropout': 0.1, 'lr': 0.01, 'weight_decay': 1e-05, 'opt': 'Adam'}. Best is trial 722 with value: 0.32671537835324177.[0m
[32m[I 2022-12-30 09:29:33,632][0m Trial 1174 finished with value: 0.3261558468696361 and parameters: {'hidden_size': 512, 'activation1': 'tanh', 'activation2': 'tanh', 'dropout': 0.1, 'lr': 0.01, 'weight_decay': 1e-05, 'opt': 'Adam'}. Best is trial 722 with value: 0.32671537835324177.[0m
[32m[I 2022-12-30 09:29:46,623][0m Trial 1175 finished with value: 0.3236289370822779 and parameters: {'hidden_size': 512, 'activation1': 'tanh', 'activation2': 'tanh', 'dropout': 0.1, 'lr': 0.01, 'weight_decay': 1e-05, 'opt': 'Adam'}. Best is trial 722 with value: 0.32671537835324177.[0m
[32m[I 2022-12-30 09:29:58,796][0m Trial 1176 finished with value: 0.3203519543829504 and parameters: {'hidden_size': 512, 'activation1': 'tanh', 'activation2': 'tanh', 'dropout': 0.1, 'lr': 0.01, 'weight_decay': 1e-05, 'opt': 'Adam'}. Best is trial 722 with value: 0.32671537835324177.[0m
[32m[I 2022-12-30 09:30:11,991][0m Trial 1177 finished with value: 0.31516747277726237 and parameters: {'hidden_size': 1024, 'activation1': 'tanh', 'activation2': 'tanh', 'dropout': 0.1, 'lr': 0.003, 'weight_decay': 1e-05, 'opt': 'Adam'}. Best is trial 722 with value: 0.32671537835324177.[0m
[32m[I 2022-12-30 09:30:23,191][0m Trial 1178 finished with value: 0.32143155258871775 and parameters: {'hidden_size': 512, 'activation1': 'tanh', 'activation2': 'tanh', 'dropout': 0.2, 'lr': 0.01, 'weight_decay': 1e-05, 'opt': 'Adam'}. Best is trial 722 with value: 0.32671537835324177.[0m
[32m[I 2022-12-30 09:30:35,637][0m Trial 1179 finished with value: 0.3226565182739292 and parameters: {'hidden_size': 512, 'activation1': 'tanh', 'activation2': 'tanh', 'dropout': 0.1, 'lr': 0.01, 'weight_decay': 1e-05, 'opt': 'Adam'}. Best is trial 722 with value: 0.32671537835324177.[0m
[32m[I 2022-12-30 09:30:48,650][0m Trial 1180 finished with value: 0.32225807591055133 and parameters: {'hidden_size': 512, 'activation1': 'tanh', 'activation2': 'tanh', 'dropout': 0.1, 'lr': 0.01, 'weight_decay': 1e-05, 'opt': 'Adam'}. Best is trial 722 with value: 0.32671537835324177.[0m
[32m[I 2022-12-30 09:31:00,933][0m Trial 1181 finished with value: 0.2909820210110738 and parameters: {'hidden_size': 512, 'activation1': 'relu', 'activation2': 'sigmoid', 'dropout': 0.1, 'lr': 0.01, 'weight_decay': 1e-05, 'opt': 'Adam'}. Best is trial 722 with value: 0.32671537835324177.[0m
[32m[I 2022-12-30 09:31:13,392][0m Trial 1182 finished with value: 0.3232789573291147 and parameters: {'hidden_size': 512, 'activation1': 'tanh', 'activation2': 'tanh', 'dropout': 0.1, 'lr': 0.01, 'weight_decay': 1e-05, 'opt': 'Adam'}. Best is trial 722 with value: 0.32671537835324177.[0m
[32m[I 2022-12-30 09:31:22,700][0m Trial 1183 finished with value: 0.027024684924366226 and parameters: {'hidden_size': 512, 'activation1': 'tanh', 'activation2': 'tanh', 'dropout': 0.1, 'lr': 0.01, 'weight_decay': 1e-05, 'opt': 'SGD'}. Best is trial 722 with value: 0.32671537835324177.[0m
[32m[I 2022-12-30 09:31:34,027][0m Trial 1184 finished with value: 0.32562737320874335 and parameters: {'hidden_size': 512, 'activation1': 'tanh', 'activation2': 'tanh', 'dropout': 0.05, 'lr': 0.01, 'weight_decay': 1e-05, 'opt': 'Adam'}. Best is trial 722 with value: 0.32671537835324177.[0m
[32m[I 2022-12-30 09:31:44,571][0m Trial 1185 finished with value: 0.3233116345824153 and parameters: {'hidden_size': 512, 'activation1': 'tanh', 'activation2': 'tanh', 'dropout': 0.05, 'lr': 0.01, 'weight_decay': 1e-05, 'opt': 'Adam'}. Best is trial 722 with value: 0.32671537835324177.[0m
[32m[I 2022-12-30 09:31:55,016][0m Trial 1186 finished with value: 0.3041591886355645 and parameters: {'hidden_size': 128, 'activation1': 'tanh', 'activation2': 'tanh', 'dropout': 0.05, 'lr': 0.01, 'weight_decay': 1e-05, 'opt': 'Adam'}. Best is trial 722 with value: 0.32671537835324177.[0m
[32m[I 2022-12-30 09:32:05,324][0m Trial 1187 finished with value: 0.3240823407196494 and parameters: {'hidden_size': 512, 'activation1': 'tanh', 'activation2': 'tanh', 'dropout': 0.05, 'lr': 0.01, 'weight_decay': 1e-05, 'opt': 'Adam'}. Best is trial 722 with value: 0.32671537835324177.[0m
